{"success": true, "transactions": [{"date": "01/07/25", "date_iso": "2025-01-07", "description": "UPI-IRCTCUTS-PAYTM-8796946@PTYBL-YESB0P TMUPI-107325611537-UPI", "raw": "UPI-IRCTCUTS-PAYTM-8796946@PTYBL-YESB0P TMUPI-107325611537-UPI", "amount": 10.0, "type": "expense", "debit": 10.0, "credit": 0.0, "balance": 902.92, "page": "Page 1", "line": "24", "store": null, "commodity": null, "reference": "0000107325611537", "upi_id": "IRCTCUTS", "bankCode": "HDFC", "ifsc": null, "transaction_id": null}, {"date": "01/07/25", "date_iso": "2025-01-07", "description": "UPI-AYUSHIKANSINGH CHAU-AYUSHICHAUHAN00 7007@OKSBI-BCBM0000006-518254577154-UPI", "raw": "UPI-AYUSHIKANSINGH CHAU-AYUSHICHAUHAN00 7007@OKSBI-BCBM0000006-518254577154-UPI", "amount": 2000.0, "type": "income", "debit": 0.0, "credit": 2000.0, "balance": 2902.92, "page": "Page 1", "line": "27", "store": null, "commodity": null, "reference": "0000518254577154", "upi_id": "AYUSHIKANSINGH", "bankCode": "HDFC", "ifsc": "BCBM0000006", "transaction_id": null}, {"date": "01/07/25", "date_iso": "2025-01-07", "description": "UPI-BANKARMAYUR MACHIND-PAYTMQR5VTD57@P TYS-YESB0PTMUPI-107330855796-UPI", "raw": "UPI-BANKARMAYUR MACHIND-PAYTMQR5VTD57@P TYS-YESB0PTMUPI-107330855796-UPI", "amount": 2000.0, "type": "expense", "debit": 2000.0, "credit": 0.0, "balance": 902.92, "page": "Page 1", "line": "30", "store": null, "commodity": null, "reference": "0000107330855796", "upi_id": "BANKARMAYUR", "bankCode": "HDFC", "ifsc": "YESB0PTMUPI", "transaction_id": null}, {"date": "01/07/25", "date_iso": "2025-01-07", "description": "UPI-AYUSHIKANSINGH CHAU-AYUSHICHAUHAN00 7007@OKSBI-BCBM0000006-107353297221-UPI", "raw": "UPI-AYUSHIKANSINGH CHAU-AYUSHICHAUHAN00 7007@OKSBI-BCBM0000006-107353297221-UPI", "amount": 40.0, "type": "expense", "debit": 40.0, "credit": 0.0, "balance": 862.92, "page": "Page 1", "line": "33", "store": null, "commodity": null, "reference": "0000107353297221", "upi_id": "AYUSHIKANSINGH", "bankCode": "HDFC", "ifsc": "BCBM0000006", "transaction_id": null}, {"date": "01/07/25", "date_iso": "2025-01-07", "description": "UPI-BIPINKUMARKEDARNAT-SINGHBIPIN22590 @OKSBI-SBIN0005354-107357658045-UPI", "raw": "UPI-BIPINKUMARKEDARNAT-SINGHBIPIN22590 @OKSBI-SBIN0005354-107357658045-UPI", "amount": 15.0, "type": "expense", "debit": 15.0, "credit": 0.0, "balance": 847.92, "page": "Page 1", "line": "35", "store": null, "commodity": null, "reference": "0000107357658045", "upi_id": "BIPINKUMARKEDARNAT", "bankCode": "HDFC", "ifsc": "SBIN0005354", "transaction_id": null}, {"date": "02/07/25", "date_iso": "2025-02-07", "description": "UPI-KIRAN GUPTA-PAYTM.S1HN1PV@PTY-YESB0M CHUPI-107419809985-UPI", "raw": "UPI-KIRAN GUPTA-PAYTM.S1HN1PV@PTY-YESB0M CHUPI-107419809985-UPI", "amount": 30.0, "type": "expense", "debit": 30.0, "credit": 0.0, "balance": 817.92, "page": "Page 1", "line": "38", "store": null, "commodity": null, "reference": "0000107419809985", "upi_id": "KIRAN", "bankCode": "HDFC", "ifsc": null, "transaction_id": null}, {"date": "02/07/25", "date_iso": "2025-02-07", "description": "UPI-SONAMANIL GUPTA-PAYTM.S1CCW47@PTY-Y ESB0MCHUPI-107419997623-UPI", "raw": "UPI-SONAMANIL GUPTA-PAYTM.S1CCW47@PTY-Y ESB0MCHUPI-107419997623-UPI", "amount": 20.0, "type": "expense", "debit": 20.0, "credit": 0.0, "balance": 797.92, "page": "Page 1", "line": "41", "store": null, "commodity": null, "reference": "0000107419997623", "upi_id": "SONAMANIL", "bankCode": "HDFC", "ifsc": null, "transaction_id": null}, {"date": "02/07/25", "date_iso": "2025-02-07", "description": "UPI-GUPTARAJKUMAR RAMB-PAYTMQR66DOIB@PT YS-YESB0PTMUPI-107420197787-UPI", "raw": "UPI-GUPTARAJKUMAR RAMB-PAYTMQR66DOIB@PT YS-YESB0PTMUPI-107420197787-UPI", "amount": 30.0, "type": "expense", "debit": 30.0, "credit": 0.0, "balance": 767.92, "page": "Page 1", "line": "44", "store": null, "commodity": null, "reference": "0000107420197787", "upi_id": "GUPTARAJKUMAR", "bankCode": "HDFC", "ifsc": "YESB0PTMUPI", "transaction_id": null}, {"date": "02/07/25", "date_iso": "2025-02-07", "description": "UPI-SHAKUNTALADEVI BABL-PAYTM.S16IECC@P TY-YESB0MCHUPI-107420794658-UPI", "raw": "UPI-SHAKUNTALADEVI BABL-PAYTM.S16IECC@P TY-YESB0MCHUPI-107420794658-UPI", "amount": 20.0, "type": "expense", "debit": 20.0, "credit": 0.0, "balance": 747.92, "page": "Page 1", "line": "47", "store": null, "commodity": null, "reference": "0000107420794658", "upi_id": "SHAKUNTALADEVI", "bankCode": "HDFC", "ifsc": "YESB0MCHUPI", "transaction_id": null}, {"date": "03/07/25", "date_iso": "2025-03-07", "description": "UPI-SHIVSHANKERRAJESH-BHARATPE.9A0Z0B 0B0P354295@UNITYPE-UNBA000BHPE-107477340 570-PAYTOBHARATPEME", "raw": "UPI-SHIVSHANKERRAJESH-BHARATPE.9A0Z0B 0B0P354295@UNITYPE-UNBA000BHPE-107477340 570-PAYTOBHARATPEME", "amount": 40.0, "type": "expense", "debit": 40.0, "credit": 0.0, "balance": 707.92, "page": "Page 1", "line": "50", "store": null, "commodity": null, "reference": "0000107477340570", "upi_id": "SHIVSHANKERRAJESH", "bankCode": "HDFC", "ifsc": "UNBA000BHPE", "transaction_id": null}, {"date": "03/07/25", "date_iso": "2025-03-07", "description": "UPI-IMTIYAJ IMTIYAJ-IMTIYAZSAYYED6268@O KICICI-SBIN0014771-107479151918-UPI *Closingbalanceincludesfundsearmarkedforholdandunclearedfunds Contentsofthisstatementwillbeconsideredcorrectifnoerrorisreportedwithin30daysofreceiptofstatement.TheaddressonthisstatementisthatonrecordwiththeBankasatthedayofrequesting thisstatement. StateaccountbranchGSTN:27AAACH2702H1Z0 HDFCBankGSTINnumberdetailsareavailableathttps://www.hdfcbank.com/personal/making-payments/online-tax-payment/goods-and-service-tax. RegisteredOfficeAddress:HDFCBankHouse,SenapatiBapatMarg,LowerParel,Mumbai400013", "raw": "UPI-IMTIYAJ IMTIYAJ-IMTIYAZSAYYED6268@O KICICI-SBIN0014771-107479151918-UPI *Closingbalanceincludesfundsearmarkedforholdandunclearedfunds Contentsofthisstatementwillbeconsideredcorrectifnoerrorisreportedwithin30daysofreceiptofstatement.TheaddressonthisstatementisthatonrecordwiththeBankasatthedayofrequesting thisstatement. StateaccountbranchGSTN:27AAACH2702H1Z0 HDFCBankGSTINnumberdetailsareavailableathttps://www.hdfcbank.com/personal/making-payments/online-tax-payment/goods-and-service-tax. RegisteredOfficeAddress:HDFCBankHouse,SenapatiBapatMarg,LowerParel,Mumbai400013", "amount": 100.0, "type": "expense", "debit": 100.0, "credit": 0.0, "balance": 607.92, "page": "Page 1", "line": "59", "store": null, "commodity": null, "reference": "0000107479151918", "upi_id": "IMTIYAJ", "bankCode": "HDFC", "ifsc": "SBIN0014771", "transaction_id": null}, {"date": "04/07/25", "date_iso": "2025-04-07", "description": "UPI-MRVISHNU MUNSHEELAL-VISHUNVISHWAKAR MA90211-2@OKAXIS-IDIB000M764-10754292900 5-UPI", "raw": "UPI-MRVISHNU MUNSHEELAL-VISHUNVISHWAKAR MA90211-2@OKAXIS-IDIB000M764-10754292900 5-UPI", "amount": 2000.0, "type": "expense", "debit": 2000.0, "credit": 0.0, "balance": 18472.28, "page": "Page 2", "line": "44", "store": null, "commodity": null, "reference": "0000107542929005", "upi_id": "MRVISHNU", "bankCode": "HDFC", "ifsc": "IDIB000M764", "transaction_id": null}, {"date": "04/07/25", "date_iso": "2025-04-07", "description": "UPI-AAKASHPAVAN JAISWAL-JAISWALAAKASH99 3-1@OKAXIS-KARB0000520-107542848513-UPI", "raw": "UPI-AAKASHPAVAN JAISWAL-JAISWALAAKASH99 3-1@OKAXIS-KARB0000520-107542848513-UPI", "amount": 1160.0, "type": "expense", "debit": 1160.0, "credit": 0.0, "balance": 20472.28, "page": "Page 2", "line": "40", "store": null, "commodity": null, "reference": "0000107542848513", "upi_id": "AAKASHPAVAN", "bankCode": "HDFC", "ifsc": "KARB0000520", "transaction_id": null}, {"date": "04/07/25", "date_iso": "2025-04-07", "description": "UPI-ZEPTOMARKETPLACEPR-PINELABS.103884 90@HDFCBANK-HDFC0MERUPI-100906930512-PAY MENTFOR500955", "raw": "UPI-ZEPTOMARKETPLACEPR-PINELABS.103884 90@HDFCBANK-HDFC0MERUPI-100906930512-PAY MENTFOR500955", "amount": 14.64, "type": "expense", "debit": 14.64, "credit": 0.0, "balance": 21632.28, "page": "Page 2", "line": "37", "store": null, "commodity": null, "reference": "0000100906930512", "upi_id": "ZEPTOMARKETPLACEPR", "bankCode": "HDFC", "ifsc": "HDFC0MERUPI", "transaction_id": null}, {"date": "04/07/25", "date_iso": "2025-04-07", "description": "UPI-SAYAJITUKARAM CHAVA-PAYTM.S1F8OGW@P TY-YESB0MCHUPI-518567002426-UPI", "raw": "UPI-SAYAJITUKARAM CHAVA-PAYTM.S1F8OGW@P TY-YESB0MCHUPI-518567002426-UPI", "amount": 67.0, "type": "expense", "debit": 67.0, "credit": 0.0, "balance": 21646.92, "page": "Page 2", "line": "34", "store": null, "commodity": null, "reference": "0000518567002426", "upi_id": "SAYAJITUKARAM", "bankCode": "HDFC", "ifsc": "YESB0MCHUPI", "transaction_id": null}, {"date": "04/07/25", "date_iso": "2025-04-07", "description": "UPI-SHIVSHANKERRAJESH-BHARATPE.9A0Z0B 0B0P354295@UNITYPE-UNBA000BHPE-107534625 733-PAYTOBHARATPEME", "raw": "UPI-SHIVSHANKERRAJESH-BHARATPE.9A0Z0B 0B0P354295@UNITYPE-UNBA000BHPE-107534625 733-PAYTOBHARATPEME", "amount": 40.0, "type": "expense", "debit": 40.0, "credit": 0.0, "balance": 21713.92, "page": "Page 2", "line": "31", "store": null, "commodity": null, "reference": "0000107534625733", "upi_id": "SHIVSHANKERRAJESH", "bankCode": "HDFC", "ifsc": "UNBA000BHPE", "transaction_id": null}, {"date": "04/07/25", "date_iso": "2025-04-07", "description": "UPI-SHAKUNTALADEVI BABL-PAYTM.S16IECC@P TY-YESB0MCHUPI-107533887453-UPI", "raw": "UPI-SHAKUNTALADEVI BABL-PAYTM.S16IECC@P TY-YESB0MCHUPI-107533887453-UPI", "amount": 10.0, "type": "expense", "debit": 10.0, "credit": 0.0, "balance": 21753.92, "page": "Page 2", "line": "28", "store": null, "commodity": null, "reference": "0000107533887453", "upi_id": "SHAKUNTALADEVI", "bankCode": "HDFC", "ifsc": "YESB0MCHUPI", "transaction_id": null}, {"date": "04/07/25", "date_iso": "2025-04-07", "description": "UPI-JAIKOTESHWARENTERP-GPAY-1124531407 4@OKBIZAXIS-UTIB0000553-107530798592-UPI", "raw": "UPI-JAIKOTESHWARENTERP-GPAY-1124531407 4@OKBIZAXIS-UTIB0000553-107530798592-UPI", "amount": 110.0, "type": "expense", "debit": 110.0, "credit": 0.0, "balance": 21763.92, "page": "Page 2", "line": "25", "store": null, "commodity": null, "reference": "0000107530798592", "upi_id": "JAIKOTESHWARENTERP", "bankCode": "HDFC", "ifsc": "UTIB0000553", "transaction_id": null}, {"date": "04/07/25", "date_iso": "2025-04-07", "description": "IMPS-518517779104-OPTIMALRESOURCES-KKBK -XXXXXX5974-IB: MAMTASALARY", "raw": "IMPS-518517779104-OPTIMALRESOURCES-KKBK -XXXXXX5974-IB: MAMTASALARY", "amount": 21266.0, "type": "income", "debit": 0.0, "credit": 21266.0, "balance": 21873.92, "page": "Page 2", "line": "23", "store": null, "commodity": null, "reference": "0000518517779104", "upi_id": null, "bankCode": "HDFC", "ifsc": null, "transaction_id": null}, {"date": "05/07/25", "date_iso": "2025-05-07", "description": "UPI-RAJVIKRAM MANDALE-RAJMANDLE444-1@OK HDFCBANK-KKBK0001422-107569626341-UPI", "raw": "UPI-RAJVIKRAM MANDALE-RAJMANDLE444-1@OK HDFCBANK-KKBK0001422-107569626341-UPI", "amount": 270.0, "type": "expense", "debit": 270.0, "credit": 0.0, "balance": 18202.28, "page": "Page 2", "line": "47", "store": null, "commodity": null, "reference": "0000107569626341", "upi_id": "RAJVIKRAM", "bankCode": "HDFC", "ifsc": "KKBK0001422", "transaction_id": null}, {"date": "05/07/25", "date_iso": "2025-05-07", "description": "UPI-MANSISUBHASH MANDAL-MANDALEMANSI44@ OKICICI-KKBK0001400-518611652165-UPI", "raw": "UPI-MANSISUBHASH MANDAL-MANDALEMANSI44@ OKICICI-KKBK0001400-518611652165-UPI", "amount": 270.0, "type": "income", "debit": 0.0, "credit": 270.0, "balance": 18472.28, "page": "Page 2", "line": "50", "store": null, "commodity": null, "reference": "0000518611652165", "upi_id": "MANSISUBHASH", "bankCode": "HDFC", "ifsc": "KKBK0001400", "transaction_id": null}, {"date": "05/07/25", "date_iso": "2025-05-07", "description": "UPI-MRMUNSHEELAL RAMSUR-MUNSHILALVISHWA KARMA210@OKSBI-IDIB000M764-107582668077- *Closingbalanceincludesfundsearmarkedforholdandunclearedfunds Contentsofthisstatementwillbeconsideredcorrectifnoerrorisreportedwithin30daysofreceiptofstatement.TheaddressonthisstatementisthatonrecordwiththeBankasatthedayofrequesting thisstatement. StateaccountbranchGSTN:27AAACH2702H1Z0 HDFCBankGSTINnumberdetailsareavailableathttps://www.hdfcbank.com/personal/making-payments/online-tax-payment/goods-and-service-tax. RegisteredOfficeAddress:HDFCBankHouse,SenapatiBapatMarg,LowerParel,Mumbai400013", "raw": "UPI-MRMUNSHEELAL RAMSUR-MUNSHILALVISHWA KARMA210@OKSBI-IDIB000M764-107582668077- *Closingbalanceincludesfundsearmarkedforholdandunclearedfunds Contentsofthisstatementwillbeconsideredcorrectifnoerrorisreportedwithin30daysofreceiptofstatement.TheaddressonthisstatementisthatonrecordwiththeBankasatthedayofrequesting thisstatement. StateaccountbranchGSTN:27AAACH2702H1Z0 HDFCBankGSTINnumberdetailsareavailableathttps://www.hdfcbank.com/personal/making-payments/online-tax-payment/goods-and-service-tax. RegisteredOfficeAddress:HDFCBankHouse,SenapatiBapatMarg,LowerParel,Mumbai400013", "amount": 1000.0, "type": "expense", "debit": 1000.0, "credit": 0.0, "balance": 17472.28, "page": "Page 2", "line": "60", "store": null, "commodity": null, "reference": "0000107582668077", "upi_id": "MRMUNSHEELAL", "bankCode": "HDFC", "ifsc": "IDIB000M764", "transaction_id": null}, {"date": "05/07/25", "date_iso": "2025-05-07", "description": "UPI-GOOGLEINDIA DIGITAL-GPAYONLINEPAREF UNDS@AXISBANK-UTIB0000553-207399141865-U PI", "raw": "UPI-GOOGLEINDIA DIGITAL-GPAYONLINEPAREF UNDS@AXISBANK-UTIB0000553-207399141865-U PI", "amount": 323.0, "type": "expense", "debit": 323.0, "credit": 0.0, "balance": 17795.28, "page": "Page 3", "line": "26", "store": null, "commodity": null, "reference": "0000207399141865", "upi_id": "GOOGLEINDIA", "bankCode": "HDFC", "ifsc": "UTIB0000553", "transaction_id": null}, {"date": "07/07/25", "date_iso": "2025-07-07", "description": "UPI-MEESHO-MEESHO1ONLINE.GPAY@OKPAYAXIS- UTIB0000553-107664842989-UPIINTENT", "raw": "UPI-MEESHO-MEESHO1ONLINE.GPAY@OKPAYAXIS- UTIB0000553-107664842989-UPIINTENT", "amount": 320.0, "type": "expense", "debit": 320.0, "credit": 0.0, "balance": 17475.28, "page": "Page 3", "line": "28", "store": null, "commodity": null, "reference": "0000107664842989", "upi_id": "MEESHO", "bankCode": "HDFC", "ifsc": "UTIB0000553", "transaction_id": null}, {"date": "07/07/25", "date_iso": "2025-07-07", "description": "ACHD-FININDIANCLEARING-194713201", "raw": "ACHD-FININDIANCLEARING-194713201", "amount": 1000.0, "type": "expense", "debit": 1000.0, "credit": 0.0, "balance": 16475.28, "page": "Page 3", "line": "29", "store": null, "commodity": null, "reference": "0000008118603188", "upi_id": null, "bankCode": "HDFC", "ifsc": null, "transaction_id": null}, {"date": "07/07/25", "date_iso": "2025-07-07", "description": "ACHD-FININDIANCLEARING-193687462", "raw": "ACHD-FININDIANCLEARING-193687462", "amount": 1000.0, "type": "expense", "debit": 1000.0, "credit": 0.0, "balance": 15475.28, "page": "Page 3", "line": "30", "store": null, "commodity": null, "reference": "0000008321378188", "upi_id": null, "bankCode": "HDFC", "ifsc": null, "transaction_id": null}, {"date": "07/07/25", "date_iso": "2025-07-07", "description": "UPI-MRMUNSHEELAL RAMSUR-MUNSHILALVISHWA KARMA210@OKSBI-IDIB000M764-107670756757- UPI", "raw": "UPI-MRMUNSHEELAL RAMSUR-MUNSHILALVISHWA KARMA210@OKSBI-IDIB000M764-107670756757- UPI", "amount": 1000.0, "type": "expense", "debit": 1000.0, "credit": 0.0, "balance": 14475.28, "page": "Page 3", "line": "34", "store": null, "commodity": null, "reference": "0000107670756757", "upi_id": "MRMUNSHEELAL", "bankCode": "HDFC", "ifsc": "IDIB000M764", "transaction_id": null}, {"date": "08/07/25", "date_iso": "2025-08-07", "description": "UPI-ALIMKARSCOOPAND CA-PAYTMQR28100505 *Closingbalanceincludesfundsearmarkedforholdandunclearedfunds Contentsofthisstatementwillbeconsideredcorrectifnoerrorisreportedwithin30daysofreceiptofstatement.TheaddressonthisstatementisthatonrecordwiththeBankasatthedayofrequesting thisstatement. StateaccountbranchGSTN:27AAACH2702H1Z0 HDFCBankGSTINnumberdetailsareavailableathttps://www.hdfcbank.com/personal/making-payments/online-tax-payment/goods-and-service-tax. RegisteredOfficeAddress:HDFCBankHouse,SenapatiBapatMarg,LowerParel,Mumbai400013", "raw": "UPI-ALIMKARSCOOPAND CA-PAYTMQR28100505 *Closingbalanceincludesfundsearmarkedforholdandunclearedfunds Contentsofthisstatementwillbeconsideredcorrectifnoerrorisreportedwithin30daysofreceiptofstatement.TheaddressonthisstatementisthatonrecordwiththeBankasatthedayofrequesting thisstatement. StateaccountbranchGSTN:27AAACH2702H1Z0 HDFCBankGSTINnumberdetailsareavailableathttps://www.hdfcbank.com/personal/making-payments/online-tax-payment/goods-and-service-tax. RegisteredOfficeAddress:HDFCBankHouse,SenapatiBapatMarg,LowerParel,Mumbai400013", "amount": 300.0, "type": "expense", "debit": 300.0, "credit": 0.0, "balance": 9082.51, "page": "Page 3", "line": "60", "store": null, "commodity": null, "reference": "0000107766209616", "upi_id": "ALIMKARSCOOPAND", "bankCode": "HDFC", "ifsc": null, "transaction_id": null}, {"date": "08/07/25", "date_iso": "2025-08-07", "description": "UPI-NAMADEV STORE-GPAY-11251176693@OKBIZ AXIS-UTIB0000553-107765763122-UPI", "raw": "UPI-NAMADEV STORE-GPAY-11251176693@OKBIZ AXIS-UTIB0000553-107765763122-UPI", "amount": 15.0, "type": "expense", "debit": 15.0, "credit": 0.0, "balance": 9382.51, "page": "Page 3", "line": "51", "store": null, "commodity": null, "reference": "0000107765763122", "upi_id": "NAMADEV", "bankCode": "HDFC", "ifsc": "UTIB0000553", "transaction_id": null}, {"date": "08/07/25", "date_iso": "2025-08-07", "description": "UPI-VALRAMSUPER MART-GPAY-11256374897@O KBIZAXIS-UTIB0000553-107764434019-UPI", "raw": "UPI-VALRAMSUPER MART-GPAY-11256374897@O KBIZAXIS-UTIB0000553-107764434019-UPI", "amount": 113.0, "type": "expense", "debit": 113.0, "credit": 0.0, "balance": 9397.51, "page": "Page 3", "line": "48", "store": null, "commodity": null, "reference": "0000107764434019", "upi_id": "VALRAMSUPER", "bankCode": "HDFC", "ifsc": "UTIB0000553", "transaction_id": null}, {"date": "08/07/25", "date_iso": "2025-08-07", "description": "UPI-MAHARASHTRACLOTH ST-GPAY-1124081746 8@OKBIZAXIS-UTIB0000553-107760109860-UPI", "raw": "UPI-MAHARASHTRACLOTH ST-GPAY-1124081746 8@OKBIZAXIS-UTIB0000553-107760109860-UPI", "amount": 800.0, "type": "expense", "debit": 800.0, "credit": 0.0, "balance": 9510.51, "page": "Page 3", "line": "45", "store": null, "commodity": null, "reference": "0000107760109860", "upi_id": "MAHARASHTRACLOTH", "bankCode": "HDFC", "ifsc": "UTIB0000553", "transaction_id": null}, {"date": "08/07/25", "date_iso": "2025-08-07", "description": "UPI-MAHALAXMI JEWELLERS-GPAY-11252123315 @OKBIZAXIS-UTIB0000553-107758658923-UPI", "raw": "UPI-MAHALAXMI JEWELLERS-GPAY-11252123315 @OKBIZAXIS-UTIB0000553-107758658923-UPI", "amount": 3000.0, "type": "expense", "debit": 3000.0, "credit": 0.0, "balance": 10310.51, "page": "Page 3", "line": "42", "store": null, "commodity": null, "reference": "0000107758658923", "upi_id": "MAHALAXMI", "bankCode": "HDFC", "ifsc": "UTIB0000553", "transaction_id": null}, {"date": "08/07/25", "date_iso": "2025-08-07", "description": "UPI-AYUSHIKANSINGH CHAU-AYUSHICHAUHAN00 7007@OKSBI-BCBM0000006-107752205770-UPI", "raw": "UPI-AYUSHIKANSINGH CHAU-AYUSHICHAUHAN00 7007@OKSBI-BCBM0000006-107752205770-UPI", "amount": 585.77, "type": "expense", "debit": 585.77, "credit": 0.0, "balance": 13310.51, "page": "Page 3", "line": "39", "store": null, "commodity": null, "reference": "0000107752205770", "upi_id": "AYUSHIKANSINGH", "bankCode": "HDFC", "ifsc": "BCBM0000006", "transaction_id": null}, {"date": "08/07/25", "date_iso": "2025-08-07", "description": "UPI-AIRTEL-AIRTEL-PREPAID.PAYTM@PTYBL-YE SB0PTMUPI-107725540826-UPI", "raw": "UPI-AIRTEL-AIRTEL-PREPAID.PAYTM@PTYBL-YE SB0PTMUPI-107725540826-UPI", "amount": 579.0, "type": "expense", "debit": 579.0, "credit": 0.0, "balance": 13896.28, "page": "Page 3", "line": "36", "store": null, "commodity": null, "reference": "0000107725540826", "upi_id": "AIRTEL", "bankCode": "HDFC", "ifsc": null, "transaction_id": null}, {"date": "09/07/25", "date_iso": "2025-09-07", "description": "UPI-SONKAMBALEGOVIND VA-8104595992@PTAX IS-TJSB0000012-107816193050-UPI", "raw": "UPI-SONKAMBALEGOVIND VA-8104595992@PTAX IS-TJSB0000012-107816193050-UPI", "amount": 15.0, "type": "expense", "debit": 15.0, "credit": 0.0, "balance": 9067.51, "page": "Page 4", "line": "26", "store": null, "commodity": null, "reference": "0000107816193050", "upi_id": "SONKAMBALEGOVIND", "bankCode": "HDFC", "ifsc": "TJSB0000012", "transaction_id": null}, {"date": "10/07/25", "date_iso": "2025-10-07", "description": "UPI-SACHINMUNSHEELAL VI-9867926681@KOTA K811-KKBK0001432-519108712793-WISHYOUA VERYHA", "raw": "UPI-SACHINMUNSHEELAL VI-9867926681@KOTA K811-KKBK0001432-519108712793-WISHYOUA VERYHA", "amount": 5000.0, "type": "income", "debit": 0.0, "credit": 5000.0, "balance": 14067.51, "page": "Page 4", "line": "30", "store": null, "commodity": null, "reference": "0000519108712793", "upi_id": "SACHINMUNSHEELAL", "bankCode": "HDFC", "ifsc": "KKBK0001432", "transaction_id": null}, {"date": "10/07/25", "date_iso": "2025-10-07", "description": "ACHD-FININDIANCLEARING-195243688", "raw": "ACHD-FININDIANCLEARING-195243688", "amount": 1000.0, "type": "expense", "debit": 1000.0, "credit": 0.0, "balance": 13067.51, "page": "Page 4", "line": "31", "store": null, "commodity": null, "reference": "0000008744401191", "upi_id": null, "bankCode": "HDFC", "ifsc": null, "transaction_id": null}, {"date": "10/07/25", "date_iso": "2025-10-07", "description": "ACHD-FININDIANCLEARING-194998072", "raw": "ACHD-FININDIANCLEARING-194998072", "amount": 1000.0, "type": "expense", "debit": 1000.0, "credit": 0.0, "balance": 12067.51, "page": "Page 4", "line": "32", "store": null, "commodity": null, "reference": "0000008852277191", "upi_id": null, "bankCode": "HDFC", "ifsc": null, "transaction_id": null}, {"date": "10/07/25", "date_iso": "2025-10-07", "description": "UPI-SWIGGY LIMITED-SWIGGYINSTAMART1ONLIN E.GPAY@OKPAYAXIS-UTIB0000553-10786825063 5-UPI", "raw": "UPI-SWIGGY LIMITED-SWIGGYINSTAMART1ONLIN E.GPAY@OKPAYAXIS-UTIB0000553-10786825063 5-UPI", "amount": 367.0, "type": "expense", "debit": 367.0, "credit": 0.0, "balance": 11700.51, "page": "Page 4", "line": "36", "store": null, "commodity": null, "reference": "0000107868250635", "upi_id": "SWIGGY", "bankCode": "HDFC", "ifsc": "UTIB0000553", "transaction_id": null}, {"date": "10/07/25", "date_iso": "2025-10-07", "description": "UPI-ZEPTOMARKETPLACE PR-ZEPTOMARKETPLAC 357841.RZP@HDFCBANK-HDFC0MERUPI-10094996 1437-PAYVIARAZORPAY", "raw": "UPI-ZEPTOMARKETPLACE PR-ZEPTOMARKETPLAC 357841.RZP@HDFCBANK-HDFC0MERUPI-10094996 1437-PAYVIARAZORPAY", "amount": 144.19, "type": "expense", "debit": 144.19, "credit": 0.0, "balance": 11556.32, "page": "Page 4", "line": "40", "store": null, "commodity": null, "reference": "0000100949961437", "upi_id": "ZEPTOMARKETPLACE", "bankCode": "HDFC", "ifsc": "HDFC0MERUPI", "transaction_id": null}, {"date": "11/07/25", "date_iso": "2025-11-07", "description": "UPI-KALPANAMEDICALAND -PAYTMQR64O9YT@P TYS-YESB0PTMUPI-107897647991-UPI", "raw": "UPI-KALPANAMEDICALAND -PAYTMQR64O9YT@P TYS-YESB0PTMUPI-107897647991-UPI", "amount": 120.0, "type": "expense", "debit": 120.0, "credit": 0.0, "balance": 11436.32, "page": "Page 4", "line": "43", "store": null, "commodity": null, "reference": "0000107897647991", "upi_id": "KALPANAMEDICALAND", "bankCode": "HDFC", "ifsc": "YESB0PTMUPI", "transaction_id": null}, {"date": "11/07/25", "date_iso": "2025-11-07", "description": "UPI-MAMTAMUNSHEELAL VIS-MAMTAVISHWAKARM A0948-1@OKHDFCBANK-KKBK0001432-107914722 643-UPI", "raw": "UPI-MAMTAMUNSHEELAL VIS-MAMTAVISHWAKARM A0948-1@OKHDFCBANK-KKBK0001432-107914722 643-UPI", "amount": 3000.0, "type": "expense", "debit": 3000.0, "credit": 0.0, "balance": 8436.32, "page": "Page 4", "line": "47", "store": null, "commodity": null, "reference": "0000107914722643", "upi_id": "MAMTAMUNSHEELAL", "bankCode": "HDFC", "ifsc": "KKBK0001432", "transaction_id": null}, {"date": "11/07/25", "date_iso": "2025-11-07", "description": "UPI-AONE SUPER SALE-PAYTMQR6BQKSE@PTYS -YESB0PTMUPI-107931186131-UPI", "raw": "UPI-AONE SUPER SALE-PAYTMQR6BQKSE@PTYS -YESB0PTMUPI-107931186131-UPI", "amount": 120.0, "type": "expense", "debit": 120.0, "credit": 0.0, "balance": 8316.32, "page": "Page 4", "line": "50", "store": null, "commodity": null, "reference": "0000107931186131", "upi_id": "AONE", "bankCode": "HDFC", "ifsc": "YESB0PTMUPI", "transaction_id": null}, {"date": "11/07/25", "date_iso": "2025-11-07", "description": "UPI-PATHANJASMIN RAJJAK-JASMIN.PATHAN00 7-2@OKAXIS-BARB0WALUJX-107934299614-UPI *Closingbalanceincludesfundsearmarkedforholdandunclearedfunds Contentsofthisstatementwillbeconsideredcorrectifnoerrorisreportedwithin30daysofreceiptofstatement.TheaddressonthisstatementisthatonrecordwiththeBankasatthedayofrequesting thisstatement. StateaccountbranchGSTN:27AAACH2702H1Z0 HDFCBankGSTINnumberdetailsareavailableathttps://www.hdfcbank.com/personal/making-payments/online-tax-payment/goods-and-service-tax. RegisteredOfficeAddress:HDFCBankHouse,SenapatiBapatMarg,LowerParel,Mumbai400013", "raw": "UPI-PATHANJASMIN RAJJAK-JASMIN.PATHAN00 7-2@OKAXIS-BARB0WALUJX-107934299614-UPI *Closingbalanceincludesfundsearmarkedforholdandunclearedfunds Contentsofthisstatementwillbeconsideredcorrectifnoerrorisreportedwithin30daysofreceiptofstatement.TheaddressonthisstatementisthatonrecordwiththeBankasatthedayofrequesting thisstatement. StateaccountbranchGSTN:27AAACH2702H1Z0 HDFCBankGSTINnumberdetailsareavailableathttps://www.hdfcbank.com/personal/making-payments/online-tax-payment/goods-and-service-tax. RegisteredOfficeAddress:HDFCBankHouse,SenapatiBapatMarg,LowerParel,Mumbai400013", "amount": 120.0, "type": "expense", "debit": 120.0, "credit": 0.0, "balance": 8196.32, "page": "Page 4", "line": "60", "store": null, "commodity": null, "reference": "0000107934299614", "upi_id": "PATHANJASMIN", "bankCode": "HDFC", "ifsc": "BARB0WALUJX", "transaction_id": null}, {"date": "12/07/25", "date_iso": "2025-12-07", "description": "UPI-RK BAZAR-M1VSIN0BDPRI@YBL-YESB0YBLUP I-519314526545-COLLECTREQUESTFR", "raw": "UPI-RK BAZAR-M1VSIN0BDPRI@YBL-YESB0YBLUP I-519314526545-COLLECTREQUESTFR", "amount": 554.05, "type": "expense", "debit": 554.05, "credit": 0.0, "balance": 7557.27, "page": "Page 5", "line": "33", "store": null, "commodity": null, "reference": "0000519314526545", "upi_id": "RK", "bankCode": "HDFC", "ifsc": null, "transaction_id": null}, {"date": "12/07/25", "date_iso": "2025-12-07", "description": "UPI-PRAMOD KUMAR-PAYTMQR6J2CNR@PTYS-YESB 0PTMUPI-107973484007-UPI", "raw": "UPI-PRAMOD KUMAR-PAYTMQR6J2CNR@PTYS-YESB 0PTMUPI-107973484007-UPI", "amount": 40.0, "type": "expense", "debit": 40.0, "credit": 0.0, "balance": 8111.32, "page": "Page 5", "line": "30", "store": null, "commodity": null, "reference": "0000107973484007", "upi_id": "PRAMOD", "bankCode": "HDFC", "ifsc": null, "transaction_id": null}, {"date": "12/07/25", "date_iso": "2025-12-07", "description": "UPI-DASHARATHTRIMBAK WA-GPAY-1125072102 0@OKBIZAXIS-UTIB0000553-107957357471-UPI", "raw": "UPI-DASHARATHTRIMBAK WA-GPAY-1125072102 0@OKBIZAXIS-UTIB0000553-107957357471-UPI", "amount": 25.0, "type": "expense", "debit": 25.0, "credit": 0.0, "balance": 8171.32, "page": "Page 5", "line": "24", "store": null, "commodity": null, "reference": "0000107957357471", "upi_id": "DASHARATHTRIMBAK", "bankCode": "HDFC", "ifsc": "UTIB0000553", "transaction_id": null}, {"date": "12/07/25", "date_iso": "2025-12-07", "description": "UPI-AMBIKA PRASAD-PAYTM.S1GQY6H@PTY-YESB 0MCHUPI-107973387893-UPI", "raw": "UPI-AMBIKA PRASAD-PAYTM.S1GQY6H@PTY-YESB 0MCHUPI-107973387893-UPI", "amount": 20.0, "type": "expense", "debit": 20.0, "credit": 0.0, "balance": 8151.32, "page": "Page 5", "line": "27", "store": null, "commodity": null, "reference": "0000107973387893", "upi_id": "AMBIKA", "bankCode": "HDFC", "ifsc": null, "transaction_id": null}, {"date": "13/07/25", "date_iso": "2025-07-13", "description": "UPI-SMARTMUMBAITOM0-2430449634467-01@J IOPAY-JIOP0000001-108039653702-UPI", "raw": "UPI-SMARTMUMBAITOM0-2430449634467-01@J IOPAY-JIOP0000001-108039653702-UPI", "amount": 373.89, "type": "expense", "debit": 373.89, "credit": 0.0, "balance": 7183.38, "page": "Page 5", "line": "35", "store": null, "commodity": null, "reference": "0000108039653702", "upi_id": "SMARTMUMBAITOM0", "bankCode": "HDFC", "ifsc": "JIOP0000001", "transaction_id": "2430449634467"}, {"date": "13/07/25", "date_iso": "2025-07-13", "description": "UPI-SNEHALNITESH PAWAR-PAYTM.S1H31E0@PT Y-YESB0MCHUPI-108044626916-UPI", "raw": "UPI-SNEHALNITESH PAWAR-PAYTM.S1H31E0@PT Y-YESB0MCHUPI-108044626916-UPI", "amount": 42.0, "type": "expense", "debit": 42.0, "credit": 0.0, "balance": 7141.38, "page": "Page 5", "line": "38", "store": null, "commodity": null, "reference": "0000108044626916", "upi_id": "SNEHALNITESH", "bankCode": "HDFC", "ifsc": "YESB0MCHUPI", "transaction_id": null}, {"date": "14/07/25", "date_iso": "2025-07-14", "description": "UPI-PRAJAPATI RAMPRAKASH-Q053640936@YBL- YESB0YBLUPI-108101811973-UPI", "raw": "UPI-PRAJAPATI RAMPRAKASH-Q053640936@YBL- YESB0YBLUPI-108101811973-UPI", "amount": 20.0, "type": "expense", "debit": 20.0, "credit": 0.0, "balance": 7121.38, "page": "Page 5", "line": "41", "store": null, "commodity": null, "reference": "0000108101811973", "upi_id": "PRAJAPATI", "bankCode": "HDFC", "ifsc": "YESB0YBLUPI", "transaction_id": null}, {"date": "14/07/25", "date_iso": "2025-07-14", "description": "UPI-RAJKUMAR VERMA-BHARATPE.9J0F0B0F2Y5 50222@UNITYPE-UNBA000BHPE-108102386843-P AYTOBHARATPEME", "raw": "UPI-RAJKUMAR VERMA-BHARATPE.9J0F0B0F2Y5 50222@UNITYPE-UNBA000BHPE-108102386843-P AYTOBHARATPEME", "amount": 30.0, "type": "expense", "debit": 30.0, "credit": 0.0, "balance": 7091.38, "page": "Page 5", "line": "45", "store": null, "commodity": null, "reference": "0000108102386843", "upi_id": "RAJKUMAR", "bankCode": "HDFC", "ifsc": "UNBA000BHPE", "transaction_id": null}, {"date": "14/07/25", "date_iso": "2025-07-14", "description": "UPI-SHAKUNTALADEVI BABL-PAYTM.S16IECC@P TY-YESB0MCHUPI-108102736225-UPI", "raw": "UPI-SHAKUNTALADEVI BABL-PAYTM.S16IECC@P TY-YESB0MCHUPI-108102736225-UPI", "amount": 40.0, "type": "expense", "debit": 40.0, "credit": 0.0, "balance": 7051.38, "page": "Page 5", "line": "48", "store": null, "commodity": null, "reference": "0000108102736225", "upi_id": "SHAKUNTALADEVI", "bankCode": "HDFC", "ifsc": "YESB0MCHUPI", "transaction_id": null}, {"date": "14/07/25", "date_iso": "2025-07-14", "description": "UPI-AAKASHPAVAN JAISWAL-AAKASH.8931-9@W AAXIS-KARB0000520-108117130559-UPI", "raw": "UPI-AAKASHPAVAN JAISWAL-AAKASH.8931-9@W AAXIS-KARB0000520-108117130559-UPI", "amount": 530.0, "type": "expense", "debit": 530.0, "credit": 0.0, "balance": 6521.38, "page": "Page 5", "line": "51", "store": null, "commodity": null, "reference": "0000108117130559", "upi_id": "AAKASHPAVAN", "bankCode": "HDFC", "ifsc": "KARB0000520", "transaction_id": null}, {"date": "15/07/25", "date_iso": "2025-07-15", "description": "UPI-MRRIYAZKHAN-BHARATPE.9Z0Z0R0S0J969 104@UNITYPE-UNBA000BHPE-108156460850-PAY *Closingbalanceincludesfundsearmarkedforholdandunclearedfunds Contentsofthisstatementwillbeconsideredcorrectifnoerrorisreportedwithin30daysofreceiptofstatement.TheaddressonthisstatementisthatonrecordwiththeBankasatthedayofrequesting thisstatement. StateaccountbranchGSTN:27AAACH2702H1Z0 HDFCBankGSTINnumberdetailsareavailableathttps://www.hdfcbank.com/personal/making-payments/online-tax-payment/goods-and-service-tax. RegisteredOfficeAddress:HDFCBankHouse,SenapatiBapatMarg,LowerParel,Mumbai400013", "raw": "UPI-MRRIYAZKHAN-BHARATPE.9Z0Z0R0S0J969 104@UNITYPE-UNBA000BHPE-108156460850-PAY *Closingbalanceincludesfundsearmarkedforholdandunclearedfunds Contentsofthisstatementwillbeconsideredcorrectifnoerrorisreportedwithin30daysofreceiptofstatement.TheaddressonthisstatementisthatonrecordwiththeBankasatthedayofrequesting thisstatement. StateaccountbranchGSTN:27AAACH2702H1Z0 HDFCBankGSTINnumberdetailsareavailableathttps://www.hdfcbank.com/personal/making-payments/online-tax-payment/goods-and-service-tax. RegisteredOfficeAddress:HDFCBankHouse,SenapatiBapatMarg,LowerParel,Mumbai400013", "amount": 100.0, "type": "expense", "debit": 100.0, "credit": 0.0, "balance": 6421.38, "page": "Page 5", "line": "60", "store": null, "commodity": null, "reference": "0000108156460850", "upi_id": "MRRIYAZKHAN", "bankCode": "HDFC", "ifsc": "UNBA000BHPE", "transaction_id": null}, {"date": "15/07/25", "date_iso": "2025-07-15", "description": "UPI-NANDAJOSEPH MOBEN-Q831197501@YBL-YE SB0YBLUPI-108158719652-UPI", "raw": "UPI-NANDAJOSEPH MOBEN-Q831197501@YBL-YE SB0YBLUPI-108158719652-UPI", "amount": 112.0, "type": "expense", "debit": 112.0, "credit": 0.0, "balance": 6309.38, "page": "Page 6", "line": "25", "store": null, "commodity": null, "reference": "0000108158719652", "upi_id": "NANDAJOSEPH", "bankCode": "HDFC", "ifsc": null, "transaction_id": null}, {"date": "16/07/25", "date_iso": "2025-07-16", "description": "ATW-541919XXXXXX1984-P3ECMI11-THANE", "raw": "ATW-541919XXXXXX1984-P3ECMI11-THANE", "amount": 5000.0, "type": "expense", "debit": 5000.0, "credit": 0.0, "balance": 1309.38, "page": "Page 6", "line": "26", "store": null, "commodity": null, "reference": "0000000000001079", "upi_id": null, "bankCode": "HDFC", "ifsc": null, "transaction_id": null}, {"date": "16/07/25", "date_iso": "2025-07-16", "description": "UPI-SHREESADGURUKRUPA -PAYTMQR6J3GQC@P TYS-YESB0PTMUPI-108212806858-UPI", "raw": "UPI-SHREESADGURUKRUPA -PAYTMQR6J3GQC@P TYS-YESB0PTMUPI-108212806858-UPI", "amount": 50.0, "type": "expense", "debit": 50.0, "credit": 0.0, "balance": 1259.38, "page": "Page 6", "line": "29", "store": null, "commodity": null, "reference": "0000108212806858", "upi_id": "SHREESADGURUKRUPA", "bankCode": "HDFC", "ifsc": "YESB0PTMUPI", "transaction_id": null}, {"date": "16/07/25", "date_iso": "2025-07-16", "description": "UPI-BHAVANIMEDICALAND -PAYTMQR69LPPX@P TYS-YESB0PTMUPI-108213069912-UPI", "raw": "UPI-BHAVANIMEDICALAND -PAYTMQR69LPPX@P TYS-YESB0PTMUPI-108213069912-UPI", "amount": 100.0, "type": "expense", "debit": 100.0, "credit": 0.0, "balance": 1159.38, "page": "Page 6", "line": "32", "store": null, "commodity": null, "reference": "0000108213069912", "upi_id": "BHAVANIMEDICALAND", "bankCode": "HDFC", "ifsc": "YESB0PTMUPI", "transaction_id": null}, {"date": "17/07/25", "date_iso": "2025-07-17", "description": "UPI-RAMKUMAR-9136736257@IBL-UBIN0562718 -108266286884-UPI", "raw": "UPI-RAMKUMAR-9136736257@IBL-UBIN0562718 -108266286884-UPI", "amount": 40.0, "type": "expense", "debit": 40.0, "credit": 0.0, "balance": 1027.88, "page": "Page 6", "line": "47", "store": null, "commodity": null, "reference": "0000108266286884", "upi_id": "RAMKUMAR", "bankCode": "HDFC", "ifsc": "UBIN0562718", "transaction_id": null}, {"date": "17/07/25", "date_iso": "2025-07-17", "description": "UPI-IMTIYAJ-PAYTM.S1K5WWG@PTY-YESB0MCHUP I-108267556870-UPI", "raw": "UPI-IMTIYAJ-PAYTM.S1K5WWG@PTY-YESB0MCHUP I-108267556870-UPI", "amount": 100.0, "type": "expense", "debit": 100.0, "credit": 0.0, "balance": 927.88, "page": "Page 6", "line": "49", "store": null, "commodity": null, "reference": "0000108267556870", "upi_id": "IMTIYAJ", "bankCode": "HDFC", "ifsc": null, "transaction_id": null}, {"date": "17/07/25", "date_iso": "2025-07-17", "description": "UPI-SHAKUNTALADEVI BABL-PAYTM.S16IECC@P TY-YESB0MCHUPI-108266138038-UPI", "raw": "UPI-SHAKUNTALADEVI BABL-PAYTM.S16IECC@P TY-YESB0MCHUPI-108266138038-UPI", "amount": 10.0, "type": "expense", "debit": 10.0, "credit": 0.0, "balance": 1067.88, "page": "Page 6", "line": "45", "store": null, "commodity": null, "reference": "0000108266138038", "upi_id": "SHAKUNTALADEVI", "bankCode": "HDFC", "ifsc": "YESB0MCHUPI", "transaction_id": null}, {"date": "17/07/25", "date_iso": "2025-07-17", "description": "UPI-MSAJITHA GUNASEKARA-AJITHANADAR123@ OKICICI-IDIB000I018-108242248662-UPI", "raw": "UPI-MSAJITHA GUNASEKARA-AJITHANADAR123@ OKICICI-IDIB000I018-108242248662-UPI", "amount": 21.5, "type": "expense", "debit": 21.5, "credit": 0.0, "balance": 1137.88, "page": "Page 6", "line": "35", "store": null, "commodity": null, "reference": "0000108242248662", "upi_id": "MSAJITHA", "bankCode": "HDFC", "ifsc": "IDIB000I018", "transaction_id": null}, {"date": "17/07/25", "date_iso": "2025-07-17", "description": "UPI-PRIYANSHU-PAYTMQR6GUTFZ@PTYS-YESB0PT MUPI-108265647895-UPI", "raw": "UPI-PRIYANSHU-PAYTMQR6GUTFZ@PTYS-YESB0PT MUPI-108265647895-UPI", "amount": 10.0, "type": "expense", "debit": 10.0, "credit": 0.0, "balance": 1107.88, "page": "Page 6", "line": "39", "store": null, "commodity": null, "reference": "0000108265647895", "upi_id": "PRIYANSHU", "bankCode": "HDFC", "ifsc": null, "transaction_id": null}, {"date": "17/07/25", "date_iso": "2025-07-17", "description": "UPI-PRIYANSHU-PAYTMQR6GUTFZ@PTYS-YESB0PT MUPI-108265591377-UPI", "raw": "UPI-PRIYANSHU-PAYTMQR6GUTFZ@PTYS-YESB0PT MUPI-108265591377-UPI", "amount": 20.0, "type": "expense", "debit": 20.0, "credit": 0.0, "balance": 1117.88, "page": "Page 6", "line": "37", "store": null, "commodity": null, "reference": "0000108265591377", "upi_id": "PRIYANSHU", "bankCode": "HDFC", "ifsc": null, "transaction_id": null}, {"date": "17/07/25", "date_iso": "2025-07-17", "description": "UPI-ABHISHEK GUPTA-PAYTMQR6CDJSU@PTYS-YE SB0PTMUPI-108265948958-UPI", "raw": "UPI-ABHISHEK GUPTA-PAYTMQR6CDJSU@PTYS-YE SB0PTMUPI-108265948958-UPI", "amount": 30.0, "type": "expense", "debit": 30.0, "credit": 0.0, "balance": 1077.88, "page": "Page 6", "line": "42", "store": null, "commodity": null, "reference": "0000108265948958", "upi_id": "ABHISHEK", "bankCode": "HDFC", "ifsc": null, "transaction_id": null}, {"date": "18/07/25", "date_iso": "2025-07-18", "description": "UPI-KAIFUL-PRIYANSHUUSINGH1223@OKSBI-AIR P0000001-108319371040-UPI", "raw": "UPI-KAIFUL-PRIYANSHUUSINGH1223@OKSBI-AIR P0000001-108319371040-UPI", "amount": 10.0, "type": "expense", "debit": 10.0, "credit": 0.0, "balance": 917.88, "page": "Page 6", "line": "51", "store": null, "commodity": null, "reference": "0000108319371040", "upi_id": "KAIFUL", "bankCode": "HDFC", "ifsc": null, "transaction_id": null}, {"date": "18/07/25", "date_iso": "2025-07-18", "description": "UPI-MOHD SHADAB-BHARATPE.9G0Z0C0A3I92822 *Closingbalanceincludesfundsearmarkedforholdandunclearedfunds Contentsofthisstatementwillbeconsideredcorrectifnoerrorisreportedwithin30daysofreceiptofstatement.TheaddressonthisstatementisthatonrecordwiththeBankasatthedayofrequesting thisstatement. StateaccountbranchGSTN:27AAACH2702H1Z0 HDFCBankGSTINnumberdetailsareavailableathttps://www.hdfcbank.com/personal/making-payments/online-tax-payment/goods-and-service-tax. RegisteredOfficeAddress:HDFCBankHouse,SenapatiBapatMarg,LowerParel,Mumbai400013", "raw": "UPI-MOHD SHADAB-BHARATPE.9G0Z0C0A3I92822 *Closingbalanceincludesfundsearmarkedforholdandunclearedfunds Contentsofthisstatementwillbeconsideredcorrectifnoerrorisreportedwithin30daysofreceiptofstatement.TheaddressonthisstatementisthatonrecordwiththeBankasatthedayofrequesting thisstatement. StateaccountbranchGSTN:27AAACH2702H1Z0 HDFCBankGSTINnumberdetailsareavailableathttps://www.hdfcbank.com/personal/making-payments/online-tax-payment/goods-and-service-tax. RegisteredOfficeAddress:HDFCBankHouse,SenapatiBapatMarg,LowerParel,Mumbai400013", "amount": 20.0, "type": "expense", "debit": 20.0, "credit": 0.0, "balance": 897.88, "page": "Page 6", "line": "60", "store": null, "commodity": null, "reference": "0000108319583883", "upi_id": "MOHD", "bankCode": "HDFC", "ifsc": null, "transaction_id": null}, {"date": "18/07/25", "date_iso": "2025-07-18", "description": "UPI-SHIVSHANKERRAJESH-BHARATPE.9A0Z0B 0B0P354295@UNITYPE-UNBA000BHPE-108320044 215-PAYTOBHARATPEME", "raw": "UPI-SHIVSHANKERRAJESH-BHARATPE.9A0Z0B 0B0P354295@UNITYPE-UNBA000BHPE-108320044 215-PAYTOBHARATPEME", "amount": 20.0, "type": "expense", "debit": 20.0, "credit": 0.0, "balance": 877.88, "page": "Page 7", "line": "26", "store": null, "commodity": null, "reference": "0000108320044215", "upi_id": "SHIVSHANKERRAJESH", "bankCode": "HDFC", "ifsc": "UNBA000BHPE", "transaction_id": null}, {"date": "18/07/25", "date_iso": "2025-07-18", "description": "UPI-LAHUKESHAV THAKUR-8451020463@IBL-BA RB0KALRAI-108320815491-UPI", "raw": "UPI-LAHUKESHAV THAKUR-8451020463@IBL-BA RB0KALRAI-108320815491-UPI", "amount": 15.0, "type": "expense", "debit": 15.0, "credit": 0.0, "balance": 862.88, "page": "Page 7", "line": "29", "store": null, "commodity": null, "reference": "0000108320815491", "upi_id": "LAHUKESHAV", "bankCode": "HDFC", "ifsc": null, "transaction_id": null}, {"date": "18/07/25", "date_iso": "2025-07-18", "description": "UPI-SHREESHIVSHAMBHU D-PAYTMQR6CR25Z@P TYS-YESB0PTMUPI-108321470550-UPI", "raw": "UPI-SHREESHIVSHAMBHU D-PAYTMQR6CR25Z@P TYS-YESB0PTMUPI-108321470550-UPI", "amount": 140.0, "type": "expense", "debit": 140.0, "credit": 0.0, "balance": 722.88, "page": "Page 7", "line": "32", "store": null, "commodity": null, "reference": "0000108321470550", "upi_id": "SHREESHIVSHAMBHU", "bankCode": "HDFC", "ifsc": "YESB0PTMUPI", "transaction_id": null}, {"date": "19/07/25", "date_iso": "2025-07-19", "description": "UPI-AYUSHIKANSINGH CHAU-AYUSHICHAUHAN00 7007@OKSBI-BCBM0000006-520070166055-UPI", "raw": "UPI-AYUSHIKANSINGH CHAU-AYUSHICHAUHAN00 7007@OKSBI-BCBM0000006-520070166055-UPI", "amount": 20.0, "type": "income", "debit": 0.0, "credit": 20.0, "balance": 742.88, "page": "Page 7", "line": "35", "store": null, "commodity": null, "reference": "0000520070166055", "upi_id": "AYUSHIKANSINGH", "bankCode": "HDFC", "ifsc": "BCBM0000006", "transaction_id": null}, {"date": "19/07/25", "date_iso": "2025-07-19", "description": "UPI-MANSISUBHASH MANDAL-MANDALEMANSI44@ OKICICI-KKBK0001400-520016623167-UPI", "raw": "UPI-MANSISUBHASH MANDAL-MANDALEMANSI44@ OKICICI-KKBK0001400-520016623167-UPI", "amount": 20.0, "type": "income", "debit": 0.0, "credit": 20.0, "balance": 762.88, "page": "Page 7", "line": "38", "store": null, "commodity": null, "reference": "0000520016623167", "upi_id": "MANSISUBHASH", "bankCode": "HDFC", "ifsc": "KKBK0001400", "transaction_id": null}, {"date": "19/07/25", "date_iso": "2025-07-19", "description": "UPI-SANIKARAJESHPATIL-PATILSANIKA26082 006@OKHDFCBANK-BARB0MANPAD-108346508089- UPI", "raw": "UPI-SANIKARAJESHPATIL-PATILSANIKA26082 006@OKHDFCBANK-BARB0MANPAD-108346508089- UPI", "amount": 20.0, "type": "income", "debit": 0.0, "credit": 20.0, "balance": 782.88, "page": "Page 7", "line": "41", "store": null, "commodity": null, "reference": "0000108346508089", "upi_id": "SANIKARAJESHPATIL", "bankCode": "HDFC", "ifsc": "BARB0MANPAD", "transaction_id": null}, {"date": "19/07/25", "date_iso": "2025-07-19", "description": "UPI-DASHARATHTRIMBAK WA-GPAY-1125117158 4@OKBIZAXIS-UTIB0000553-108346768348-UPI", "raw": "UPI-DASHARATHTRIMBAK WA-GPAY-1125117158 4@OKBIZAXIS-UTIB0000553-108346768348-UPI", "amount": 80.0, "type": "expense", "debit": 80.0, "credit": 0.0, "balance": 702.88, "page": "Page 7", "line": "44", "store": null, "commodity": null, "reference": "0000108346768348", "upi_id": "DASHARATHTRIMBAK", "bankCode": "HDFC", "ifsc": "UTIB0000553", "transaction_id": null}, {"date": "19/07/25", "date_iso": "2025-07-19", "description": "UPI-SHAKUNTALADEVI BABL-PAYTM.S16IECC@P TY-YESB0MCHUPI-108376151995-UPI", "raw": "UPI-SHAKUNTALADEVI BABL-PAYTM.S16IECC@P TY-YESB0MCHUPI-108376151995-UPI", "amount": 10.0, "type": "expense", "debit": 10.0, "credit": 0.0, "balance": 692.88, "page": "Page 7", "line": "47", "store": null, "commodity": null, "reference": "0000108376151995", "upi_id": "SHAKUNTALADEVI", "bankCode": "HDFC", "ifsc": "YESB0MCHUPI", "transaction_id": null}, {"date": "20/07/25", "date_iso": "2025-07-20", "description": "UPI-GOOGLEINDIA DIGITAL-GOOG-PAYMENTS@A XISBANK-UTIB0000553-986239292015-UPI *Closingbalanceincludesfundsearmarkedforholdandunclearedfunds Contentsofthisstatementwillbeconsideredcorrectifnoerrorisreportedwithin30daysofreceiptofstatement.TheaddressonthisstatementisthatonrecordwiththeBankasatthedayofrequesting thisstatement. StateaccountbranchGSTN:27AAACH2702H1Z0 HDFCBankGSTINnumberdetailsareavailableathttps://www.hdfcbank.com/personal/making-payments/online-tax-payment/goods-and-service-tax. RegisteredOfficeAddress:HDFCBankHouse,SenapatiBapatMarg,LowerParel,Mumbai400013", "raw": "UPI-GOOGLEINDIA DIGITAL-GOOG-PAYMENTS@A XISBANK-UTIB0000553-986239292015-UPI *Closingbalanceincludesfundsearmarkedforholdandunclearedfunds Contentsofthisstatementwillbeconsideredcorrectifnoerrorisreportedwithin30daysofreceiptofstatement.TheaddressonthisstatementisthatonrecordwiththeBankasatthedayofrequesting thisstatement. StateaccountbranchGSTN:27AAACH2702H1Z0 HDFCBankGSTINnumberdetailsareavailableathttps://www.hdfcbank.com/personal/making-payments/online-tax-payment/goods-and-service-tax. RegisteredOfficeAddress:HDFCBankHouse,SenapatiBapatMarg,LowerParel,Mumbai400013", "amount": 3.0, "type": "income", "debit": 0.0, "credit": 3.0, "balance": 114.98, "page": "Page 7", "line": "60", "store": null, "commodity": null, "reference": "0000986239292015", "upi_id": "GOOGLEINDIA", "bankCode": "HDFC", "ifsc": "UTIB0000553", "transaction_id": null}, {"date": "20/07/25", "date_iso": "2025-07-20", "description": "UPI-GOOGLEINDIA DIGITAL-GPAYRECHARGE@OK PAYAXIS-UTIB0000553-108411660575-UPI", "raw": "UPI-GOOGLEINDIA DIGITAL-GPAYRECHARGE@OK PAYAXIS-UTIB0000553-108411660575-UPI", "amount": 580.9, "type": "expense", "debit": 580.9, "credit": 0.0, "balance": 111.98, "page": "Page 7", "line": "50", "store": null, "commodity": null, "reference": "0000108411660575", "upi_id": "GOOGLEINDIA", "bankCode": "HDFC", "ifsc": "UTIB0000553", "transaction_id": null}, {"date": "21/07/25", "date_iso": "2025-07-21", "description": "UPI-MSAJITHA GUNASEKARA-AJITHANADAR123@ OKAXIS-IDIB000I018-520242162596-UPI", "raw": "UPI-MSAJITHA GUNASEKARA-AJITHANADAR123@ OKAXIS-IDIB000I018-520242162596-UPI", "amount": 500.0, "type": "expense", "debit": 500.0, "credit": 0.0, "balance": 614.98, "page": "Page 8", "line": "24", "store": null, "commodity": null, "reference": "0000520242162596", "upi_id": "MSAJITHA", "bankCode": "HDFC", "ifsc": "IDIB000I018", "transaction_id": null}, {"date": "21/07/25", "date_iso": "2025-07-21", "description": "UPI-SHAILENDAR KUMAR-PAYTM.S1H378M@PTY-Y ESB0MCHUPI-108484795361-UPI", "raw": "UPI-SHAILENDAR KUMAR-PAYTM.S1H378M@PTY-Y ESB0MCHUPI-108484795361-UPI", "amount": 100.0, "type": "expense", "debit": 100.0, "credit": 0.0, "balance": 514.98, "page": "Page 8", "line": "27", "store": null, "commodity": null, "reference": "0000108484795361", "upi_id": "SHAILENDAR", "bankCode": "HDFC", "ifsc": null, "transaction_id": null}, {"date": "21/07/25", "date_iso": "2025-07-21", "description": "UPI-MOHD SHADAB-BHARATPE.9G0Z0C0A3I92822 6@UNITYPE-UNBA000BHPE-108485091358-PAYT OBHARATPEME", "raw": "UPI-MOHD SHADAB-BHARATPE.9G0Z0C0A3I92822 6@UNITYPE-UNBA000BHPE-108485091358-PAYT OBHARATPEME", "amount": 15.0, "type": "expense", "debit": 15.0, "credit": 0.0, "balance": 499.98, "page": "Page 8", "line": "31", "store": null, "commodity": null, "reference": "0000108485091358", "upi_id": "MOHD", "bankCode": "HDFC", "ifsc": "UNBA000BHPE", "transaction_id": null}, {"date": "21/07/25", "date_iso": "2025-07-21", "description": "UPI-MRSSONI DEVI-Q831042750@YBL-YESB0Y BLUPI-108485391575-UPI", "raw": "UPI-MRSSONI DEVI-Q831042750@YBL-YESB0Y BLUPI-108485391575-UPI", "amount": 15.0, "type": "expense", "debit": 15.0, "credit": 0.0, "balance": 484.98, "page": "Page 8", "line": "33", "store": null, "commodity": null, "reference": "0000108485391575", "upi_id": "MRSSONI", "bankCode": "HDFC", "ifsc": null, "transaction_id": null}, {"date": "21/07/25", "date_iso": "2025-07-21", "description": "UPI-SHAKUNTALADEVI BABL-PAYTM.S16IECC@P TY-YESB0MCHUPI-108485452535-UPI", "raw": "UPI-SHAKUNTALADEVI BABL-PAYTM.S16IECC@P TY-YESB0MCHUPI-108485452535-UPI", "amount": 10.0, "type": "expense", "debit": 10.0, "credit": 0.0, "balance": 474.98, "page": "Page 8", "line": "36", "store": null, "commodity": null, "reference": "0000108485452535", "upi_id": "SHAKUNTALADEVI", "bankCode": "HDFC", "ifsc": "YESB0MCHUPI", "transaction_id": null}, {"date": "21/07/25", "date_iso": "2025-07-21", "description": "UPI-MHATREVAISHALI HARI-MAYURMHATRE2803 -2@OKICICI-PJSB0000040-108485710829-UPI", "raw": "UPI-MHATREVAISHALI HARI-MAYURMHATRE2803 -2@OKICICI-PJSB0000040-108485710829-UPI", "amount": 15.0, "type": "expense", "debit": 15.0, "credit": 0.0, "balance": 459.98, "page": "Page 8", "line": "39", "store": null, "commodity": null, "reference": "0000108485710829", "upi_id": "MHATREVAISHALI", "bankCode": "HDFC", "ifsc": "PJSB0000040", "transaction_id": null}, {"date": "21/07/25", "date_iso": "2025-07-21", "description": "UPI-PRADNYANILESH ACHAR-PAYTMQR6J2LE5@P TYS-YESB0PTMUPI-108486636698-UPI", "raw": "UPI-PRADNYANILESH ACHAR-PAYTMQR6J2LE5@P TYS-YESB0PTMUPI-108486636698-UPI", "amount": 25.0, "type": "expense", "debit": 25.0, "credit": 0.0, "balance": 434.98, "page": "Page 8", "line": "42", "store": null, "commodity": null, "reference": "0000108486636698", "upi_id": "PRADNYANILESH", "bankCode": "HDFC", "ifsc": "YESB0PTMUPI", "transaction_id": null}, {"date": "22/07/25", "date_iso": "2025-07-22", "description": "UPI-SHAKUNTALADEVI BABL-PAYTM.S16IECC@P TY-YESB0MCHUPI-108536769130-UPI", "raw": "UPI-SHAKUNTALADEVI BABL-PAYTM.S16IECC@P TY-YESB0MCHUPI-108536769130-UPI", "amount": 30.0, "type": "expense", "debit": 30.0, "credit": 0.0, "balance": 404.98, "page": "Page 8", "line": "45", "store": null, "commodity": null, "reference": "0000108536769130", "upi_id": "SHAKUNTALADEVI", "bankCode": "HDFC", "ifsc": "YESB0MCHUPI", "transaction_id": null}, {"date": "22/07/25", "date_iso": "2025-07-22", "description": "UPI-MADHUKAR ENTERPRISES-9221098833@OKBI ZAXIS-UTIB0000553-108537063076-UPI", "raw": "UPI-MADHUKAR ENTERPRISES-9221098833@OKBI ZAXIS-UTIB0000553-108537063076-UPI", "amount": 30.0, "type": "expense", "debit": 30.0, "credit": 0.0, "balance": 374.98, "page": "Page 8", "line": "48", "store": null, "commodity": null, "reference": "0000108537063076", "upi_id": "MADHUKAR", "bankCode": "HDFC", "ifsc": "UTIB0000553", "transaction_id": null}, {"date": "23/07/25", "date_iso": "2025-07-23", "description": "UPI-VICKY KUMAR-PAYTMQR6J2EYI@PTYS-YESB0 PTMUPI-108589196556-UPI", "raw": "UPI-VICKY KUMAR-PAYTMQR6J2EYI@PTYS-YESB0 PTMUPI-108589196556-UPI", "amount": 10.0, "type": "expense", "debit": 10.0, "credit": 0.0, "balance": 364.98, "page": "Page 8", "line": "51", "store": null, "commodity": null, "reference": "0000108589196556", "upi_id": "VICKY", "bankCode": "HDFC", "ifsc": null, "transaction_id": null}, {"date": "23/07/25", "date_iso": "2025-07-23", "description": "UPI-SHAKUNTALADEVI BABL-PAYTM.S16IECC@P *Closingbalanceincludesfundsearmarkedforholdandunclearedfunds Contentsofthisstatementwillbeconsideredcorrectifnoerrorisreportedwithin30daysofreceiptofstatement.TheaddressonthisstatementisthatonrecordwiththeBankasatthedayofrequesting thisstatement. StateaccountbranchGSTN:27AAACH2702H1Z0 HDFCBankGSTINnumberdetailsareavailableathttps://www.hdfcbank.com/personal/making-payments/online-tax-payment/goods-and-service-tax. RegisteredOfficeAddress:HDFCBankHouse,SenapatiBapatMarg,LowerParel,Mumbai400013", "raw": "UPI-SHAKUNTALADEVI BABL-PAYTM.S16IECC@P *Closingbalanceincludesfundsearmarkedforholdandunclearedfunds Contentsofthisstatementwillbeconsideredcorrectifnoerrorisreportedwithin30daysofreceiptofstatement.TheaddressonthisstatementisthatonrecordwiththeBankasatthedayofrequesting thisstatement. StateaccountbranchGSTN:27AAACH2702H1Z0 HDFCBankGSTINnumberdetailsareavailableathttps://www.hdfcbank.com/personal/making-payments/online-tax-payment/goods-and-service-tax. RegisteredOfficeAddress:HDFCBankHouse,SenapatiBapatMarg,LowerParel,Mumbai400013", "amount": 10.0, "type": "expense", "debit": 10.0, "credit": 0.0, "balance": 354.98, "page": "Page 8", "line": "60", "store": null, "commodity": null, "reference": "0000108589388371", "upi_id": "SHAKUNTALADEVI", "bankCode": "HDFC", "ifsc": null, "transaction_id": null}, {"date": "23/07/25", "date_iso": "2025-07-23", "description": "UPI-MHATREVAISHALI DINE-KADAMVAISHALI57 72@OKHDFCBANK-TDCB0000001-108591818665-U PI", "raw": "UPI-MHATREVAISHALI DINE-KADAMVAISHALI57 72@OKHDFCBANK-TDCB0000001-108591818665-U PI", "amount": 15.0, "type": "expense", "debit": 15.0, "credit": 0.0, "balance": 339.98, "page": "Page 9", "line": "26", "store": null, "commodity": null, "reference": "0000108591818665", "upi_id": "MHATREVAISHALI", "bankCode": "HDFC", "ifsc": "TDCB0000001", "transaction_id": null}, {"date": "24/07/25", "date_iso": "2025-07-24", "description": "UPI-AADESHVISHNU BHOIR-AADESHBHOIR7888@ OKAXIS-KKBK0000628-108643114872-UPI", "raw": "UPI-AADESHVISHNU BHOIR-AADESHBHOIR7888@ OKAXIS-KKBK0000628-108643114872-UPI", "amount": 15.0, "type": "expense", "debit": 15.0, "credit": 0.0, "balance": 154.98, "page": "Page 9", "line": "38", "store": null, "commodity": null, "reference": "0000108643114872", "upi_id": "AADESHVISHNU", "bankCode": "HDFC", "ifsc": "KKBK0000628", "transaction_id": null}, {"date": "24/07/25", "date_iso": "2025-07-24", "description": "UPI-MANOJBABULAL GUPTA-PAYTMQR5Z15JO@PT YS-YESB0PTMUPI-108641890194-UPI", "raw": "UPI-MANOJBABULAL GUPTA-PAYTMQR5Z15JO@PT YS-YESB0PTMUPI-108641890194-UPI", "amount": 20.0, "type": "expense", "debit": 20.0, "credit": 0.0, "balance": 169.98, "page": "Page 9", "line": "35", "store": null, "commodity": null, "reference": "0000108641890194", "upi_id": "MANOJBABULAL", "bankCode": "HDFC", "ifsc": "YESB0PTMUPI", "transaction_id": null}, {"date": "24/07/25", "date_iso": "2025-07-24", "description": "UPI-PRADEEPKUMARP KANOJ-KANOJIYAPRADEEP 755@OKAXIS-UBIN0531855-108639365545-UPI", "raw": "UPI-PRADEEPKUMARP KANOJ-KANOJIYAPRADEEP 755@OKAXIS-UBIN0531855-108639365545-UPI", "amount": 50.0, "type": "expense", "debit": 50.0, "credit": 0.0, "balance": 289.98, "page": "Page 9", "line": "29", "store": null, "commodity": null, "reference": "0000108639365545", "upi_id": "PRADEEPKUMARP", "bankCode": "HDFC", "ifsc": "UBIN0531855", "transaction_id": null}, {"date": "24/07/25", "date_iso": "2025-07-24", "description": "UPI-PRADEEPKUMARP KANOJ-KANOJIYAPRADEEP 755@OKAXIS-UBIN0531855-108639548607-UPI", "raw": "UPI-PRADEEPKUMARP KANOJ-KANOJIYAPRADEEP 755@OKAXIS-UBIN0531855-108639548607-UPI", "amount": 100.0, "type": "expense", "debit": 100.0, "credit": 0.0, "balance": 189.98, "page": "Page 9", "line": "32", "store": null, "commodity": null, "reference": "0000108639548607", "upi_id": "PRADEEPKUMARP", "bankCode": "HDFC", "ifsc": "UBIN0531855", "transaction_id": null}, {"date": "25/07/25", "date_iso": "2025-07-25", "description": "UPI-MRVISHNU MUNSHEELAL-VISHUNVISHWAKAR MA90211-2@OKAXIS-IDIB000M764-55722256619 7-UPI", "raw": "UPI-MRVISHNU MUNSHEELAL-VISHUNVISHWAKAR MA90211-2@OKAXIS-IDIB000M764-55722256619 7-UPI", "amount": 2000.0, "type": "income", "debit": 0.0, "credit": 2000.0, "balance": 2154.98, "page": "Page 9", "line": "42", "store": null, "commodity": null, "reference": "0000557222566197", "upi_id": "MRVISHNU", "bankCode": "HDFC", "ifsc": "IDIB000M764", "transaction_id": null}, {"date": "25/07/25", "date_iso": "2025-07-25", "description": "UPI-SHREEJI COLLECTION-PAYTMQR603HQ7@PTY S-YESB0PTMUPI-108694424450-UPI", "raw": "UPI-SHREEJI COLLECTION-PAYTMQR603HQ7@PTY S-YESB0PTMUPI-108694424450-UPI", "amount": 270.0, "type": "expense", "debit": 270.0, "credit": 0.0, "balance": 1884.98, "page": "Page 9", "line": "45", "store": null, "commodity": null, "reference": "0000108694424450", "upi_id": "SHREEJI", "bankCode": "HDFC", "ifsc": "YESB0PTMUPI", "transaction_id": null}, {"date": "25/07/25", "date_iso": "2025-07-25", "description": "UPI-SATYAPRAKASHRAMDIN -BHARATPE.900664 27005@FBPE-FDRL0001382-108695039830-PAY TOBHARATPEME", "raw": "UPI-SATYAPRAKASHRAMDIN -BHARATPE.900664 27005@FBPE-FDRL0001382-108695039830-PAY TOBHARATPEME", "amount": 300.0, "type": "expense", "debit": 300.0, "credit": 0.0, "balance": 1584.98, "page": "Page 9", "line": "49", "store": null, "commodity": null, "reference": "0000108695039830", "upi_id": "SATYAPRAKASHRAMDIN", "bankCode": "HDFC", "ifsc": "FDRL0001382", "transaction_id": null}, {"date": "26/07/25", "date_iso": "2025-07-26", "description": "UPI-SANIKARAJESHPATIL-PATILSANIKA26082 006@OKHDFCBANK-BARB0MANPAD-108717183056- UPI", "raw": "UPI-SANIKARAJESHPATIL-PATILSANIKA26082 006@OKHDFCBANK-BARB0MANPAD-108717183056- UPI", "amount": 25.0, "type": "expense", "debit": 25.0, "credit": 0.0, "balance": 1559.98, "page": "Page 9", "line": "52", "store": null, "commodity": null, "reference": "0000108717183056", "upi_id": "SANIKARAJESHPATIL", "bankCode": "HDFC", "ifsc": "BARB0MANPAD", "transaction_id": null}, {"date": "26/07/25", "date_iso": "2025-07-26", "description": "UPI-ANKITDEVENDRA *Closingbalanceincludesfundsearmarkedforholdandunclearedfunds Contentsofthisstatementwillbeconsideredcorrectifnoerrorisreportedwithin30daysofreceiptofstatement.TheaddressonthisstatementisthatonrecordwiththeBankasatthedayofrequesting thisstatement. StateaccountbranchGSTN:27AAACH2702H1Z0 HDFCBankGSTINnumberdetailsareavailableathttps://www.hdfcbank.com/personal/making-payments/online-tax-payment/goods-and-service-tax. RegisteredOfficeAddress:HDFCBankHouse,SenapatiBapatMarg,LowerParel,Mumbai400013", "raw": "UPI-ANKITDEVENDRA *Closingbalanceincludesfundsearmarkedforholdandunclearedfunds Contentsofthisstatementwillbeconsideredcorrectifnoerrorisreportedwithin30daysofreceiptofstatement.TheaddressonthisstatementisthatonrecordwiththeBankasatthedayofrequesting thisstatement. StateaccountbranchGSTN:27AAACH2702H1Z0 HDFCBankGSTINnumberdetailsareavailableathttps://www.hdfcbank.com/personal/making-payments/online-tax-payment/goods-and-service-tax. RegisteredOfficeAddress:HDFCBankHouse,SenapatiBapatMarg,LowerParel,Mumbai400013", "amount": 15.0, "type": "expense", "debit": 15.0, "credit": 0.0, "balance": 1544.98, "page": "Page 9", "line": "60", "store": null, "commodity": null, "reference": "0000108731417831", "upi_id": "ANKITDEVENDRA", "bankCode": "HDFC", "ifsc": null, "transaction_id": null}, {"date": "26/07/25", "date_iso": "2025-07-26", "description": "UPI-ANKITDEVENDRA SINGH-PAYTM.S1JCL3X@P TY-YESB0MCHUPI-108731993990-UPI", "raw": "UPI-ANKITDEVENDRA SINGH-PAYTM.S1JCL3X@P TY-YESB0MCHUPI-108731993990-UPI", "amount": 15.0, "type": "expense", "debit": 15.0, "credit": 0.0, "balance": 1529.98, "page": "Page 10", "line": "26", "store": null, "commodity": null, "reference": "0000108731993990", "upi_id": "ANKITDEVENDRA", "bankCode": "HDFC", "ifsc": "YESB0MCHUPI", "transaction_id": null}, {"date": "26/07/25", "date_iso": "2025-07-26", "description": "UPI-HINGLAJ MART-Q624165911@YBL-YESB0YBL UPI-108738969079-UPI", "raw": "UPI-HINGLAJ MART-Q624165911@YBL-YESB0YBL UPI-108738969079-UPI", "amount": 394.0, "type": "expense", "debit": 394.0, "credit": 0.0, "balance": 1135.98, "page": "Page 10", "line": "29", "store": null, "commodity": null, "reference": "0000108738969079", "upi_id": "HINGLAJ", "bankCode": "HDFC", "ifsc": null, "transaction_id": null}, {"date": "27/07/25", "date_iso": "2025-07-27", "description": "UPI-MAMTAMUNSHEELAL VIS-MAMTAVISHWAKARM A0948-1@OKHDFCBANK-KKBK0001432-108785862 792-UPI", "raw": "UPI-MAMTAMUNSHEELAL VIS-MAMTAVISHWAKARM A0948-1@OKHDFCBANK-KKBK0001432-108785862 792-UPI", "amount": 500.0, "type": "expense", "debit": 500.0, "credit": 0.0, "balance": 635.98, "page": "Page 10", "line": "33", "store": null, "commodity": null, "reference": "0000108785862792", "upi_id": "MAMTAMUNSHEELAL", "bankCode": "HDFC", "ifsc": "KKBK0001432", "transaction_id": null}, {"date": "28/07/25", "date_iso": "2025-07-28", "description": "UPI-SHIVSHANKERRAJESH-BHARATPE.9A0Z0B 0B0P354295@UNITYPE-UNBA000BHPE-108850837 964-PAYTOBHARATPEME", "raw": "UPI-SHIVSHANKERRAJESH-BHARATPE.9A0Z0B 0B0P354295@UNITYPE-UNBA000BHPE-108850837 964-PAYTOBHARATPEME", "amount": 20.0, "type": "expense", "debit": 20.0, "credit": 0.0, "balance": 535.98, "page": "Page 10", "line": "42", "store": null, "commodity": null, "reference": "0000108850837964", "upi_id": "SHIVSHANKERRAJESH", "bankCode": "HDFC", "ifsc": "UNBA000BHPE", "transaction_id": null}, {"date": "28/07/25", "date_iso": "2025-07-28", "description": "UPI-VISHALAKUMAR RAMBHAV-PAYTMQR65HWHY@P TYS-YESB0PTMUPI-108850182970-UPI", "raw": "UPI-VISHALAKUMAR RAMBHAV-PAYTMQR65HWHY@P TYS-YESB0PTMUPI-108850182970-UPI", "amount": 30.0, "type": "expense", "debit": 30.0, "credit": 0.0, "balance": 605.98, "page": "Page 10", "line": "36", "store": null, "commodity": null, "reference": "0000108850182970", "upi_id": "VISHALAKUMAR", "bankCode": "HDFC", "ifsc": "YESB0PTMUPI", "transaction_id": null}, {"date": "28/07/25", "date_iso": "2025-07-28", "description": "UPI-SHAKUNTALADEVI BABL-PAYTM.S16IECC@P TY-YESB0MCHUPI-108850681095-UPI", "raw": "UPI-SHAKUNTALADEVI BABL-PAYTM.S16IECC@P TY-YESB0MCHUPI-108850681095-UPI", "amount": 50.0, "type": "expense", "debit": 50.0, "credit": 0.0, "balance": 555.98, "page": "Page 10", "line": "39", "store": null, "commodity": null, "reference": "0000108850681095", "upi_id": "SHAKUNTALADEVI", "bankCode": "HDFC", "ifsc": "YESB0MCHUPI", "transaction_id": null}, {"date": "29/07/25", "date_iso": "2025-07-29", "description": "UPI-SHUBHAM GUPTA-GPAY-11259507120@OKBIZ AXIS-UTIB0000553-108902435079-UPI", "raw": "UPI-SHUBHAM GUPTA-GPAY-11259507120@OKBIZ AXIS-UTIB0000553-108902435079-UPI", "amount": 15.0, "type": "expense", "debit": 15.0, "credit": 0.0, "balance": 450.98, "page": "Page 10", "line": "51", "store": null, "commodity": null, "reference": "0000108902435079", "upi_id": "SHUBHAM", "bankCode": "HDFC", "ifsc": "UTIB0000553", "transaction_id": null}, {"date": "29/07/25", "date_iso": "2025-07-29", "description": "UPI-SHIVAM-BHARATPE.90068950272@FBPE-FDR L0001382-108901281841-PAYTOBHARATPEME", "raw": "UPI-SHIVAM-BHARATPE.90068950272@FBPE-FDR L0001382-108901281841-PAYTOBHARATPEME", "amount": 10.0, "type": "expense", "debit": 10.0, "credit": 0.0, "balance": 465.98, "page": "Page 10", "line": "48", "store": null, "commodity": null, "reference": "0000108901281841", "upi_id": "SHIVAM", "bankCode": "HDFC", "ifsc": null, "transaction_id": null}, {"date": "29/07/25", "date_iso": "2025-07-29", "description": "UPI-TEJSHREEDEEPAKPATI-Q897947740@YBL- YESB0YBLUPI-108900787062-UPI", "raw": "UPI-TEJSHREEDEEPAKPATI-Q897947740@YBL- YESB0YBLUPI-108900787062-UPI", "amount": 30.0, "type": "expense", "debit": 30.0, "credit": 0.0, "balance": 505.98, "page": "Page 10", "line": "44", "store": null, "commodity": null, "reference": "0000108900787062", "upi_id": "TEJSHREEDEEPAKPATI", "bankCode": "HDFC", "ifsc": "YESB0YBLUPI", "transaction_id": null}, {"date": "29/07/25", "date_iso": "2025-07-29", "description": "UPI-SHIVAM-BHARATPE.90068950272@FBPE-FDR L0001382-108901170307-PAYTOBHARATPEME", "raw": "UPI-SHIVAM-BHARATPE.90068950272@FBPE-FDR L0001382-108901170307-PAYTOBHARATPEME", "amount": 30.0, "type": "expense", "debit": 30.0, "credit": 0.0, "balance": 475.98, "page": "Page 10", "line": "46", "store": null, "commodity": null, "reference": "0000108901170307", "upi_id": "SHIVAM", "bankCode": "HDFC", "ifsc": null, "transaction_id": null}, {"date": "30/07/25", "date_iso": "2025-07-30", "description": "UPI-IRCTCUTS-PAYTM-8796946@PTYBL-YESB0P TMUPI-108921000806-UPI *Closingbalanceincludesfundsearmarkedforholdandunclearedfunds Contentsofthisstatementwillbeconsideredcorrectifnoerrorisreportedwithin30daysofreceiptofstatement.TheaddressonthisstatementisthatonrecordwiththeBankasatthedayofrequesting thisstatement. StateaccountbranchGSTN:27AAACH2702H1Z0 HDFCBankGSTINnumberdetailsareavailableathttps://www.hdfcbank.com/personal/making-payments/online-tax-payment/goods-and-service-tax. RegisteredOfficeAddress:HDFCBankHouse,SenapatiBapatMarg,LowerParel,Mumbai400013", "raw": "UPI-IRCTCUTS-PAYTM-8796946@PTYBL-YESB0P TMUPI-108921000806-UPI *Closingbalanceincludesfundsearmarkedforholdandunclearedfunds Contentsofthisstatementwillbeconsideredcorrectifnoerrorisreportedwithin30daysofreceiptofstatement.TheaddressonthisstatementisthatonrecordwiththeBankasatthedayofrequesting thisstatement. StateaccountbranchGSTN:27AAACH2702H1Z0 HDFCBankGSTINnumberdetailsareavailableathttps://www.hdfcbank.com/personal/making-payments/online-tax-payment/goods-and-service-tax. RegisteredOfficeAddress:HDFCBankHouse,SenapatiBapatMarg,LowerParel,Mumbai400013", "amount": 130.0, "type": "expense", "debit": 130.0, "credit": 0.0, "balance": 320.98, "page": "Page 10", "line": "60", "store": null, "commodity": null, "reference": "0000108921000806", "upi_id": "IRCTCUTS", "bankCode": "HDFC", "ifsc": null, "transaction_id": null}, {"date": "30/07/25", "date_iso": "2025-07-30", "description": "NWD-541919XXXXXX1984-MPB02576-GREATER MU MBA", "raw": "NWD-541919XXXXXX1984-MPB02576-GREATER MU MBA", "amount": 100.0, "type": "expense", "debit": 100.0, "credit": 0.0, "balance": 220.98, "page": "Page 11", "line": "24", "store": null, "commodity": null, "reference": "0000521118728702", "upi_id": null, "bankCode": "HDFC", "ifsc": null, "transaction_id": null}, {"date": "30/07/25", "date_iso": "2025-07-30", "description": "UPI-SHAKUNTALADEVI BABL-PAYTM.S16IECC@P TY-YESB0MCHUPI-108953367765-UPI", "raw": "UPI-SHAKUNTALADEVI BABL-PAYTM.S16IECC@P TY-YESB0MCHUPI-108953367765-UPI", "amount": 20.0, "type": "expense", "debit": 20.0, "credit": 0.0, "balance": 200.98, "page": "Page 11", "line": "27", "store": null, "commodity": null, "reference": "0000108953367765", "upi_id": "SHAKUNTALADEVI", "bankCode": "HDFC", "ifsc": "YESB0MCHUPI", "transaction_id": null}, {"date": "01/08/25", "date_iso": "2025-01-08", "description": "UPI-AYUSHIKANSINGH CHAU-AYUSHICHAUHAN00 7007@OKSBI-BCBM0000006-521376813137-UPI", "raw": "UPI-AYUSHIKANSINGH CHAU-AYUSHICHAUHAN00 7007@OKSBI-BCBM0000006-521376813137-UPI", "amount": 25.0, "type": "income", "debit": 0.0, "credit": 25.0, "balance": 275.98, "page": "Page 11", "line": "36", "store": null, "commodity": null, "reference": "0000521376813137", "upi_id": "AYUSHIKANSINGH", "bankCode": "HDFC", "ifsc": "BCBM0000006", "transaction_id": null}, {"date": "01/08/25", "date_iso": "2025-01-08", "description": "UPI-NIVEDITHAP GANAPATHI-UDUPANIVEDITHA0 4@OKAXIS-CNRB0000033-557951101700-UPI", "raw": "UPI-NIVEDITHAP GANAPATHI-UDUPANIVEDITHA0 4@OKAXIS-CNRB0000033-557951101700-UPI", "amount": 25.0, "type": "income", "debit": 0.0, "credit": 25.0, "balance": 225.98, "page": "Page 11", "line": "30", "store": null, "commodity": null, "reference": "0000557951101700", "upi_id": "NIVEDITHAP", "bankCode": "HDFC", "ifsc": "CNRB0000033", "transaction_id": null}, {"date": "01/08/25", "date_iso": "2025-01-08", "description": "UPI-MANSISUBHASH MANDAL-MANDALEMANSI44@ OKICICI-KKBK0001400-557953982408-UPI", "raw": "UPI-MANSISUBHASH MANDAL-MANDALEMANSI44@ OKICICI-KKBK0001400-557953982408-UPI", "amount": 25.0, "type": "income", "debit": 0.0, "credit": 25.0, "balance": 250.98, "page": "Page 11", "line": "33", "store": null, "commodity": null, "reference": "0000557953982408", "upi_id": "MANSISUBHASH", "bankCode": "HDFC", "ifsc": "KKBK0001400", "transaction_id": null}, {"date": "01/08/25", "date_iso": "2025-01-08", "description": "UPI-GANESHBALKRISHNA JA-SHRIGANESHA8339 2@YBL-UBIN0901407-109035851749-UPI", "raw": "UPI-GANESHBALKRISHNA JA-SHRIGANESHA8339 2@YBL-UBIN0901407-109035851749-UPI", "amount": 125.0, "type": "expense", "debit": 125.0, "credit": 0.0, "balance": 150.98, "page": "Page 11", "line": "39", "store": null, "commodity": null, "reference": "0000109035851749", "upi_id": "GANESHBALKRISHNA", "bankCode": "HDFC", "ifsc": "UBIN0901407", "transaction_id": null}, {"date": "02/08/25", "date_iso": "2025-02-08", "description": "UPI-SHAKUNTALADEVI BABL-PAYTM.S16IECC@P TY-YESB0MCHUPI-109123562191-UPI", "raw": "UPI-SHAKUNTALADEVI BABL-PAYTM.S16IECC@P TY-YESB0MCHUPI-109123562191-UPI", "amount": 25.0, "type": "expense", "debit": 25.0, "credit": 0.0, "balance": 105.98, "page": "Page 11", "line": "45", "store": null, "commodity": null, "reference": "0000109123562191", "upi_id": "SHAKUNTALADEVI", "bankCode": "HDFC", "ifsc": "YESB0MCHUPI", "transaction_id": null}, {"date": "02/08/25", "date_iso": "2025-02-08", "description": "UPI-AYUSHIKANSINGH CHAU-AYUSHICHAUHAN00 7007@OKSBI-BCBM0000006-109098147339-UPI", "raw": "UPI-AYUSHIKANSINGH CHAU-AYUSHICHAUHAN00 7007@OKSBI-BCBM0000006-109098147339-UPI", "amount": 20.0, "type": "expense", "debit": 20.0, "credit": 0.0, "balance": 130.98, "page": "Page 11", "line": "42", "store": null, "commodity": null, "reference": "0000109098147339", "upi_id": "AYUSHIKANSINGH", "bankCode": "HDFC", "ifsc": "BCBM0000006", "transaction_id": null}, {"date": "02/08/25", "date_iso": "2025-02-08", "description": "UPI-DEEPAKCHANDRAJEET Y-PAYTMQR6CO1NJ@P TYS-YESB0PTMUPI-109125124420-UPI", "raw": "UPI-DEEPAKCHANDRAJEET Y-PAYTMQR6CO1NJ@P TYS-YESB0PTMUPI-109125124420-UPI", "amount": 25.0, "type": "expense", "debit": 25.0, "credit": 0.0, "balance": 80.98, "page": "Page 11", "line": "48", "store": null, "commodity": null, "reference": "0000109125124420", "upi_id": "DEEPAKCHANDRAJEET", "bankCode": "HDFC", "ifsc": "YESB0PTMUPI", "transaction_id": null}, {"date": "04/08/25", "date_iso": "2025-04-08", "description": "UPI-SHAKUNTALADEVI BABL-PAYTM.S16IECC@P *Closingbalanceincludesfundsearmarkedforholdandunclearedfunds Contentsofthisstatementwillbeconsideredcorrectifnoerrorisreportedwithin30daysofreceiptofstatement.TheaddressonthisstatementisthatonrecordwiththeBankasatthedayofrequesting thisstatement. StateaccountbranchGSTN:27AAACH2702H1Z0 HDFCBankGSTINnumberdetailsareavailableathttps://www.hdfcbank.com/personal/making-payments/online-tax-payment/goods-and-service-tax. RegisteredOfficeAddress:HDFCBankHouse,SenapatiBapatMarg,LowerParel,Mumbai400013", "raw": "UPI-SHAKUNTALADEVI BABL-PAYTM.S16IECC@P *Closingbalanceincludesfundsearmarkedforholdandunclearedfunds Contentsofthisstatementwillbeconsideredcorrectifnoerrorisreportedwithin30daysofreceiptofstatement.TheaddressonthisstatementisthatonrecordwiththeBankasatthedayofrequesting thisstatement. StateaccountbranchGSTN:27AAACH2702H1Z0 HDFCBankGSTINnumberdetailsareavailableathttps://www.hdfcbank.com/personal/making-payments/online-tax-payment/goods-and-service-tax. RegisteredOfficeAddress:HDFCBankHouse,SenapatiBapatMarg,LowerParel,Mumbai400013", "amount": 20.0, "type": "expense", "debit": 20.0, "credit": 0.0, "balance": 30.98, "page": "Page 11", "line": "60", "store": null, "commodity": null, "reference": "0000109242027127", "upi_id": "SHAKUNTALADEVI", "bankCode": "HDFC", "ifsc": null, "transaction_id": null}, {"date": "04/08/25", "date_iso": "2025-04-08", "description": "UPI-DEEPAKKESHAV PATIL-PAYTMQR6JM3KE@PT YS-YESB0PTMUPI-109241608690-UPI", "raw": "UPI-DEEPAKKESHAV PATIL-PAYTMQR6JM3KE@PT YS-YESB0PTMUPI-109241608690-UPI", "amount": 30.0, "type": "expense", "debit": 30.0, "credit": 0.0, "balance": 50.98, "page": "Page 11", "line": "51", "store": null, "commodity": null, "reference": "0000109241608690", "upi_id": "DEEPAKKESHAV", "bankCode": "HDFC", "ifsc": "YESB0PTMUPI", "transaction_id": null}, {"date": "05/08/25", "date_iso": "2025-05-08", "description": "UPI-SHIVSHANKERRAJESH -BHARATPE.9H0L0N 0R4M280313@UNITYPE-UNBA000BHPE-109299697 434-PAYTOBHARATPEME", "raw": "UPI-SHIVSHANKERRAJESH -BHARATPE.9H0L0N 0R4M280313@UNITYPE-UNBA000BHPE-109299697 434-PAYTOBHARATPEME", "amount": 20.0, "type": "expense", "debit": 20.0, "credit": 0.0, "balance": 10.98, "page": "Page 12", "line": "26", "store": null, "commodity": null, "reference": "0000109299697434", "upi_id": "SHIVSHANKERRAJESH", "bankCode": "HDFC", "ifsc": "UNBA000BHPE", "transaction_id": null}, {"date": "06/08/25", "date_iso": "2025-06-08", "description": "UPI-MRMUNSHEELAL RAMSUR-MUNSHILALVISHWA KARMA210@OKSBI-IDIB000M764-109322121489- UPI", "raw": "UPI-MRMUNSHEELAL RAMSUR-MUNSHILALVISHWA KARMA210@OKSBI-IDIB000M764-109322121489- UPI", "amount": 1000.0, "type": "income", "debit": 0.0, "credit": 1000.0, "balance": 19543.98, "page": "Page 12", "line": "35", "store": null, "commodity": null, "reference": "0000109322121489", "upi_id": "MRMUNSHEELAL", "bankCode": "HDFC", "ifsc": "IDIB000M764", "transaction_id": null}, {"date": "06/08/25", "date_iso": "2025-06-08", "description": "UPI-MRVISHNU MUNSHEELAL-VISHUNVISHWAKAR MA90211-2@OKAXIS-IDIB000M764-10932214680 3-UPI", "raw": "UPI-MRVISHNU MUNSHEELAL-VISHUNVISHWAKAR MA90211-2@OKAXIS-IDIB000M764-10932214680 3-UPI", "amount": 2000.0, "type": "expense", "debit": 2000.0, "credit": 0.0, "balance": 17543.98, "page": "Page 12", "line": "39", "store": null, "commodity": null, "reference": "0000109322146803", "upi_id": "MRVISHNU", "bankCode": "HDFC", "ifsc": "IDIB000M764", "transaction_id": null}, {"date": "06/08/25", "date_iso": "2025-06-08", "description": "UPI-AYUSHIKANSINGH CHAU-AYUSHICHAUHAN00 7007@OKSBI-BCBM0000006-109337677142-UPI", "raw": "UPI-AYUSHIKANSINGH CHAU-AYUSHICHAUHAN00 7007@OKSBI-BCBM0000006-109337677142-UPI", "amount": 50.0, "type": "expense", "debit": 50.0, "credit": 0.0, "balance": 17493.98, "page": "Page 12", "line": "42", "store": null, "commodity": null, "reference": "0000109337677142", "upi_id": "AYUSHIKANSINGH", "bankCode": "HDFC", "ifsc": "BCBM0000006", "transaction_id": null}, {"date": "06/08/25", "date_iso": "2025-06-08", "description": "UPI-SHAKUNTALADEVI BABL-PAYTM.S16IECC@P TY-YESB0MCHUPI-109357336816-UPI", "raw": "UPI-SHAKUNTALADEVI BABL-PAYTM.S16IECC@P TY-YESB0MCHUPI-109357336816-UPI", "amount": 30.0, "type": "expense", "debit": 30.0, "credit": 0.0, "balance": 17463.98, "page": "Page 12", "line": "45", "store": null, "commodity": null, "reference": "0000109357336816", "upi_id": "SHAKUNTALADEVI", "bankCode": "HDFC", "ifsc": "YESB0MCHUPI", "transaction_id": null}, {"date": "06/08/25", "date_iso": "2025-06-08", "description": "UPI-RAHULKISAN SHAH-BHARATPE.9H0O0K0J1M 916664@UNITYPE-UNBA000BHPE-109357383812- PAYTOBHARATPEME", "raw": "UPI-RAHULKISAN SHAH-BHARATPE.9H0O0K0J1M 916664@UNITYPE-UNBA000BHPE-109357383812- PAYTOBHARATPEME", "amount": 20.0, "type": "expense", "debit": 20.0, "credit": 0.0, "balance": 17443.98, "page": "Page 12", "line": "49", "store": null, "commodity": null, "reference": "0000109357383812", "upi_id": "RAHULKISAN", "bankCode": "HDFC", "ifsc": "UNBA000BHPE", "transaction_id": null}, {"date": "06/08/25", "date_iso": "2025-06-08", "description": "UPI-SHREESHIVSHAMBHU D-PAYTMQR6JJ0KC@P TYS-YESB0PTMUPI-109358950490-UPI", "raw": "UPI-SHREESHIVSHAMBHU D-PAYTMQR6JJ0KC@P TYS-YESB0PTMUPI-109358950490-UPI", "amount": 100.0, "type": "expense", "debit": 100.0, "credit": 0.0, "balance": 17343.98, "page": "Page 12", "line": "52", "store": null, "commodity": null, "reference": "0000109358950490", "upi_id": "SHREESHIVSHAMBHU", "bankCode": "HDFC", "ifsc": "YESB0PTMUPI", "transaction_id": null}, {"date": "06/08/25", "date_iso": "2025-06-08", "description": "UPI-NARSINGHLALSINGH *Closingbalanceincludesfundsearmarkedforholdandunclearedfunds Contentsofthisstatementwillbeconsideredcorrectifnoerrorisreportedwithin30daysofreceiptofstatement.TheaddressonthisstatementisthatonrecordwiththeBankasatthedayofrequesting thisstatement. StateaccountbranchGSTN:27AAACH2702H1Z0 HDFCBankGSTINnumberdetailsareavailableathttps://www.hdfcbank.com/personal/making-payments/online-tax-payment/goods-and-service-tax. RegisteredOfficeAddress:HDFCBankHouse,SenapatiBapatMarg,LowerParel,Mumbai400013", "raw": "UPI-NARSINGHLALSINGH *Closingbalanceincludesfundsearmarkedforholdandunclearedfunds Contentsofthisstatementwillbeconsideredcorrectifnoerrorisreportedwithin30daysofreceiptofstatement.TheaddressonthisstatementisthatonrecordwiththeBankasatthedayofrequesting thisstatement. StateaccountbranchGSTN:27AAACH2702H1Z0 HDFCBankGSTINnumberdetailsareavailableathttps://www.hdfcbank.com/personal/making-payments/online-tax-payment/goods-and-service-tax. RegisteredOfficeAddress:HDFCBankHouse,SenapatiBapatMarg,LowerParel,Mumbai400013", "amount": 30.0, "type": "expense", "debit": 30.0, "credit": 0.0, "balance": 17313.98, "page": "Page 12", "line": "60", "store": null, "commodity": null, "reference": "0000109359397755", "upi_id": "NARSINGHLALSINGH", "bankCode": "HDFC", "ifsc": null, "transaction_id": null}, {"date": "06/08/25", "date_iso": "2025-06-08", "description": "UPI-SURAJKUMARRAMJI GU-CADBURYROAD143- 1@OKAXIS-UBIN0558401-109374741094-UPI", "raw": "UPI-SURAJKUMARRAMJI GU-CADBURYROAD143- 1@OKAXIS-UBIN0558401-109374741094-UPI", "amount": 171.0, "type": "expense", "debit": 171.0, "credit": 0.0, "balance": 17142.98, "page": "Page 13", "line": "26", "store": null, "commodity": null, "reference": "0000109374741094", "upi_id": "SURAJKUMARRAMJI", "bankCode": "HDFC", "ifsc": "UBIN0558401", "transaction_id": null}, {"date": "06/08/25", "date_iso": "2025-06-08", "description": "UPI-DMARTAVENUE SUPERMA-DMARTAVENUESUPE RMART.41489727@HDFCBANK-HDFC0MERUPI-1093 76371254-UPI", "raw": "UPI-DMARTAVENUE SUPERMA-DMARTAVENUESUPE RMART.41489727@HDFCBANK-HDFC0MERUPI-1093 76371254-UPI", "amount": 12244.53, "type": "expense", "debit": 12244.53, "credit": 0.0, "balance": 4898.45, "page": "Page 13", "line": "30", "store": null, "commodity": null, "reference": "0000109376371254", "upi_id": "DMARTAVENUE", "bankCode": "HDFC", "ifsc": "HDFC0MERUPI", "transaction_id": null}, {"date": "07/08/25", "date_iso": "2025-07-08", "description": "UPI-VALRAMSUPER MART-GPAY-11256374897@O KBIZAXIS-UTIB0000553-558537029908-UPI", "raw": "UPI-VALRAMSUPER MART-GPAY-11256374897@O KBIZAXIS-UTIB0000553-558537029908-UPI", "amount": 44.0, "type": "expense", "debit": 44.0, "credit": 0.0, "balance": 2859.45, "page": "Page 13", "line": "41", "store": null, "commodity": null, "reference": "0000558537029908", "upi_id": "VALRAMSUPER", "bankCode": "HDFC", "ifsc": "UTIB0000553", "transaction_id": null}, {"date": "07/08/25", "date_iso": "2025-07-08", "description": "UPI-MSAJITHA GUNASEKARA-AJITHANADAR123@ OKAXIS-IDIB000I018-521983293757-UPI", "raw": "UPI-MSAJITHA GUNASEKARA-AJITHANADAR123@ OKAXIS-IDIB000I018-521983293757-UPI", "amount": 15.0, "type": "income", "debit": 0.0, "credit": 15.0, "balance": 2913.45, "page": "Page 13", "line": "35", "store": null, "commodity": null, "reference": "0000521983293757", "upi_id": "MSAJITHA", "bankCode": "HDFC", "ifsc": "IDIB000I018", "transaction_id": null}, {"date": "07/08/25", "date_iso": "2025-07-08", "description": "UPI-SHAKUNTALADEVI BABL-PAYTM.S16IECC@P TY-YESB0MCHUPI-558553506935-UPI", "raw": "UPI-SHAKUNTALADEVI BABL-PAYTM.S16IECC@P TY-YESB0MCHUPI-558553506935-UPI", "amount": 10.0, "type": "expense", "debit": 10.0, "credit": 0.0, "balance": 2903.45, "page": "Page 13", "line": "38", "store": null, "commodity": null, "reference": "0000558553506935", "upi_id": "SHAKUNTALADEVI", "bankCode": "HDFC", "ifsc": "YESB0MCHUPI", "transaction_id": null}, {"date": "07/08/25", "date_iso": "2025-07-08", "description": "ACHD-FININDIANCLEARING-202294979", "raw": "ACHD-FININDIANCLEARING-202294979", "amount": 1000.0, "type": "expense", "debit": 1000.0, "credit": 0.0, "balance": 3898.45, "page": "Page 13", "line": "31", "store": null, "commodity": null, "reference": "0000008072132219", "upi_id": null, "bankCode": "HDFC", "ifsc": null, "transaction_id": null}, {"date": "07/08/25", "date_iso": "2025-07-08", "description": "ACHD-FININDIANCLEARING-202516423", "raw": "ACHD-FININDIANCLEARING-202516423", "amount": 1000.0, "type": "expense", "debit": 1000.0, "credit": 0.0, "balance": 2898.45, "page": "Page 13", "line": "32", "store": null, "commodity": null, "reference": "0000008029985219", "upi_id": null, "bankCode": "HDFC", "ifsc": null, "transaction_id": null}, {"date": "09/08/25", "date_iso": "2025-09-08", "description": "UPI-MRVISHNU MUNSHEELAL-VISHUNVISHWAKAR MA90211-2@OKAXIS-IDIB000M764-52219266330 5-HAPPYRAKHI", "raw": "UPI-MRVISHNU MUNSHEELAL-VISHUNVISHWAKAR MA90211-2@OKAXIS-IDIB000M764-52219266330 5-HAPPYRAKHI", "amount": 500.0, "type": "income", "debit": 0.0, "credit": 500.0, "balance": 3359.45, "page": "Page 13", "line": "45", "store": null, "commodity": null, "reference": "0000522192663305", "upi_id": "MRVISHNU", "bankCode": "HDFC", "ifsc": "IDIB000M764", "transaction_id": null}, {"date": "09/08/25", "date_iso": "2025-09-08", "description": "UPI-SACHINMUNSHEELAL VI-9867926681@KOTA K811-KKBK0001432-522108744617-RAKHI", "raw": "UPI-SACHINMUNSHEELAL VI-9867926681@KOTA K811-KKBK0001432-522108744617-RAKHI", "amount": 1001.0, "type": "income", "debit": 0.0, "credit": 1001.0, "balance": 4360.45, "page": "Page 13", "line": "48", "store": null, "commodity": null, "reference": "0000522108744617", "upi_id": "SACHINMUNSHEELAL", "bankCode": "HDFC", "ifsc": "KKBK0001432", "transaction_id": null}, {"date": "09/08/25", "date_iso": "2025-09-08", "description": "UPI-AYUSHIKANSINGH CHAU-AYUSHICHAUHAN00 7007@OKSBI-BCBM0000006-109515528861-UPI", "raw": "UPI-AYUSHIKANSINGH CHAU-AYUSHICHAUHAN00 7007@OKSBI-BCBM0000006-109515528861-UPI", "amount": 60.0, "type": "expense", "debit": 60.0, "credit": 0.0, "balance": 4300.45, "page": "Page 13", "line": "51", "store": null, "commodity": null, "reference": "0000109515528861", "upi_id": "AYUSHIKANSINGH", "bankCode": "HDFC", "ifsc": "BCBM0000006", "transaction_id": null}, {"date": "09/08/25", "date_iso": "2025-09-08", "description": "UPI-AYUSHIKANSINGH CHAU-AYUSHICHAUHAN00 *Closingbalanceincludesfundsearmarkedforholdandunclearedfunds Contentsofthisstatementwillbeconsideredcorrectifnoerrorisreportedwithin30daysofreceiptofstatement.TheaddressonthisstatementisthatonrecordwiththeBankasatthedayofrequesting thisstatement. StateaccountbranchGSTN:27AAACH2702H1Z0 HDFCBankGSTINnumberdetailsareavailableathttps://www.hdfcbank.com/personal/making-payments/online-tax-payment/goods-and-service-tax. RegisteredOfficeAddress:HDFCBankHouse,SenapatiBapatMarg,LowerParel,Mumbai400013", "raw": "UPI-AYUSHIKANSINGH CHAU-AYUSHICHAUHAN00 *Closingbalanceincludesfundsearmarkedforholdandunclearedfunds Contentsofthisstatementwillbeconsideredcorrectifnoerrorisreportedwithin30daysofreceiptofstatement.TheaddressonthisstatementisthatonrecordwiththeBankasatthedayofrequesting thisstatement. StateaccountbranchGSTN:27AAACH2702H1Z0 HDFCBankGSTINnumberdetailsareavailableathttps://www.hdfcbank.com/personal/making-payments/online-tax-payment/goods-and-service-tax. RegisteredOfficeAddress:HDFCBankHouse,SenapatiBapatMarg,LowerParel,Mumbai400013", "amount": 30.0, "type": "income", "debit": 0.0, "credit": 30.0, "balance": 4330.45, "page": "Page 13", "line": "60", "store": null, "commodity": null, "reference": "0000522132798334", "upi_id": "AYUSHIKANSINGH", "bankCode": "HDFC", "ifsc": null, "transaction_id": null}, {"date": "09/08/25", "date_iso": "2025-09-08", "description": "UPI-SHREEGOPAL DAIRY-PAYTM.S1FLLTA@PTY- YESB0MCHUPI-109520501057-UPI", "raw": "UPI-SHREEGOPAL DAIRY-PAYTM.S1FLLTA@PTY- YESB0MCHUPI-109520501057-UPI", "amount": 80.0, "type": "expense", "debit": 80.0, "credit": 0.0, "balance": 4250.45, "page": "Page 14", "line": "25", "store": null, "commodity": null, "reference": "0000109520501057", "upi_id": "SHREEGOPAL", "bankCode": "HDFC", "ifsc": "YESB0MCHUPI", "transaction_id": null}, {"date": "09/08/25", "date_iso": "2025-09-08", "description": "UPI-SHREESHIVSHAMBHUDA-GPAY-1125625191 0@OKBIZAXIS-UTIB0000553-109521432149-UPI", "raw": "UPI-SHREESHIVSHAMBHUDA-GPAY-1125625191 0@OKBIZAXIS-UTIB0000553-109521432149-UPI", "amount": 100.0, "type": "expense", "debit": 100.0, "credit": 0.0, "balance": 4150.45, "page": "Page 14", "line": "27", "store": null, "commodity": null, "reference": "0000109521432149", "upi_id": "SHREESHIVSHAMBHUDA", "bankCode": "HDFC", "ifsc": "UTIB0000553", "transaction_id": null}, {"date": "11/08/25", "date_iso": "2025-11-08", "description": "UPI-VALRAMSUPER MART-GPAY-11256374897@O KBIZAXIS-UTIB0000553-109650223101-UPI", "raw": "UPI-VALRAMSUPER MART-GPAY-11256374897@O KBIZAXIS-UTIB0000553-109650223101-UPI", "amount": 35.0, "type": "expense", "debit": 35.0, "credit": 0.0, "balance": 1990.45, "page": "Page 14", "line": "45", "store": null, "commodity": null, "reference": "0000109650223101", "upi_id": "VALRAMSUPER", "bankCode": "HDFC", "ifsc": "UTIB0000553", "transaction_id": null}, {"date": "11/08/25", "date_iso": "2025-11-08", "description": "ACHD-FININDIANCLEARING-204175074", "raw": "ACHD-FININDIANCLEARING-204175074", "amount": 1000.0, "type": "expense", "debit": 1000.0, "credit": 0.0, "balance": 3150.45, "page": "Page 14", "line": "28", "store": null, "commodity": null, "reference": "0000008665817223", "upi_id": null, "bankCode": "HDFC", "ifsc": null, "transaction_id": null}, {"date": "11/08/25", "date_iso": "2025-11-08", "description": "ACHD-FININDIANCLEARING-203195447", "raw": "ACHD-FININDIANCLEARING-203195447", "amount": 1000.0, "type": "expense", "debit": 1000.0, "credit": 0.0, "balance": 2150.45, "page": "Page 14", "line": "29", "store": null, "commodity": null, "reference": "0000008804492223", "upi_id": null, "bankCode": "HDFC", "ifsc": null, "transaction_id": null}, {"date": "11/08/25", "date_iso": "2025-11-08", "description": "UPI-PRAJAPATI RAMPRAKASH-PAYTMQR6CQC3J@P TYS-YESB0PTMUPI-109647953202-UPI", "raw": "UPI-PRAJAPATI RAMPRAKASH-PAYTMQR6CQC3J@P TYS-YESB0PTMUPI-109647953202-UPI", "amount": 40.0, "type": "expense", "debit": 40.0, "credit": 0.0, "balance": 2110.45, "page": "Page 14", "line": "32", "store": null, "commodity": null, "reference": "0000109647953202", "upi_id": "PRAJAPATI", "bankCode": "HDFC", "ifsc": "YESB0PTMUPI", "transaction_id": null}, {"date": "11/08/25", "date_iso": "2025-11-08", "description": "UPI-AMIRCHAND-BHARATPE.90068998941@FBPE- FDRL0001382-109648354035-PAYTOBHARATPE ME", "raw": "UPI-AMIRCHAND-BHARATPE.90068998941@FBPE- FDRL0001382-109648354035-PAYTOBHARATPE ME", "amount": 15.0, "type": "expense", "debit": 15.0, "credit": 0.0, "balance": 2095.45, "page": "Page 14", "line": "35", "store": null, "commodity": null, "reference": "0000109648354035", "upi_id": "AMIRCHAND", "bankCode": "HDFC", "ifsc": "FDRL0001382", "transaction_id": null}, {"date": "11/08/25", "date_iso": "2025-11-08", "description": "UPI-ANILKUMAR GUPTA-PAYTMQR6N4VNV@PTYS- YESB0PTMUPI-109648500056-UPI", "raw": "UPI-ANILKUMAR GUPTA-PAYTMQR6N4VNV@PTYS- YESB0PTMUPI-109648500056-UPI", "amount": 30.0, "type": "expense", "debit": 30.0, "credit": 0.0, "balance": 2065.45, "page": "Page 14", "line": "38", "store": null, "commodity": null, "reference": "0000109648500056", "upi_id": "ANILKUMAR", "bankCode": "HDFC", "ifsc": "YESB0PTMUPI", "transaction_id": null}, {"date": "11/08/25", "date_iso": "2025-11-08", "description": "UPI-SHIVSHANKERRAJESH -BHARATPE.9H0L0N 0R4M280313@UNITYPE-UNBA000BHPE-109649311 524-PAYTOBHARATPEME", "raw": "UPI-SHIVSHANKERRAJESH -BHARATPE.9H0L0N 0R4M280313@UNITYPE-UNBA000BHPE-109649311 524-PAYTOBHARATPEME", "amount": 40.0, "type": "expense", "debit": 40.0, "credit": 0.0, "balance": 2025.45, "page": "Page 14", "line": "42", "store": null, "commodity": null, "reference": "0000109649311524", "upi_id": "SHIVSHANKERRAJESH", "bankCode": "HDFC", "ifsc": "UNBA000BHPE", "transaction_id": null}, {"date": "12/08/25", "date_iso": "2025-12-08", "description": "UPI-SATYAWANBABAN VAGHE-SATEVANS1@OKAXI *Closingbalanceincludesfundsearmarkedforholdandunclearedfunds Contentsofthisstatementwillbeconsideredcorrectifnoerrorisreportedwithin30daysofreceiptofstatement.TheaddressonthisstatementisthatonrecordwiththeBankasatthedayofrequesting thisstatement. StateaccountbranchGSTN:27AAACH2702H1Z0 HDFCBankGSTINnumberdetailsareavailableathttps://www.hdfcbank.com/personal/making-payments/online-tax-payment/goods-and-service-tax. RegisteredOfficeAddress:HDFCBankHouse,SenapatiBapatMarg,LowerParel,Mumbai400013", "raw": "UPI-SATYAWANBABAN VAGHE-SATEVANS1@OKAXI *Closingbalanceincludesfundsearmarkedforholdandunclearedfunds Contentsofthisstatementwillbeconsideredcorrectifnoerrorisreportedwithin30daysofreceiptofstatement.TheaddressonthisstatementisthatonrecordwiththeBankasatthedayofrequesting thisstatement. StateaccountbranchGSTN:27AAACH2702H1Z0 HDFCBankGSTINnumberdetailsareavailableathttps://www.hdfcbank.com/personal/making-payments/online-tax-payment/goods-and-service-tax. RegisteredOfficeAddress:HDFCBankHouse,SenapatiBapatMarg,LowerParel,Mumbai400013", "amount": 15.0, "type": "expense", "debit": 15.0, "credit": 0.0, "balance": 1925.45, "page": "Page 14", "line": "60", "store": null, "commodity": null, "reference": "0000109706062716", "upi_id": "SATYAWANBABAN", "bankCode": "HDFC", "ifsc": null, "transaction_id": null}, {"date": "12/08/25", "date_iso": "2025-12-08", "description": "UPI-GUPTARAJKUMAR RAMB-PAYTMQR6FIRVI@PT YS-YESB0PTMUPI-109704604572-UPI", "raw": "UPI-GUPTARAJKUMAR RAMB-PAYTMQR6FIRVI@PT YS-YESB0PTMUPI-109704604572-UPI", "amount": 30.0, "type": "expense", "debit": 30.0, "credit": 0.0, "balance": 1960.45, "page": "Page 14", "line": "48", "store": null, "commodity": null, "reference": "0000109704604572", "upi_id": "GUPTARAJKUMAR", "bankCode": "HDFC", "ifsc": "YESB0PTMUPI", "transaction_id": null}, {"date": "12/08/25", "date_iso": "2025-12-08", "description": "UPI-GUPTARAJKUMAR RAMB-PAYTMQR6FIRVI@PT YS-YESB0PTMUPI-109704885119-UPI", "raw": "UPI-GUPTARAJKUMAR RAMB-PAYTMQR6FIRVI@PT YS-YESB0PTMUPI-109704885119-UPI", "amount": 20.0, "type": "expense", "debit": 20.0, "credit": 0.0, "balance": 1940.45, "page": "Page 14", "line": "51", "store": null, "commodity": null, "reference": "0000109704885119", "upi_id": "GUPTARAJKUMAR", "bankCode": "HDFC", "ifsc": "YESB0PTMUPI", "transaction_id": null}, {"date": "14/08/25", "date_iso": "2025-08-14", "description": "UPI-SHAKUNTALADEVI BABL-PAYTM.S16IECC@P TY-YESB0MCHUPI-109813612151-UPI", "raw": "UPI-SHAKUNTALADEVI BABL-PAYTM.S16IECC@P TY-YESB0MCHUPI-109813612151-UPI", "amount": 10.0, "type": "expense", "debit": 10.0, "credit": 0.0, "balance": 1915.45, "page": "Page 15", "line": "25", "store": null, "commodity": null, "reference": "0000109813612151", "upi_id": "SHAKUNTALADEVI", "bankCode": "HDFC", "ifsc": "YESB0MCHUPI", "transaction_id": null}, {"date": "14/08/25", "date_iso": "2025-08-14", "description": "UPI-SHIVSHANKERRAJESH -BHARATPE.9H0L0N 0R4M280313@UNITYPE-UNBA000BHPE-109814031 018-PAYTOBHARATPEME", "raw": "UPI-SHIVSHANKERRAJESH -BHARATPE.9H0L0N 0R4M280313@UNITYPE-UNBA000BHPE-109814031 018-PAYTOBHARATPEME", "amount": 40.0, "type": "expense", "debit": 40.0, "credit": 0.0, "balance": 1875.45, "page": "Page 15", "line": "29", "store": null, "commodity": null, "reference": "0000109814031018", "upi_id": "SHIVSHANKERRAJESH", "bankCode": "HDFC", "ifsc": "UNBA000BHPE", "transaction_id": null}, {"date": "14/08/25", "date_iso": "2025-08-14", "description": "UPI-IMTIYAJ-PAYTM.S1K5WWG@PTY-YESB0MCHUP I-109814889729-UPI", "raw": "UPI-IMTIYAJ-PAYTM.S1K5WWG@PTY-YESB0MCHUP I-109814889729-UPI", "amount": 140.0, "type": "expense", "debit": 140.0, "credit": 0.0, "balance": 1735.45, "page": "Page 15", "line": "31", "store": null, "commodity": null, "reference": "0000109814889729", "upi_id": "IMTIYAJ", "bankCode": "HDFC", "ifsc": null, "transaction_id": null}, {"date": "18/08/25", "date_iso": "2025-08-18", "description": "UPI-SHREEGOPAL DAIRY-PAYTM.S1FLLTA@PTY- YESB0MCHUPI-109995022353-UPI", "raw": "UPI-SHREEGOPAL DAIRY-PAYTM.S1FLLTA@PTY- YESB0MCHUPI-109995022353-UPI", "amount": 80.0, "type": "expense", "debit": 80.0, "credit": 0.0, "balance": 1655.45, "page": "Page 15", "line": "34", "store": null, "commodity": null, "reference": "0000109995022353", "upi_id": "SHREEGOPAL", "bankCode": "HDFC", "ifsc": "YESB0MCHUPI", "transaction_id": null}, {"date": "18/08/25", "date_iso": "2025-08-18", "description": "UPI-RAMKARN MAURYA-BHARATPE.9V0K0H0V2G01 5560@UNITYPE-UNBA000BHPE-109995318899-PA YTOBHARATPEME", "raw": "UPI-RAMKARN MAURYA-BHARATPE.9V0K0H0V2G01 5560@UNITYPE-UNBA000BHPE-109995318899-PA YTOBHARATPEME", "amount": 30.0, "type": "expense", "debit": 30.0, "credit": 0.0, "balance": 1625.45, "page": "Page 15", "line": "38", "store": null, "commodity": null, "reference": "0000109995318899", "upi_id": "RAMKARN", "bankCode": "HDFC", "ifsc": "UNBA000BHPE", "transaction_id": null}, {"date": "18/08/25", "date_iso": "2025-08-18", "description": "UPI-MRJITENDRA PRAJAPT-Q814213252@YBL- YESB0YBLUPI-109995441801-UPI", "raw": "UPI-MRJITENDRA PRAJAPT-Q814213252@YBL- YESB0YBLUPI-109995441801-UPI", "amount": 10.0, "type": "expense", "debit": 10.0, "credit": 0.0, "balance": 1615.45, "page": "Page 15", "line": "40", "store": null, "commodity": null, "reference": "0000109995441801", "upi_id": "MRJITENDRA", "bankCode": "HDFC", "ifsc": "YESB0YBLUPI", "transaction_id": null}, {"date": "18/08/25", "date_iso": "2025-08-18", "description": "UPI-SHAKUNTALADEVI BABL-PAYTM.S16IECC@P TY-YESB0MCHUPI-109995658569-UPI", "raw": "UPI-SHAKUNTALADEVI BABL-PAYTM.S16IECC@P TY-YESB0MCHUPI-109995658569-UPI", "amount": 10.0, "type": "expense", "debit": 10.0, "credit": 0.0, "balance": 1605.45, "page": "Page 15", "line": "43", "store": null, "commodity": null, "reference": "0000109995658569", "upi_id": "SHAKUNTALADEVI", "bankCode": "HDFC", "ifsc": "YESB0MCHUPI", "transaction_id": null}, {"date": "18/08/25", "date_iso": "2025-08-18", "description": "UPI-SHWETAAMIT PAWAR-UPAY048022MH@UJJI VAN-UJVN0000100-109996886296-UPI", "raw": "UPI-SHWETAAMIT PAWAR-UPAY048022MH@UJJI VAN-UJVN0000100-109996886296-UPI", "amount": 15.0, "type": "expense", "debit": 15.0, "credit": 0.0, "balance": 1590.45, "page": "Page 15", "line": "46", "store": null, "commodity": null, "reference": "0000109996886296", "upi_id": "SHWETAAMIT", "bankCode": "HDFC", "ifsc": "UPAY048022M", "transaction_id": null}, {"date": "19/08/25", "date_iso": "2025-08-19", "description": "UPI-SHREEGOPAL DAIRY-PAYTMQR6K0GB9@PTYS -YESB0PTMUPI-110038649808-UPI", "raw": "UPI-SHREEGOPAL DAIRY-PAYTMQR6K0GB9@PTYS -YESB0PTMUPI-110038649808-UPI", "amount": 105.0, "type": "expense", "debit": 105.0, "credit": 0.0, "balance": 1485.45, "page": "Page 15", "line": "49", "store": null, "commodity": null, "reference": "0000110038649808", "upi_id": "SHREEGOPAL", "bankCode": "HDFC", "ifsc": "YESB0PTMUPI", "transaction_id": null}, {"date": "21/08/25", "date_iso": "2025-08-21", "description": "UPI-SHAKUNTALADEVI BABL-PAYTM.S16IECC@P TY-YESB0MCHUPI-110129417294-UPI", "raw": "UPI-SHAKUNTALADEVI BABL-PAYTM.S16IECC@P TY-YESB0MCHUPI-110129417294-UPI", "amount": 10.0, "type": "expense", "debit": 10.0, "credit": 0.0, "balance": 1475.45, "page": "Page 15", "line": "52", "store": null, "commodity": null, "reference": "0000110129417294", "upi_id": "SHAKUNTALADEVI", "bankCode": "HDFC", "ifsc": "YESB0MCHUPI", "transaction_id": null}, {"date": "21/08/25", "date_iso": "2025-08-21", "description": "UPI-NARSINGHLALSINGH *Closingbalanceincludesfundsearmarkedforholdandunclearedfunds Contentsofthisstatementwillbeconsideredcorrectifnoerrorisreportedwithin30daysofreceiptofstatement.TheaddressonthisstatementisthatonrecordwiththeBankasatthedayofrequesting thisstatement. StateaccountbranchGSTN:27AAACH2702H1Z0 HDFCBankGSTINnumberdetailsareavailableathttps://www.hdfcbank.com/personal/making-payments/online-tax-payment/goods-and-service-tax. RegisteredOfficeAddress:HDFCBankHouse,SenapatiBapatMarg,LowerParel,Mumbai400013", "raw": "UPI-NARSINGHLALSINGH *Closingbalanceincludesfundsearmarkedforholdandunclearedfunds Contentsofthisstatementwillbeconsideredcorrectifnoerrorisreportedwithin30daysofreceiptofstatement.TheaddressonthisstatementisthatonrecordwiththeBankasatthedayofrequesting thisstatement. StateaccountbranchGSTN:27AAACH2702H1Z0 HDFCBankGSTINnumberdetailsareavailableathttps://www.hdfcbank.com/personal/making-payments/online-tax-payment/goods-and-service-tax. RegisteredOfficeAddress:HDFCBankHouse,SenapatiBapatMarg,LowerParel,Mumbai400013", "amount": 30.0, "type": "expense", "debit": 30.0, "credit": 0.0, "balance": 1445.45, "page": "Page 15", "line": "60", "store": null, "commodity": null, "reference": "0000110131142642", "upi_id": "NARSINGHLALSINGH", "bankCode": "HDFC", "ifsc": null, "transaction_id": null}, {"date": "22/08/25", "date_iso": "2025-08-22", "description": "UPI-SHIVAM-BHARATPE.90068950272@FBPE-FDR L0001382-110178280057-PAYTOBHARATPEME", "raw": "UPI-SHIVAM-BHARATPE.90068950272@FBPE-FDR L0001382-110178280057-PAYTOBHARATPEME", "amount": 20.0, "type": "expense", "debit": 20.0, "credit": 0.0, "balance": 1395.45, "page": "Page 16", "line": "29", "store": null, "commodity": null, "reference": "0000110178280057", "upi_id": "SHIVAM", "bankCode": "HDFC", "ifsc": null, "transaction_id": null}, {"date": "22/08/25", "date_iso": "2025-08-22", "description": "UPI-SHIVSHANKERRAJESH -BHARATPE.9H0L0N 0R4M280313@UNITYPE-UNBA000BHPE-110178514 566-PAYTOBHARATPEME", "raw": "UPI-SHIVSHANKERRAJESH -BHARATPE.9H0L0N 0R4M280313@UNITYPE-UNBA000BHPE-110178514 566-PAYTOBHARATPEME", "amount": 40.0, "type": "expense", "debit": 40.0, "credit": 0.0, "balance": 1355.45, "page": "Page 16", "line": "33", "store": null, "commodity": null, "reference": "0000110178514566", "upi_id": "SHIVSHANKERRAJESH", "bankCode": "HDFC", "ifsc": "UNBA000BHPE", "transaction_id": null}, {"date": "22/08/25", "date_iso": "2025-08-22", "description": "UPI-RAHULKISAN SHAH-BHARATPE.9H0O0K0J1M 916664@UNITYPE-UNBA000BHPE-110178053832- PAYTOBHARATPEME", "raw": "UPI-RAHULKISAN SHAH-BHARATPE.9H0O0K0J1M 916664@UNITYPE-UNBA000BHPE-110178053832- PAYTOBHARATPEME", "amount": 30.0, "type": "expense", "debit": 30.0, "credit": 0.0, "balance": 1415.45, "page": "Page 16", "line": "27", "store": null, "commodity": null, "reference": "0000110178053832", "upi_id": "RAHULKISAN", "bankCode": "HDFC", "ifsc": "UNBA000BHPE", "transaction_id": null}, {"date": "23/08/25", "date_iso": "2025-08-23", "description": "UPI-VANDANANOVELTY APNB-GPAY-1118771974 6@OKBIZAXIS-UTIB0000553-110210075222-UPI", "raw": "UPI-VANDANANOVELTY APNB-GPAY-1118771974 6@OKBIZAXIS-UTIB0000553-110210075222-UPI", "amount": 77.0, "type": "expense", "debit": 77.0, "credit": 0.0, "balance": 1278.45, "page": "Page 16", "line": "36", "store": null, "commodity": null, "reference": "0000110210075222", "upi_id": "VANDANANOVELTY", "bankCode": "HDFC", "ifsc": "UTIB0000553", "transaction_id": null}, {"date": "23/08/25", "date_iso": "2025-08-23", "description": "UPI-MUNAJJAR ALI-PAYTMQR6GULUD@PTYS-YESB 0PTMUPI-110211945365-UPI", "raw": "UPI-MUNAJJAR ALI-PAYTMQR6GULUD@PTYS-YESB 0PTMUPI-110211945365-UPI", "amount": 40.0, "type": "expense", "debit": 40.0, "credit": 0.0, "balance": 1238.45, "page": "Page 16", "line": "39", "store": null, "commodity": null, "reference": "0000110211945365", "upi_id": "MUNAJJAR", "bankCode": "HDFC", "ifsc": null, "transaction_id": null}, {"date": "23/08/25", "date_iso": "2025-08-23", "description": "UPI-SONIBAIKISAN RATHO-PAYTM.S1O1UVY@P TY-YESB0MCHUPI-110212023275-UPI", "raw": "UPI-SONIBAIKISAN RATHO-PAYTM.S1O1UVY@P TY-YESB0MCHUPI-110212023275-UPI", "amount": 20.0, "type": "expense", "debit": 20.0, "credit": 0.0, "balance": 1218.45, "page": "Page 16", "line": "42", "store": null, "commodity": null, "reference": "0000110212023275", "upi_id": "SONIBAIKISAN", "bankCode": "HDFC", "ifsc": "YESB0MCHUPI", "transaction_id": null}, {"date": "23/08/25", "date_iso": "2025-08-23", "description": "UPI-RITAPINTUJAISAWAL-RAJJAISWAL192201 0-1@OKAXIS-PUNB0398800-560174928287-UPI", "raw": "UPI-RITAPINTUJAISAWAL-RAJJAISWAL192201 0-1@OKAXIS-PUNB0398800-560174928287-UPI", "amount": 20.0, "type": "expense", "debit": 20.0, "credit": 0.0, "balance": 1198.45, "page": "Page 16", "line": "44", "store": null, "commodity": null, "reference": "0000560174928287", "upi_id": "RITAPINTUJAISAWAL", "bankCode": "HDFC", "ifsc": "PUNB0398800", "transaction_id": null}, {"date": "23/08/25", "date_iso": "2025-08-23", "description": "UPI-SUMIT KUMAR-PAYTMQR6GRQGZ@PTYS-YESB0 PTMUPI-110212302952-UPI", "raw": "UPI-SUMIT KUMAR-PAYTMQR6GRQGZ@PTYS-YESB0 PTMUPI-110212302952-UPI", "amount": 30.0, "type": "expense", "debit": 30.0, "credit": 0.0, "balance": 1168.45, "page": "Page 16", "line": "47", "store": null, "commodity": null, "reference": "0000110212302952", "upi_id": "SUMIT", "bankCode": "HDFC", "ifsc": null, "transaction_id": null}, {"date": "25/08/25", "date_iso": "2025-08-25", "description": "UPI-AYUSHIKANSINGH CHAU-AYUSHICHAUHAN00 7007@OKSBI-BCBM0000006-560385404648-UPI", "raw": "UPI-AYUSHIKANSINGH CHAU-AYUSHICHAUHAN00 7007@OKSBI-BCBM0000006-560385404648-UPI", "amount": 60.0, "type": "expense", "debit": 60.0, "credit": 0.0, "balance": 1108.45, "page": "Page 16", "line": "50", "store": null, "commodity": null, "reference": "0000560385404648", "upi_id": "AYUSHIKANSINGH", "bankCode": "HDFC", "ifsc": "BCBM0000006", "transaction_id": null}, {"date": "25/08/25", "date_iso": "2025-08-25", "description": "UPI-RAMAVTARRAMMURAT YA-BHARATPE.900689 46846@FBPE-FDRL0001382-110318906298-PAY *Closingbalanceincludesfundsearmarkedforholdandunclearedfunds Contentsofthisstatementwillbeconsideredcorrectifnoerrorisreportedwithin30daysofreceiptofstatement.TheaddressonthisstatementisthatonrecordwiththeBankasatthedayofrequesting thisstatement. StateaccountbranchGSTN:27AAACH2702H1Z0 HDFCBankGSTINnumberdetailsareavailableathttps://www.hdfcbank.com/personal/making-payments/online-tax-payment/goods-and-service-tax. RegisteredOfficeAddress:HDFCBankHouse,SenapatiBapatMarg,LowerParel,Mumbai400013", "raw": "UPI-RAMAVTARRAMMURAT YA-BHARATPE.900689 46846@FBPE-FDRL0001382-110318906298-PAY *Closingbalanceincludesfundsearmarkedforholdandunclearedfunds Contentsofthisstatementwillbeconsideredcorrectifnoerrorisreportedwithin30daysofreceiptofstatement.TheaddressonthisstatementisthatonrecordwiththeBankasatthedayofrequesting thisstatement. StateaccountbranchGSTN:27AAACH2702H1Z0 HDFCBankGSTINnumberdetailsareavailableathttps://www.hdfcbank.com/personal/making-payments/online-tax-payment/goods-and-service-tax. RegisteredOfficeAddress:HDFCBankHouse,SenapatiBapatMarg,LowerParel,Mumbai400013", "amount": 30.0, "type": "expense", "debit": 30.0, "credit": 0.0, "balance": 1078.45, "page": "Page 16", "line": "60", "store": null, "commodity": null, "reference": "0000110318906298", "upi_id": "RAMAVTARRAMMURAT", "bankCode": "HDFC", "ifsc": "FDRL0001382", "transaction_id": null}, {"date": "25/08/25", "date_iso": "2025-08-25", "description": "UPI-SHAKUNTALADEVI BABL-PAYTM.S16IECC@P TY-YESB0MCHUPI-110319449612-UPI", "raw": "UPI-SHAKUNTALADEVI BABL-PAYTM.S16IECC@P TY-YESB0MCHUPI-110319449612-UPI", "amount": 10.0, "type": "expense", "debit": 10.0, "credit": 0.0, "balance": 1068.45, "page": "Page 17", "line": "25", "store": null, "commodity": null, "reference": "0000110319449612", "upi_id": "SHAKUNTALADEVI", "bankCode": "HDFC", "ifsc": "YESB0MCHUPI", "transaction_id": null}, {"date": "25/08/25", "date_iso": "2025-08-25", "description": "UPI-BLINKIT-BLINKIT.PAYU@HDFCBANK-HDFC0M ERUPI-110333263930-UPIINTENT", "raw": "UPI-BLINKIT-BLINKIT.PAYU@HDFCBANK-HDFC0M ERUPI-110333263930-UPIINTENT", "amount": 267.0, "type": "expense", "debit": 267.0, "credit": 0.0, "balance": 801.45, "page": "Page 17", "line": "27", "store": null, "commodity": null, "reference": "0000110333263930", "upi_id": "BLINKIT", "bankCode": "HDFC", "ifsc": null, "transaction_id": null}, {"date": "26/08/25", "date_iso": "2025-08-26", "description": "UPI-IMTIYAJ-PAYTM.S1JV623@PTY-YESB0MCHUP I-110368879931-UPI", "raw": "UPI-IMTIYAJ-PAYTM.S1JV623@PTY-YESB0MCHUP I-110368879931-UPI", "amount": 50.0, "type": "expense", "debit": 50.0, "credit": 0.0, "balance": 377.45, "page": "Page 17", "line": "31", "store": null, "commodity": null, "reference": "0000110368879931", "upi_id": "IMTIYAJ", "bankCode": "HDFC", "ifsc": null, "transaction_id": null}, {"date": "26/08/25", "date_iso": "2025-08-26", "description": "UPI-NANDAJOSEPH MOBEN-Q565079256@YBL-YE SB0YBLUPI-110369197173-UPI", "raw": "UPI-NANDAJOSEPH MOBEN-Q565079256@YBL-YE SB0YBLUPI-110369197173-UPI", "amount": 64.0, "type": "expense", "debit": 64.0, "credit": 0.0, "balance": 313.45, "page": "Page 17", "line": "34", "store": null, "commodity": null, "reference": "0000110369197173", "upi_id": "NANDAJOSEPH", "bankCode": "HDFC", "ifsc": null, "transaction_id": null}, {"date": "26/08/25", "date_iso": "2025-08-26", "description": "UPI-BLINKIT-BLINKIT.RZP@HDFCBANK-HDFC0ME RUPI-101293521311-PAYVIARAZORPAY", "raw": "UPI-BLINKIT-BLINKIT.RZP@HDFCBANK-HDFC0ME RUPI-101293521311-PAYVIARAZORPAY", "amount": 374.0, "type": "expense", "debit": 374.0, "credit": 0.0, "balance": 427.45, "page": "Page 17", "line": "29", "store": null, "commodity": null, "reference": "0000101293521311", "upi_id": "BLINKIT", "bankCode": "HDFC", "ifsc": null, "transaction_id": null}, {"date": "28/08/25", "date_iso": "2025-08-28", "description": "UPI-MRVISHNU MUNSHEELAL-VISHUNVISHWAKAR MA90211-2@OKAXIS-IDIB000M764-52407104117 4-UPI", "raw": "UPI-MRVISHNU MUNSHEELAL-VISHUNVISHWAKAR MA90211-2@OKAXIS-IDIB000M764-52407104117 4-UPI", "amount": 2000.0, "type": "income", "debit": 0.0, "credit": 2000.0, "balance": 2263.45, "page": "Page 17", "line": "44", "store": null, "commodity": null, "reference": "0000524071041174", "upi_id": "MRVISHNU", "bankCode": "HDFC", "ifsc": "IDIB000M764", "transaction_id": null}, {"date": "28/08/25", "date_iso": "2025-08-28", "description": "UPI-SHAKUNTALADEVI BABL-PAYTM.S16IECC@P TY-YESB0MCHUPI-110456879010-UPI", "raw": "UPI-SHAKUNTALADEVI BABL-PAYTM.S16IECC@P TY-YESB0MCHUPI-110456879010-UPI", "amount": 40.0, "type": "expense", "debit": 40.0, "credit": 0.0, "balance": 263.45, "page": "Page 17", "line": "40", "store": null, "commodity": null, "reference": "0000110456879010", "upi_id": "SHAKUNTALADEVI", "bankCode": "HDFC", "ifsc": "YESB0MCHUPI", "transaction_id": null}, {"date": "28/08/25", "date_iso": "2025-08-28", "description": "UPI-MANGESHKUMAR GUPTA-PAYTMQR6J2ESW@PT YS-YESB0PTMUPI-110456605398-UPI", "raw": "UPI-MANGESHKUMAR GUPTA-PAYTMQR6J2ESW@PT YS-YESB0PTMUPI-110456605398-UPI", "amount": 10.0, "type": "expense", "debit": 10.0, "credit": 0.0, "balance": 303.45, "page": "Page 17", "line": "37", "store": null, "commodity": null, "reference": "0000110456605398", "upi_id": "MANGESHKUMAR", "bankCode": "HDFC", "ifsc": "YESB0PTMUPI", "transaction_id": null}, {"date": "29/08/25", "date_iso": "2025-08-29", "description": "UPI-MULUNDEASTCHEMIST-GPAY-11252740980 @OKBIZAXIS-UTIB0000553-110489429562-UPI", "raw": "UPI-MULUNDEASTCHEMIST-GPAY-11252740980 @OKBIZAXIS-UTIB0000553-110489429562-UPI", "amount": 110.0, "type": "expense", "debit": 110.0, "credit": 0.0, "balance": 2153.45, "page": "Page 17", "line": "46", "store": null, "commodity": null, "reference": "0000110489429562", "upi_id": "MULUNDEASTCHEMIST", "bankCode": "HDFC", "ifsc": "UTIB0000553", "transaction_id": null}, {"date": "30/08/25", "date_iso": "2025-08-30", "description": "UPI-AYUSHIKANSINGH CHAU-AYUSHICHAUHAN00 7007@OKAXIS-BCBM0000006-524233910964-UPI", "raw": "UPI-AYUSHIKANSINGH CHAU-AYUSHICHAUHAN00 7007@OKAXIS-BCBM0000006-524233910964-UPI", "amount": 10.0, "type": "income", "debit": 0.0, "credit": 10.0, "balance": 2163.45, "page": "Page 17", "line": "49", "store": null, "commodity": null, "reference": "0000524233910964", "upi_id": "AYUSHIKANSINGH", "bankCode": "HDFC", "ifsc": "BCBM0000006", "transaction_id": null}, {"date": "30/08/25", "date_iso": "2025-08-30", "description": "UPI-AYUSHIKANSINGH CHAU-AYUSHICHAUHAN00 7007@OKSBI-BCBM0000006-110543373863-UPI", "raw": "UPI-AYUSHIKANSINGH CHAU-AYUSHICHAUHAN00 7007@OKSBI-BCBM0000006-110543373863-UPI", "amount": 30.0, "type": "expense", "debit": 30.0, "credit": 0.0, "balance": 2133.45, "page": "Page 17", "line": "52", "store": null, "commodity": null, "reference": "0000110543373863", "upi_id": "AYUSHIKANSINGH", "bankCode": "HDFC", "ifsc": "BCBM0000006", "transaction_id": null}, {"date": "30/08/25", "date_iso": "2025-08-30", "description": "UPI-SONUKUMAR *Closingbalanceincludesfundsearmarkedforholdandunclearedfunds Contentsofthisstatementwillbeconsideredcorrectifnoerrorisreportedwithin30daysofreceiptofstatement.TheaddressonthisstatementisthatonrecordwiththeBankasatthedayofrequesting thisstatement. StateaccountbranchGSTN:27AAACH2702H1Z0 HDFCBankGSTINnumberdetailsareavailableathttps://www.hdfcbank.com/personal/making-payments/online-tax-payment/goods-and-service-tax. RegisteredOfficeAddress:HDFCBankHouse,SenapatiBapatMarg,LowerParel,Mumbai400013", "raw": "UPI-SONUKUMAR *Closingbalanceincludesfundsearmarkedforholdandunclearedfunds Contentsofthisstatementwillbeconsideredcorrectifnoerrorisreportedwithin30daysofreceiptofstatement.TheaddressonthisstatementisthatonrecordwiththeBankasatthedayofrequesting thisstatement. StateaccountbranchGSTN:27AAACH2702H1Z0 HDFCBankGSTINnumberdetailsareavailableathttps://www.hdfcbank.com/personal/making-payments/online-tax-payment/goods-and-service-tax. RegisteredOfficeAddress:HDFCBankHouse,SenapatiBapatMarg,LowerParel,Mumbai400013", "amount": 20.0, "type": "expense", "debit": 20.0, "credit": 0.0, "balance": 2113.45, "page": "Page 17", "line": "60", "store": null, "commodity": null, "reference": "0000110548803743", "upi_id": "SONUKUMAR", "bankCode": "HDFC", "ifsc": null, "transaction_id": null}, {"date": "30/08/25", "date_iso": "2025-08-30", "description": "UPI-SHAKUNTALADEVI BABL-PAYTM.S16IECC@P TY-YESB0MCHUPI-110548833437-UPI", "raw": "UPI-SHAKUNTALADEVI BABL-PAYTM.S16IECC@P TY-YESB0MCHUPI-110548833437-UPI", "amount": 10.0, "type": "expense", "debit": 10.0, "credit": 0.0, "balance": 2103.45, "page": "Page 18", "line": "27", "store": null, "commodity": null, "reference": "0000110548833437", "upi_id": "SHAKUNTALADEVI", "bankCode": "HDFC", "ifsc": "YESB0MCHUPI", "transaction_id": null}, {"date": "02/09/25", "date_iso": "2025-02-09", "description": "UPI-AARYAN STEEL-GPAY-11248258007@OKBIZA XIS-UTIB0000553-110674249775-UPI", "raw": "UPI-AARYAN STEEL-GPAY-11248258007@OKBIZA XIS-UTIB0000553-110674249775-UPI", "amount": 45.0, "type": "expense", "debit": 45.0, "credit": 0.0, "balance": 1903.45, "page": "Page 18", "line": "45", "store": null, "commodity": null, "reference": "0000110674249775", "upi_id": "AARYAN", "bankCode": "HDFC", "ifsc": "UTIB0000553", "transaction_id": null}, {"date": "02/09/25", "date_iso": "2025-02-09", "description": "UPI-SHREESHIVSHAMBHU DA-8097483331-1@OK BIZAXIS-UTIB0000553-110674084420-UPI", "raw": "UPI-SHREESHIVSHAMBHU DA-8097483331-1@OK BIZAXIS-UTIB0000553-110674084420-UPI", "amount": 75.0, "type": "expense", "debit": 75.0, "credit": 0.0, "balance": 1948.45, "page": "Page 18", "line": "42", "store": null, "commodity": null, "reference": "0000110674084420", "upi_id": "SHREESHIVSHAMBHU", "bankCode": "HDFC", "ifsc": "UTIB0000553", "transaction_id": null}, {"date": "02/09/25", "date_iso": "2025-02-09", "description": "UPI-SONUKUMAR GUPTA-BHARATPE90727686807 @YESBANKLTD-YESB0YESUPI-110673511640-PAY TOBHARATPEME", "raw": "UPI-SONUKUMAR GUPTA-BHARATPE90727686807 @YESBANKLTD-YESB0YESUPI-110673511640-PAY TOBHARATPEME", "amount": 10.0, "type": "expense", "debit": 10.0, "credit": 0.0, "balance": 2023.45, "page": "Page 18", "line": "39", "store": null, "commodity": null, "reference": "0000110673511640", "upi_id": "SONUKUMAR", "bankCode": "HDFC", "ifsc": "YESB0YESUPI", "transaction_id": null}, {"date": "02/09/25", "date_iso": "2025-02-09", "description": "UPI-SONUKUMAR GUPTA-BHARATPE90727686807 @YESBANKLTD-YESB0YESUPI-110673474914-PAY TOBHARATPEME", "raw": "UPI-SONUKUMAR GUPTA-BHARATPE90727686807 @YESBANKLTD-YESB0YESUPI-110673474914-PAY TOBHARATPEME", "amount": 20.0, "type": "expense", "debit": 20.0, "credit": 0.0, "balance": 2033.45, "page": "Page 18", "line": "35", "store": null, "commodity": null, "reference": "0000110673474914", "upi_id": "SONUKUMAR", "bankCode": "HDFC", "ifsc": "YESB0YESUPI", "transaction_id": null}, {"date": "02/09/25", "date_iso": "2025-02-09", "description": "UPI-MRDIPALIGANGADHAR-Q672997753@YBL- YESB0YBLUPI-110666240118-UPI", "raw": "UPI-MRDIPALIGANGADHAR-Q672997753@YBL- YESB0YBLUPI-110666240118-UPI", "amount": 20.0, "type": "expense", "debit": 20.0, "credit": 0.0, "balance": 2053.45, "page": "Page 18", "line": "31", "store": null, "commodity": null, "reference": "0000110666240118", "upi_id": "MRDIPALIGANGADHAR", "bankCode": "HDFC", "ifsc": "YESB0YBLUPI", "transaction_id": null}, {"date": "02/09/25", "date_iso": "2025-02-09", "description": "UPI-IRCTCUTS-PAYTM-8796946@PTYBL-YESB0P TMUPI-110661016690-UPI", "raw": "UPI-IRCTCUTS-PAYTM-8796946@PTYBL-YESB0P TMUPI-110661016690-UPI", "amount": 30.0, "type": "expense", "debit": 30.0, "credit": 0.0, "balance": 2073.45, "page": "Page 18", "line": "29", "store": null, "commodity": null, "reference": "0000110661016690", "upi_id": "IRCTCUTS", "bankCode": "HDFC", "ifsc": null, "transaction_id": null}, {"date": "03/09/25", "date_iso": "2025-03-09", "description": "IMPS-524622655215-OPTIMALRESOURCES-KKBK -XXXXXX5974-IB: MAMTASALARYINCENTIV", "raw": "IMPS-524622655215-OPTIMALRESOURCES-KKBK -XXXXXX5974-IB: MAMTASALARYINCENTIV", "amount": 44800.0, "type": "income", "debit": 0.0, "credit": 44800.0, "balance": 46703.45, "page": "Page 18", "line": "47", "store": null, "commodity": null, "reference": "0000524622655215", "upi_id": null, "bankCode": "HDFC", "ifsc": null, "transaction_id": null}, {"date": "06/09/25", "date_iso": "2025-06-09", "description": "UPI-SWIGGY LTD-SWIGGYUPI@AXB-UTIB0000100 -110874843371-PAYFORINTENT", "raw": "UPI-SWIGGY LTD-SWIGGYUPI@AXB-UTIB0000100 -110874843371-PAYFORINTENT", "amount": 281.0, "type": "expense", "debit": 281.0, "credit": 0.0, "balance": 46422.45, "page": "Page 18", "line": "50", "store": null, "commodity": null, "reference": "0000110874843371", "upi_id": "SWIGGY", "bankCode": "HDFC", "ifsc": "UTIB0000100", "transaction_id": null}, {"date": "07/09/25", "date_iso": "2025-07-09", "description": "UPI-AYUSHIKANSINGH CHAU-AYUSHICHAUHAN00 7007@OKSBI-BCBM0000006-525062179387-UPI", "raw": "UPI-AYUSHIKANSINGH CHAU-AYUSHICHAUHAN00 7007@OKSBI-BCBM0000006-525062179387-UPI", "amount": 625.0, "type": "income", "debit": 0.0, "credit": 625.0, "balance": 5803.45, "page": "Page 19", "line": "39", "store": null, "commodity": null, "reference": "0000525062179387", "upi_id": "AYUSHIKANSINGH", "bankCode": "HDFC", "ifsc": "BCBM0000006", "transaction_id": null}, {"date": "07/09/25", "date_iso": "2025-07-09", "description": "UPI-GOPAL MADHAV CHANDA-GOPALCHANDANSHI V1-6@OKAXIS-YESB0000125-110907537140-UPI", "raw": "UPI-GOPAL MADHAV CHANDA-GOPALCHANDANSHI V1-6@OKAXIS-YESB0000125-110907537140-UPI", "amount": 1250.0, "type": "expense", "debit": 1250.0, "credit": 0.0, "balance": 5178.45, "page": "Page 19", "line": "36", "store": null, "commodity": null, "reference": "0000110907537140", "upi_id": "GOPAL", "bankCode": "HDFC", "ifsc": "YESB0000125", "transaction_id": null}, {"date": "07/09/25", "date_iso": "2025-07-09", "description": "UPI-MAMTAMUNSHEELAL VIS-MAMTAVISHWAKARM A0948-1@OKHDFCBANK-KKBK0001432-110906198 453-UPI", "raw": "UPI-MAMTAMUNSHEELAL VIS-MAMTAVISHWAKARM A0948-1@OKHDFCBANK-KKBK0001432-110906198 453-UPI", "amount": 40000.0, "type": "expense", "debit": 40000.0, "credit": 0.0, "balance": 6428.45, "page": "Page 19", "line": "33", "store": null, "commodity": null, "reference": "0000110906198453", "upi_id": "MAMTAMUNSHEELAL", "bankCode": "HDFC", "ifsc": "KKBK0001432", "transaction_id": null}, {"date": "07/09/25", "date_iso": "2025-07-09", "description": "UPI-MRVISHNU MUNSHEELAL-VISHUNVISHWAKAR MA90211-2@OKAXIS-IDIB000M764-11090612162 *Closingbalanceincludesfundsearmarkedforholdandunclearedfunds Contentsofthisstatementwillbeconsideredcorrectifnoerrorisreportedwithin30daysofreceiptofstatement.TheaddressonthisstatementisthatonrecordwiththeBankasatthedayofrequesting thisstatement. StateaccountbranchGSTN:27AAACH2702H1Z0 HDFCBankGSTINnumberdetailsareavailableathttps://www.hdfcbank.com/personal/making-payments/online-tax-payment/goods-and-service-tax. RegisteredOfficeAddress:HDFCBankHouse,SenapatiBapatMarg,LowerParel,Mumbai400013", "raw": "UPI-MRVISHNU MUNSHEELAL-VISHUNVISHWAKAR MA90211-2@OKAXIS-IDIB000M764-11090612162 *Closingbalanceincludesfundsearmarkedforholdandunclearedfunds Contentsofthisstatementwillbeconsideredcorrectifnoerrorisreportedwithin30daysofreceiptofstatement.TheaddressonthisstatementisthatonrecordwiththeBankasatthedayofrequesting thisstatement. StateaccountbranchGSTN:27AAACH2702H1Z0 HDFCBankGSTINnumberdetailsareavailableathttps://www.hdfcbank.com/personal/making-payments/online-tax-payment/goods-and-service-tax. RegisteredOfficeAddress:HDFCBankHouse,SenapatiBapatMarg,LowerParel,Mumbai400013", "amount": 110.0, "type": "expense", "debit": 110.0, "credit": 0.0, "balance": 46312.45, "page": "Page 18", "line": "60", "store": null, "commodity": null, "reference": "0000110906121629", "upi_id": "MRVISHNU", "bankCode": "HDFC", "ifsc": "IDIB000M764", "transaction_id": null}, {"date": "07/09/25", "date_iso": "2025-07-09", "description": "UPI-MRVISHNU MUNSHEELAL-VISHUNVISHWAKAR MA90211-2@OKAXIS-IDIB000M764-56167946274 5-UPI", "raw": "UPI-MRVISHNU MUNSHEELAL-VISHUNVISHWAKAR MA90211-2@OKAXIS-IDIB000M764-56167946274 5-UPI", "amount": 110.0, "type": "expense", "debit": 110.0, "credit": 0.0, "balance": 46422.45, "page": "Page 19", "line": "26", "store": null, "commodity": null, "reference": "0000561679462745", "upi_id": "MRVISHNU", "bankCode": "HDFC", "ifsc": "IDIB000M764", "transaction_id": null}, {"date": "07/09/25", "date_iso": "2025-07-09", "description": "UPI-GOOGLEINDIA DIGITAL-GOOG-PAYMENTS@A XISBANK-UTIB0000553-152585002505-UPI", "raw": "UPI-GOOGLEINDIA DIGITAL-GOOG-PAYMENTS@A XISBANK-UTIB0000553-152585002505-UPI", "amount": 6.0, "type": "income", "debit": 0.0, "credit": 6.0, "balance": 46428.45, "page": "Page 19", "line": "29", "store": null, "commodity": null, "reference": "0000152585002505", "upi_id": "GOOGLEINDIA", "bankCode": "HDFC", "ifsc": "UTIB0000553", "transaction_id": null}, {"date": "08/09/25", "date_iso": "2025-08-09", "description": "ACHD-FININDIANCLEARING-210153741", "raw": "ACHD-FININDIANCLEARING-210153741", "amount": 1000.0, "type": "expense", "debit": 1000.0, "credit": 0.0, "balance": 4803.45, "page": "Page 19", "line": "40", "store": null, "commodity": null, "reference": "0000008050853251", "upi_id": null, "bankCode": "HDFC", "ifsc": null, "transaction_id": null}, {"date": "08/09/25", "date_iso": "2025-08-09", "description": "ACHD-FININDIANCLEARING-210240921", "raw": "ACHD-FININDIANCLEARING-210240921", "amount": 1000.0, "type": "expense", "debit": 1000.0, "credit": 0.0, "balance": 3803.45, "page": "Page 19", "line": "41", "store": null, "commodity": null, "reference": "0000008066354251", "upi_id": null, "bankCode": "HDFC", "ifsc": null, "transaction_id": null}, {"date": "08/09/25", "date_iso": "2025-08-09", "description": "UPI-BLINKITCOMMERCE PRI-GROFERS1PAYTM@H DFCBANK-HDFC0MERUPI-101412170678-PAYMENT", "raw": "UPI-BLINKITCOMMERCE PRI-GROFERS1PAYTM@H DFCBANK-HDFC0MERUPI-101412170678-PAYMENT", "amount": 568.0, "type": "expense", "debit": 568.0, "credit": 0.0, "balance": 3235.45, "page": "Page 19", "line": "44", "store": null, "commodity": null, "reference": "0000101412170678", "upi_id": "BLINKITCOMMERCE", "bankCode": "HDFC", "ifsc": "HDFC0MERUPI", "transaction_id": null}, {"date": "09/09/25", "date_iso": "2025-09-09", "description": "UPI-MRVISHNU MUNSHEELAL-VISHUNVISHWAKAR MA90211-2@OKAXIS-IDIB000M764-56187904340 8-UPI", "raw": "UPI-MRVISHNU MUNSHEELAL-VISHUNVISHWAKAR MA90211-2@OKAXIS-IDIB000M764-56187904340 8-UPI", "amount": 1.0, "type": "income", "debit": 0.0, "credit": 1.0, "balance": 3236.45, "page": "Page 19", "line": "48", "store": null, "commodity": null, "reference": "0000561879043408", "upi_id": "MRVISHNU", "bankCode": "HDFC", "ifsc": "IDIB000M764", "transaction_id": null}, {"date": "09/09/25", "date_iso": "2025-09-09", "description": "UPI-MAMTAMUNSHEELAL VIS-MAMTAVISHWAKARM A0948-1@OKHDFCBANK-KKBK0001432-111032639 499-UPI", "raw": "UPI-MAMTAMUNSHEELAL VIS-MAMTAVISHWAKARM A0948-1@OKHDFCBANK-KKBK0001432-111032639 499-UPI", "amount": 800.0, "type": "income", "debit": 0.0, "credit": 800.0, "balance": 4036.45, "page": "Page 19", "line": "52", "store": null, "commodity": null, "reference": "0000111032639499", "upi_id": "MAMTAMUNSHEELAL", "bankCode": "HDFC", "ifsc": "KKBK0001432", "transaction_id": null}, {"date": "10/09/25", "date_iso": "2025-10-09", "description": "ACHD-FININDIANCLEARING-211762243 *Closingbalanceincludesfundsearmarkedforholdandunclearedfunds Contentsofthisstatementwillbeconsideredcorrectifnoerrorisreportedwithin30daysofreceiptofstatement.TheaddressonthisstatementisthatonrecordwiththeBankasatthedayofrequesting thisstatement. StateaccountbranchGSTN:27AAACH2702H1Z0 HDFCBankGSTINnumberdetailsareavailableathttps://www.hdfcbank.com/personal/making-payments/online-tax-payment/goods-and-service-tax. RegisteredOfficeAddress:HDFCBankHouse,SenapatiBapatMarg,LowerParel,Mumbai400013", "raw": "ACHD-FININDIANCLEARING-211762243 *Closingbalanceincludesfundsearmarkedforholdandunclearedfunds Contentsofthisstatementwillbeconsideredcorrectifnoerrorisreportedwithin30daysofreceiptofstatement.TheaddressonthisstatementisthatonrecordwiththeBankasatthedayofrequesting thisstatement. StateaccountbranchGSTN:27AAACH2702H1Z0 HDFCBankGSTINnumberdetailsareavailableathttps://www.hdfcbank.com/personal/making-payments/online-tax-payment/goods-and-service-tax. RegisteredOfficeAddress:HDFCBankHouse,SenapatiBapatMarg,LowerParel,Mumbai400013", "amount": 1000.0, "type": "expense", "debit": 1000.0, "credit": 0.0, "balance": 3036.45, "page": "Page 19", "line": "60", "store": null, "commodity": null, "reference": "0000008764274253", "upi_id": null, "bankCode": "HDFC", "ifsc": null, "transaction_id": null}, {"date": "10/09/25", "date_iso": "2025-10-09", "description": "ACHD-FININDIANCLEARING-211991653", "raw": "ACHD-FININDIANCLEARING-211991653", "amount": 1000.0, "type": "expense", "debit": 1000.0, "credit": 0.0, "balance": 2036.45, "page": "Page 20", "line": "22", "store": null, "commodity": null, "reference": "0000008804862253", "upi_id": null, "bankCode": "HDFC", "ifsc": null, "transaction_id": null}, {"date": "12/09/25", "date_iso": "2025-12-09", "description": "UPI-RAKESHURF MOTILAL-PAYTM.S1DUUU9@PTY -YESB0MCHUPI-111157349280-UPI", "raw": "UPI-RAKESHURF MOTILAL-PAYTM.S1DUUU9@PTY -YESB0MCHUPI-111157349280-UPI", "amount": 50.0, "type": "expense", "debit": 50.0, "credit": 0.0, "balance": 1806.45, "page": "Page 20", "line": "36", "store": null, "commodity": null, "reference": "0000111157349280", "upi_id": "RAKESHURF", "bankCode": "HDFC", "ifsc": "YESB0MCHUPI", "transaction_id": null}, {"date": "12/09/25", "date_iso": "2025-12-09", "description": "MEDCSI541919XXXXXX9068CURSOR,AIPOW EREDIDE", "raw": "MEDCSI541919XXXXXX9068CURSOR,AIPOW EREDIDE", "amount": 1760.88, "type": "expense", "debit": 1760.88, "credit": 0.0, "balance": 45.57, "page": "Page 20", "line": "38", "store": null, "commodity": null, "reference": "0000000000094998", "upi_id": null, "bankCode": "HDFC", "ifsc": null, "transaction_id": null}, {"date": "12/09/25", "date_iso": "2025-12-09", "description": "UPI-RAJESH KUMAR-PAYTMQR6J4IOB@PTYS-YESB 0PTMUPI-111157280600-UPI", "raw": "UPI-RAJESH KUMAR-PAYTMQR6J4IOB@PTYS-YESB 0PTMUPI-111157280600-UPI", "amount": 50.0, "type": "expense", "debit": 50.0, "credit": 0.0, "balance": 1856.45, "page": "Page 20", "line": "33", "store": null, "commodity": null, "reference": "0000111157280600", "upi_id": "RAJESH", "bankCode": "HDFC", "ifsc": null, "transaction_id": null}, {"date": "12/09/25", "date_iso": "2025-12-09", "description": "UPI-SONIBAIKISAN RATHO-PAYTM.S1O1UVY@P TY-YESB0MCHUPI-111157168944-UPI", "raw": "UPI-SONIBAIKISAN RATHO-PAYTM.S1O1UVY@P TY-YESB0MCHUPI-111157168944-UPI", "amount": 30.0, "type": "expense", "debit": 30.0, "credit": 0.0, "balance": 1906.45, "page": "Page 20", "line": "30", "store": null, "commodity": null, "reference": "0000111157168944", "upi_id": "SONIBAIKISAN", "bankCode": "HDFC", "ifsc": "YESB0MCHUPI", "transaction_id": null}, {"date": "12/09/25", "date_iso": "2025-12-09", "description": "UPI-SHREEGOPAL DAIRY-PAYTM.S1FLLTA@PTY- YESB0MCHUPI-111157043952-UPI", "raw": "UPI-SHREEGOPAL DAIRY-PAYTM.S1FLLTA@PTY- YESB0MCHUPI-111157043952-UPI", "amount": 80.0, "type": "expense", "debit": 80.0, "credit": 0.0, "balance": 1936.45, "page": "Page 20", "line": "27", "store": null, "commodity": null, "reference": "0000111157043952", "upi_id": "SHREEGOPAL", "bankCode": "HDFC", "ifsc": "YESB0MCHUPI", "transaction_id": null}, {"date": "12/09/25", "date_iso": "2025-12-09", "description": "UPI-IRCTCUTS-PAYTM-8796946@PTYBL-YESB0P TMUPI-111150909947-UPI", "raw": "UPI-IRCTCUTS-PAYTM-8796946@PTYBL-YESB0P TMUPI-111150909947-UPI", "amount": 20.0, "type": "expense", "debit": 20.0, "credit": 0.0, "balance": 2016.45, "page": "Page 20", "line": "24", "store": null, "commodity": null, "reference": "0000111150909947", "upi_id": "IRCTCUTS", "bankCode": "HDFC", "ifsc": null, "transaction_id": null}, {"date": "23/09/25", "date_iso": "2025-09-23", "description": "UPI-AARYAN STEEL-GPAY-12190486629@OKBIZA XIS-UTIB0000553-111656011007-UPI", "raw": "UPI-AARYAN STEEL-GPAY-12190486629@OKBIZA XIS-UTIB0000553-111656011007-UPI", "amount": 30.0, "type": "expense", "debit": 30.0, "credit": 0.0, "balance": 15.57, "page": "Page 20", "line": "41", "store": null, "commodity": null, "reference": "0000111656011007", "upi_id": "AARYAN", "bankCode": "HDFC", "ifsc": "UTIB0000553", "transaction_id": null}, {"date": "01/10/25", "date_iso": "2025-01-10", "description": "INTERESTPAIDTILL30-SEP-2025", "raw": "INTERESTPAIDTILL30-SEP-2025", "amount": 30.0, "type": "income", "debit": 0.0, "credit": 30.0, "balance": 30.0, "page": "Page 20", "line": "44", "store": null, "commodity": null, "reference": "000000000000000", "upi_id": null, "bankCode": "HDFC", "ifsc": null, "transaction_id": null}, {"date": "07/10/25", "date_iso": "2025-07-10", "description": "UPI-MAMTAMUNSHEELAL VIS-MAMTAVISHWAKARM A0948-1@OKHDFCBANK-KKBK0001432-112280162 793-SIP", "raw": "UPI-MAMTAMUNSHEELAL VIS-MAMTAVISHWAKARM A0948-1@OKHDFCBANK-KKBK0001432-112280162 793-SIP", "amount": 4150.0, "type": "income", "debit": 0.0, "credit": 4150.0, "balance": 4180.0, "page": "Page 20", "line": "48", "store": null, "commodity": null, "reference": "0000112280162793", "upi_id": "MAMTAMUNSHEELAL", "bankCode": "HDFC", "ifsc": "KKBK0001432", "transaction_id": null}, {"date": "07/10/25", "date_iso": "2025-07-10", "description": "ACHD-FININDIANCLEARING-218224794", "raw": "ACHD-FININDIANCLEARING-218224794", "amount": 1000.0, "type": "expense", "debit": 1000.0, "credit": 0.0, "balance": 3180.0, "page": "Page 20", "line": "49", "store": null, "commodity": null, "reference": "0000008096425280", "upi_id": null, "bankCode": "HDFC", "ifsc": null, "transaction_id": null}, {"date": "07/10/25", "date_iso": "2025-07-10", "description": "ACHD-FININDIANCLEARING-218142812", "raw": "ACHD-FININDIANCLEARING-218142812", "amount": 1000.0, "type": "expense", "debit": 1000.0, "credit": 0.0, "balance": 2180.0, "page": "Page 20", "line": "50", "store": null, "commodity": null, "reference": "0000008080866280", "upi_id": null, "bankCode": "HDFC", "ifsc": null, "transaction_id": null}, {"date": "07/10/25", "date_iso": "2025-07-10", "description": "UPI-BIGTREE *Closingbalanceincludesfundsearmarkedforholdandunclearedfunds Contentsofthisstatementwillbeconsideredcorrectifnoerrorisreportedwithin30daysofreceiptofstatement.TheaddressonthisstatementisthatonrecordwiththeBankasatthedayofrequesting thisstatement. StateaccountbranchGSTN:27AAACH2702H1Z0 HDFCBankGSTINnumberdetailsareavailableathttps://www.hdfcbank.com/personal/making-payments/online-tax-payment/goods-and-service-tax. RegisteredOfficeAddress:HDFCBankHouse,SenapatiBapatMarg,LowerParel,Mumbai400013", "raw": "UPI-BIGTREE *Closingbalanceincludesfundsearmarkedforholdandunclearedfunds Contentsofthisstatementwillbeconsideredcorrectifnoerrorisreportedwithin30daysofreceiptofstatement.TheaddressonthisstatementisthatonrecordwiththeBankasatthedayofrequesting thisstatement. StateaccountbranchGSTN:27AAACH2702H1Z0 HDFCBankGSTINnumberdetailsareavailableathttps://www.hdfcbank.com/personal/making-payments/online-tax-payment/goods-and-service-tax. RegisteredOfficeAddress:HDFCBankHouse,SenapatiBapatMarg,LowerParel,Mumbai400013", "amount": 205.72, "type": "expense", "debit": 205.72, "credit": 0.0, "balance": 1917.12, "page": "Page 20", "line": "60", "store": null, "commodity": null, "reference": "0000528079409109", "upi_id": "BIGTREE", "bankCode": "HDFC", "ifsc": null, "transaction_id": null}, {"date": "07/10/25", "date_iso": "2025-07-10", "description": "UPI-NPCI BHIM-BHIMCASHBACK@HDFCBANK-HDFC 0000001-101646890541-BHIMCASHBACK", "raw": "UPI-NPCI BHIM-BHIMCASHBACK@HDFCBANK-HDFC 0000001-101646890541-BHIMCASHBACK", "amount": 10.0, "type": "expense", "debit": 10.0, "credit": 0.0, "balance": 1927.12, "page": "Page 21", "line": "27", "store": null, "commodity": null, "reference": "0000101646890541", "upi_id": "NPCI", "bankCode": "HDFC", "ifsc": null, "transaction_id": null}, {"date": "07/10/25", "date_iso": "2025-07-10", "description": "UPI-SHAKUNTALADEVI BABL-PAYTM.S15NNHZ@P TY-YESB0MCHUPI-194349302867-NOREMARKS", "raw": "UPI-SHAKUNTALADEVI BABL-PAYTM.S15NNHZ@P TY-YESB0MCHUPI-194349302867-NOREMARKS", "amount": 10.0, "type": "expense", "debit": 10.0, "credit": 0.0, "balance": 1917.12, "page": "Page 21", "line": "30", "store": null, "commodity": null, "reference": "0000194349302867", "upi_id": "SHAKUNTALADEVI", "bankCode": "HDFC", "ifsc": "YESB0MCHUPI", "transaction_id": null}, {"date": "07/10/25", "date_iso": "2025-07-10", "description": "UPI-MRVISHNU MUNSHEELAL-VISHUNVISHWAKAR MA90211-2@OKAXIS-IDIB000M764-52803722326 6-CURSOR", "raw": "UPI-MRVISHNU MUNSHEELAL-VISHUNVISHWAKAR MA90211-2@OKAXIS-IDIB000M764-52803722326 6-CURSOR", "amount": 2000.0, "type": "income", "debit": 0.0, "credit": 2000.0, "balance": 3917.12, "page": "Page 21", "line": "34", "store": null, "commodity": null, "reference": "0000528037223266", "upi_id": "MRVISHNU", "bankCode": "HDFC", "ifsc": "IDIB000M764", "transaction_id": null}, {"date": "08/10/25", "date_iso": "2025-08-10", "description": "UPI-SWIGGY-UPISWIGGY@ICICI-ICIC0DC0099-1 25330147978-NOREMARKS", "raw": "UPI-SWIGGY-UPISWIGGY@ICICI-ICIC0DC0099-1 25330147978-NOREMARKS", "amount": 101.0, "type": "expense", "debit": 101.0, "credit": 0.0, "balance": 3816.12, "page": "Page 21", "line": "36", "store": null, "commodity": null, "reference": "0000125330147978", "upi_id": "SWIGGY", "bankCode": "HDFC", "ifsc": "ICIC0DC0099", "transaction_id": null}, {"date": "08/10/25", "date_iso": "2025-08-10", "description": "UPI-NPCI BHIM-BHIMCASHBACK@HDFCBANK-HDFC 0000001-101655199208-BHIMCASHBACK", "raw": "UPI-NPCI BHIM-BHIMCASHBACK@HDFCBANK-HDFC 0000001-101655199208-BHIMCASHBACK", "amount": 2.0, "type": "income", "debit": 0.0, "credit": 2.0, "balance": 3818.12, "page": "Page 21", "line": "39", "store": null, "commodity": null, "reference": "0000101655199208", "upi_id": "NPCI", "bankCode": "HDFC", "ifsc": null, "transaction_id": null}, {"date": "09/10/25", "date_iso": "2025-09-10", "description": "UPI-JIOHOTSTAR-HOTSTARONLINE@YBL-YESB0YB LUPI-528271796737-COLLECTREQUESTFR", "raw": "UPI-JIOHOTSTAR-HOTSTARONLINE@YBL-YESB0YB LUPI-528271796737-COLLECTREQUESTFR", "amount": 49.0, "type": "expense", "debit": 49.0, "credit": 0.0, "balance": 3769.12, "page": "Page 21", "line": "41", "store": null, "commodity": null, "reference": "0000528271796737", "upi_id": "JIOHOTSTAR", "bankCode": "HDFC", "ifsc": null, "transaction_id": null}, {"date": "10/10/25", "date_iso": "2025-10-10", "description": "UPI-MAMTAMUNSHEELAL VIS-MAMTAVISHWAKARM *Closingbalanceincludesfundsearmarkedforholdandunclearedfunds Contentsofthisstatementwillbeconsideredcorrectifnoerrorisreportedwithin30daysofreceiptofstatement.TheaddressonthisstatementisthatonrecordwiththeBankasatthedayofrequesting thisstatement. StateaccountbranchGSTN:27AAACH2702H1Z0 HDFCBankGSTINnumberdetailsareavailableathttps://www.hdfcbank.com/personal/making-payments/online-tax-payment/goods-and-service-tax. RegisteredOfficeAddress:HDFCBankHouse,SenapatiBapatMarg,LowerParel,Mumbai400013", "raw": "UPI-MAMTAMUNSHEELAL VIS-MAMTAVISHWAKARM *Closingbalanceincludesfundsearmarkedforholdandunclearedfunds Contentsofthisstatementwillbeconsideredcorrectifnoerrorisreportedwithin30daysofreceiptofstatement.TheaddressonthisstatementisthatonrecordwiththeBankasatthedayofrequesting thisstatement. StateaccountbranchGSTN:27AAACH2702H1Z0 HDFCBankGSTINnumberdetailsareavailableathttps://www.hdfcbank.com/personal/making-payments/online-tax-payment/goods-and-service-tax. RegisteredOfficeAddress:HDFCBankHouse,SenapatiBapatMarg,LowerParel,Mumbai400013", "amount": 700.0, "type": "expense", "debit": 700.0, "credit": 0.0, "balance": 2069.12, "page": "Page 21", "line": "60", "store": null, "commodity": null, "reference": "0000528365431652", "upi_id": "MAMTAMUNSHEELAL", "bankCode": "HDFC", "ifsc": null, "transaction_id": null}, {"date": "10/10/25", "date_iso": "2025-10-10", "description": "UPI-SACHINMUNSHEELAL VI-SACHINVISHWAKAR MA13188@OKHDFCBANK-KKBK0001432-094926293 262-NOREMARKS", "raw": "UPI-SACHINMUNSHEELAL VI-SACHINVISHWAKAR MA13188@OKHDFCBANK-KKBK0001432-094926293 262-NOREMARKS", "amount": 2000.0, "type": "expense", "debit": 2000.0, "credit": 0.0, "balance": 2769.12, "page": "Page 21", "line": "51", "store": null, "commodity": null, "reference": "0000094926293262", "upi_id": "SACHINMUNSHEELAL", "bankCode": "HDFC", "ifsc": "KKBK0001432", "transaction_id": null}, {"date": "10/10/25", "date_iso": "2025-10-10", "description": "ACHD-FININDIANCLEARING-218842805", "raw": "ACHD-FININDIANCLEARING-218842805", "amount": 1000.0, "type": "expense", "debit": 1000.0, "credit": 0.0, "balance": 2769.12, "page": "Page 21", "line": "42", "store": null, "commodity": null, "reference": "0000008187884283", "upi_id": null, "bankCode": "HDFC", "ifsc": null, "transaction_id": null}, {"date": "10/10/25", "date_iso": "2025-10-10", "description": "ACHD-FININDIANCLEARING-219773291", "raw": "ACHD-FININDIANCLEARING-219773291", "amount": 1000.0, "type": "expense", "debit": 1000.0, "credit": 0.0, "balance": 1769.12, "page": "Page 21", "line": "43", "store": null, "commodity": null, "reference": "0000008348041283", "upi_id": null, "bankCode": "HDFC", "ifsc": null, "transaction_id": null}, {"date": "10/10/25", "date_iso": "2025-10-10", "description": "UPI-MRMUNSHEELAL RAMSUR-MUNSHILALVISHWA KARMA210@OKAXIS-IDIB000M764-564930129580 -UPI", "raw": "UPI-MRMUNSHEELAL RAMSUR-MUNSHILALVISHWA KARMA210@OKAXIS-IDIB000M764-564930129580 -UPI", "amount": 3000.0, "type": "income", "debit": 0.0, "credit": 3000.0, "balance": 4769.12, "page": "Page 21", "line": "47", "store": null, "commodity": null, "reference": "0000564930129580", "upi_id": "MRMUNSHEELAL", "bankCode": "HDFC", "ifsc": "IDIB000M764", "transaction_id": null}, {"date": "11/10/25", "date_iso": "2025-11-10", "description": "UPI-BLINKIT-BLINKIT.RZP@HDFCBANK-HDFC0ME RUPI-101681338084-PAYVIARAZORPAY", "raw": "UPI-BLINKIT-BLINKIT.RZP@HDFCBANK-HDFC0ME RUPI-101681338084-PAYVIARAZORPAY", "amount": 101.0, "type": "expense", "debit": 101.0, "credit": 0.0, "balance": 1968.12, "page": "Page 22", "line": "25", "store": null, "commodity": null, "reference": "0000101681338084", "upi_id": "BLINKIT", "bankCode": "HDFC", "ifsc": null, "transaction_id": null}, {"date": "11/10/25", "date_iso": "2025-11-10", "description": "UPI-MAMTAMUNSHEELAL VIS-MAMTAVISHWAKARM A0948@OKSBI-KKBK0001432-528402671668-UPI", "raw": "UPI-MAMTAMUNSHEELAL VIS-MAMTAVISHWAKARM A0948@OKSBI-KKBK0001432-528402671668-UPI", "amount": 150.0, "type": "income", "debit": 0.0, "credit": 150.0, "balance": 2118.12, "page": "Page 22", "line": "28", "store": null, "commodity": null, "reference": "0000528402671668", "upi_id": "MAMTAMUNSHEELAL", "bankCode": "HDFC", "ifsc": "KKBK0001432", "transaction_id": null}, {"date": "11/10/25", "date_iso": "2025-11-10", "description": "UPI-VISHUNVISHWAKARMA902-VISHUNVISHWAKAR MA90211-2@OKAXIS-IDIB000M764-56509812072 3-UPI", "raw": "UPI-VISHUNVISHWAKARMA902-VISHUNVISHWAKAR MA90211-2@OKAXIS-IDIB000M764-56509812072 3-UPI", "amount": 2000.0, "type": "expense", "debit": 2000.0, "credit": 0.0, "balance": 118.12, "page": "Page 22", "line": "31", "store": null, "commodity": null, "reference": "0000565098120723", "upi_id": "VISHUNVISHWAKARMA902", "bankCode": "HDFC", "ifsc": "IDIB000M764", "transaction_id": null}, {"date": "15/10/25", "date_iso": "2025-10-15", "description": "UPI-NMMTTURBE C905-Q24567232@YBL-YESB0YB LUPI-172553446501-NOREMARKS", "raw": "UPI-NMMTTURBE C905-Q24567232@YBL-YESB0YB LUPI-172553446501-NOREMARKS", "amount": 6.0, "type": "expense", "debit": 6.0, "credit": 0.0, "balance": 112.12, "page": "Page 22", "line": "34", "store": null, "commodity": null, "reference": "0000172553446501", "upi_id": "NMMTTURBE", "bankCode": "HDFC", "ifsc": null, "transaction_id": null}, {"date": "17/10/25", "date_iso": "2025-10-17", "description": "UPI-MRVISHNU MUNSHEELAL-VISHUNVISHWAKAR MA90211-2@OKAXIS-IDIB000M764-52907722854 2-UPI", "raw": "UPI-MRVISHNU MUNSHEELAL-VISHUNVISHWAKAR MA90211-2@OKAXIS-IDIB000M764-52907722854 2-UPI", "amount": 250.0, "type": "income", "debit": 0.0, "credit": 250.0, "balance": 362.12, "page": "Page 22", "line": "38", "store": null, "commodity": null, "reference": "0000529077228542", "upi_id": "MRVISHNU", "bankCode": "HDFC", "ifsc": "IDIB000M764", "transaction_id": null}, {"date": "19/10/25", "date_iso": "2025-10-19", "description": "UPI-AMARAWATIDEVI MUNSHE-AMARAWATIDEVI24 11@OKAXIS-KKBK0001432-529281806041-UPI", "raw": "UPI-AMARAWATIDEVI MUNSHE-AMARAWATIDEVI24 11@OKAXIS-KKBK0001432-529281806041-UPI", "amount": 476.0, "type": "income", "debit": 0.0, "credit": 476.0, "balance": 838.12, "page": "Page 22", "line": "41", "store": null, "commodity": null, "reference": "0000529281806041", "upi_id": "AMARAWATIDEVI", "bankCode": "HDFC", "ifsc": "KKBK0001432", "transaction_id": null}, {"date": "19/10/25", "date_iso": "2025-10-19", "description": "UPI-AMAZON INDIA-AMAZON@YAPL-YESB0APLUPI -529275468268-YOUAREPAYINGFOR", "raw": "UPI-AMAZON INDIA-AMAZON@YAPL-YESB0APLUPI -529275468268-YOUAREPAYINGFOR", "amount": 480.0, "type": "expense", "debit": 480.0, "credit": 0.0, "balance": 358.12, "page": "Page 22", "line": "44", "store": null, "commodity": null, "reference": "0000529275468268", "upi_id": "AMAZON", "bankCode": "HDFC", "ifsc": "YESB0APLUPI", "transaction_id": null}, {"date": "23/10/25", "date_iso": "2025-10-23", "description": "UPI-SACHINMUNSHEELAL VI-SACHINVISHWAKAR MA13188@OKICICI-KKBK0001432-529612472153 -UPI", "raw": "UPI-SACHINMUNSHEELAL VI-SACHINVISHWAKAR MA13188@OKICICI-KKBK0001432-529612472153 -UPI", "amount": 100.0, "type": "income", "debit": 0.0, "credit": 100.0, "balance": 458.12, "page": "Page 22", "line": "48", "store": null, "commodity": null, "reference": "0000529612472153", "upi_id": "SACHINMUNSHEELAL", "bankCode": "HDFC", "ifsc": "KKBK0001432", "transaction_id": null}, {"date": "27/10/25", "date_iso": "2025-10-27", "description": "UPI-MRVISHNU MUNSHEELAL-VISHUNVISHWAKAR MA90211-2@OKAXIS-IDIB000M764-56665168821 9-RECHARGE", "raw": "UPI-MRVISHNU MUNSHEELAL-VISHUNVISHWAKAR MA90211-2@OKAXIS-IDIB000M764-56665168821 9-RECHARGE", "amount": 500.0, "type": "income", "debit": 0.0, "credit": 500.0, "balance": 958.12, "page": "Page 22", "line": "52", "store": null, "commodity": null, "reference": "0000566651688219", "upi_id": "MRVISHNU", "bankCode": "HDFC", "ifsc": "IDIB000M764", "transaction_id": null}, {"date": "27/10/25", "date_iso": "2025-10-27", "description": "UPI-MRVISHNU *Closingbalanceincludesfundsearmarkedforholdandunclearedfunds Contentsofthisstatementwillbeconsideredcorrectifnoerrorisreportedwithin30daysofreceiptofstatement.TheaddressonthisstatementisthatonrecordwiththeBankasatthedayofrequesting thisstatement. StateaccountbranchGSTN:27AAACH2702H1Z0 HDFCBankGSTINnumberdetailsareavailableathttps://www.hdfcbank.com/personal/making-payments/online-tax-payment/goods-and-service-tax. RegisteredOfficeAddress:HDFCBankHouse,SenapatiBapatMarg,LowerParel,Mumbai400013", "raw": "UPI-MRVISHNU *Closingbalanceincludesfundsearmarkedforholdandunclearedfunds Contentsofthisstatementwillbeconsideredcorrectifnoerrorisreportedwithin30daysofreceiptofstatement.TheaddressonthisstatementisthatonrecordwiththeBankasatthedayofrequesting thisstatement. StateaccountbranchGSTN:27AAACH2702H1Z0 HDFCBankGSTINnumberdetailsareavailableathttps://www.hdfcbank.com/personal/making-payments/online-tax-payment/goods-and-service-tax. RegisteredOfficeAddress:HDFCBankHouse,SenapatiBapatMarg,LowerParel,Mumbai400013", "amount": 1500.0, "type": "income", "debit": 0.0, "credit": 1500.0, "balance": 2458.12, "page": "Page 22", "line": "60", "store": null, "commodity": null, "reference": "0000566670776659", "upi_id": "MRVISHNU", "bankCode": "HDFC", "ifsc": null, "transaction_id": null}, {"date": "28/10/25", "date_iso": "2025-10-28", "description": "UPI-SWIGGY LTD-SWIGGYUPI@AXB-UTIB0000100 -113299631925-PAYFORINTENT", "raw": "UPI-SWIGGY LTD-SWIGGYUPI@AXB-UTIB0000100 -113299631925-PAYFORINTENT", "amount": 122.0, "type": "expense", "debit": 122.0, "credit": 0.0, "balance": 2336.12, "page": "Page 23", "line": "27", "store": null, "commodity": null, "reference": "0000113299631925", "upi_id": "SWIGGY", "bankCode": "HDFC", "ifsc": "UTIB0000100", "transaction_id": null}, {"date": "31/10/25", "date_iso": "2025-10-31", "description": "UPI-AARYAN STEEL-GPAY-12190486629@OKBIZA XIS-UTIB0000553-113424430366-UPI STATEMENTSUMMARY :- OpeningBalance DrCount CrCount Debits Credits ClosingBal 912.92 206 39 112,702.80 114,096.00 2,306.12 GeneratedOn: 01-Nov-202521:42 GeneratedBy:154792097 RequestingBranchCode:NET Thisisacomputergeneratedstatementanddoes notrequiresignature. *Closingbalanceincludesfundsearmarkedforholdandunclearedfunds Contentsofthisstatementwillbeconsideredcorrectifnoerrorisreportedwithin30daysofreceiptofstatement.TheaddressonthisstatementisthatonrecordwiththeBankasatthedayofrequesting thisstatement. StateaccountbranchGSTN:27AAACH2702H1Z0 HDFCBankGSTINnumberdetailsareavailableathttps://www.hdfcbank.com/personal/making-payments/online-tax-payment/goods-and-service-tax. RegisteredOfficeAddress:HDFCBankHouse,SenapatiBapatMarg,LowerParel,Mumbai400013", "raw": "UPI-AARYAN STEEL-GPAY-12190486629@OKBIZA XIS-UTIB0000553-113424430366-UPI STATEMENTSUMMARY :- OpeningBalance DrCount CrCount Debits Credits ClosingBal 912.92 206 39 112,702.80 114,096.00 2,306.12 GeneratedOn: 01-Nov-202521:42 GeneratedBy:154792097 RequestingBranchCode:NET Thisisacomputergeneratedstatementanddoes notrequiresignature. *Closingbalanceincludesfundsearmarkedforholdandunclearedfunds Contentsofthisstatementwillbeconsideredcorrectifnoerrorisreportedwithin30daysofreceiptofstatement.TheaddressonthisstatementisthatonrecordwiththeBankasatthedayofrequesting thisstatement. StateaccountbranchGSTN:27AAACH2702H1Z0 HDFCBankGSTINnumberdetailsareavailableathttps://www.hdfcbank.com/personal/making-payments/online-tax-payment/goods-and-service-tax. RegisteredOfficeAddress:HDFCBankHouse,SenapatiBapatMarg,LowerParel,Mumbai400013", "amount": 30.0, "type": "expense", "debit": 30.0, "credit": 0.0, "balance": 2306.12, "page": "Page 23", "line": "43", "store": null, "commodity": null, "reference": "0000113424430366", "upi_id": "AARYAN", "bankCode": "HDFC", "ifsc": "UTIB0000553", "transaction_id": null}], "count": 242}