{"success": true, "transactions": [{"date": "01-07-2025", "date_iso": "2025-01-07", "description": "UPI/CAPITALFLOAT/518288963974/Request", "raw": "UPI/CAPITALFLOAT/518288963974/Request", "amount": 4766.77, "type": "expense", "debit": 4766.77, "credit": 0.0, "balance": 4766.77, "page": "Text", "line": "17", "store": "CAPITALFLOAT", "commodity": "Request", "transactionId": "518288963974", "personName": "Request", "accountNumber": null, "transferType": "UPI", "upiId": "CAPITALFLOAT", "bankCode": "KKBK"}, {"date": "01-07-2025", "date_iso": "2025-01-07", "description": "UPI/SAHIL MANCHINDR/554805569566/UPI", "raw": "UPI/SAHIL MANCHINDR/554805569566/UPI", "amount": 190.0, "type": "income", "debit": 0.0, "credit": 190.0, "balance": 190.0, "page": "Text", "line": "19", "store": "SAHIL MANCHINDR", "commodity": null, "transactionId": "554805569566", "personName": "UPI", "accountNumber": null, "transferType": "UPI", "upiId": "SAHIL MANCHINDR", "bankCode": "KKBK"}, {"date": "01-07-2025", "date_iso": "2025-01-07", "description": "UPI/23000192idfcban/518213041447/UPI", "raw": "UPI/23000192idfcban/518213041447/UPI", "amount": 30.0, "type": "expense", "debit": 30.0, "credit": 0.0, "balance": 30.0, "page": "Text", "line": "20", "store": "23000192idfcban", "commodity": null, "transactionId": "518213041447", "personName": "UPI", "accountNumber": null, "transferType": "UPI", "upiId": "23000192idfcban", "bankCode": "KKBK"}, {"date": "01-07-2025", "date_iso": "2025-01-07", "description": "UPI/vivekdongre411o/518219156286/UPI", "raw": "UPI/vivekdongre411o/518219156286/UPI", "amount": 185.0, "type": "expense", "debit": 185.0, "credit": 0.0, "balance": 185.0, "page": "Text", "line": "21", "store": "vivekdongre411o", "commodity": null, "transactionId": "518219156286", "personName": "UPI", "accountNumber": null, "transferType": "UPI", "upiId": "vivekdongre411o", "bankCode": "KKBK"}, {"date": "01-07-2025", "date_iso": "2025-01-07", "description": "UPI/OMKAR TANAJI KA/554803313758/UPI", "raw": "UPI/OMKAR TANAJI KA/554803313758/UPI", "amount": 185.0, "type": "income", "debit": 0.0, "credit": 185.0, "balance": 185.0, "page": "Text", "line": "22", "store": "OMKAR TANAJI KA", "commodity": null, "transactionId": "554803313758", "personName": "UPI", "accountNumber": null, "transferType": "UPI", "upiId": "OMKAR TANAJI KA", "bankCode": "KKBK"}, {"date": "01-07-2025", "date_iso": "2025-01-07", "description": "UPI/paytmqr69lppxpt/518220354967/Kitkat", "raw": "UPI/paytmqr69lppxpt/518220354967/Kitkat", "amount": 75.0, "type": "expense", "debit": 75.0, "credit": 0.0, "balance": 75.0, "page": "Text", "line": "23", "store": "paytmqr69lppxpt", "commodity": "Kitkat", "transactionId": "518220354967", "personName": "Kitkat", "accountNumber": null, "transferType": "UPI", "upiId": "paytmqr69lppxpt", "bankCode": "KKBK"}, {"date": "02-07-2025", "date_iso": "2025-02-07", "description": "UPI/q561987105@ybl/518313786343/Sandwich", "raw": "UPI/q561987105@ybl/518313786343/Sandwich", "amount": 40.0, "type": "expense", "debit": 40.0, "credit": 0.0, "balance": 40.0, "page": "Text", "line": "24", "store": "q561987105@ybl", "commodity": "Sandwich", "transactionId": "518313786343", "personName": "Sandwich", "accountNumber": null, "transferType": "UPI", "upiId": "q561987105@ybl", "bankCode": "KKBK"}, {"date": "02-07-2025", "date_iso": "2025-02-07", "description": "UPI/gpay-1125742263/518313790470/Milk", "raw": "UPI/gpay-1125742263/518313790470/Milk", "amount": 40.0, "type": "expense", "debit": 40.0, "credit": 0.0, "balance": 40.0, "page": "Text", "line": "25", "store": "gpay-1125742263", "commodity": "Milk", "transactionId": "518313790470", "personName": "Milk", "accountNumber": null, "transferType": "UPI", "upiId": "gpay-1125742263", "bankCode": "KKBK"}, {"date": "02-07-2025", "date_iso": "2025-02-07", "description": "UPI/q683674770@ybl/518321928322/UPI", "raw": "UPI/q683674770@ybl/518321928322/UPI", "amount": 53.0, "type": "expense", "debit": 53.0, "credit": 0.0, "balance": 53.0, "page": "Text", "line": "27", "store": "q683674770@ybl", "commodity": null, "transactionId": "518321928322", "personName": "UPI", "accountNumber": null, "transferType": "UPI", "upiId": "q683674770@ybl", "bankCode": "KKBK"}, {"date": "02-07-2025", "date_iso": "2025-02-07", "description": "UPI/gudduchahan2394/518321955249/Pani puri", "raw": "UPI/gudduchahan2394/518321955249/Pani puri", "amount": 75.0, "type": "expense", "debit": 75.0, "credit": 0.0, "balance": 75.0, "page": "Text", "line": "28", "store": "gudduchahan2394", "commodity": "Pani Puri", "transactionId": "518321955249", "personName": "Pani puri", "accountNumber": null, "transferType": "UPI", "upiId": "gudduchahan2394", "bankCode": "KKBK"}, {"date": "02-07-2025", "date_iso": "2025-02-07", "description": "CASHBACK EARNED ONBF-mcm4j3lecc492bf", "raw": "CASHBACK EARNED ONBF-mcm4j3lecc492bf", "amount": 1.0, "type": "income", "debit": 0.0, "credit": 1.0, "balance": 1.0, "page": "Text", "line": "29", "store": null, "commodity": null, "transactionId": null, "personName": null, "accountNumber": null, "transferType": null, "upiId": null, "bankCode": "KKBK"}, {"date": "03-07-2025", "date_iso": "2025-03-07", "description": "UPI/Amazon Pay/518493630960/Request from", "raw": "UPI/Amazon Pay/518493630960/Request from", "amount": 900.0, "type": "expense", "debit": 900.0, "credit": 0.0, "balance": 900.0, "page": "Text", "line": "31", "store": "Amazon Pay", "commodity": "Request From", "transactionId": "518493630960", "personName": "Request from", "accountNumber": null, "transferType": "UPI", "upiId": "Amazon Pay", "bankCode": "KKBK"}, {"date": "03-07-2025", "date_iso": "2025-03-07", "description": "UPI/paytmqrx8y62dhd/518410948167/Marie", "raw": "UPI/paytmqrx8y62dhd/518410948167/Marie", "amount": 20.0, "type": "expense", "debit": 20.0, "credit": 0.0, "balance": 20.0, "page": "Text", "line": "33", "store": "paytmqrx8y62dhd", "commodity": "Marie", "transactionId": "518410948167", "personName": "Marie", "accountNumber": null, "transferType": "UPI", "upiId": "paytmqrx8y62dhd", "bankCode": "KKBK"}, {"date": "03-07-2025", "date_iso": "2025-03-07", "description": "UPI/MAMTA MUNSHEELA/107442200232/UPI", "raw": "UPI/MAMTA MUNSHEELA/107442200232/UPI", "amount": 4400.0, "type": "income", "debit": 0.0, "credit": 4400.0, "balance": 4400.0, "page": "Text", "line": "30", "store": "MAMTA MUNSHEELA", "commodity": null, "transactionId": "107442200232", "personName": "UPI", "accountNumber": null, "transferType": "UPI", "upiId": "MAMTA MUNSHEELA", "bankCode": "KKBK"}, {"date": "04-07-2025", "date_iso": "2025-04-07", "description": "UPI/SHREESHA/518517417643/UPI", "raw": "UPI/SHREESHA/518517417643/UPI", "amount": 100.0, "type": "income", "debit": 0.0, "credit": 100.0, "balance": 100.0, "page": "Text", "line": "35", "store": "SHREESHA", "commodity": null, "transactionId": "518517417643", "personName": "UPI", "accountNumber": null, "transferType": "UPI", "upiId": "SHREESHA", "bankCode": "KKBK"}, {"date": "04-07-2025", "date_iso": "2025-04-07", "description": "UPI/gpay-1125742263/518514159845/UPI", "raw": "UPI/gpay-1125742263/518514159845/UPI", "amount": 55.0, "type": "expense", "debit": 55.0, "credit": 0.0, "balance": 55.0, "page": "Text", "line": "36", "store": "gpay-1125742263", "commodity": null, "transactionId": "518514159845", "personName": "UPI", "accountNumber": null, "transferType": "UPI", "upiId": "gpay-1125742263", "bankCode": "KKBK"}, {"date": "04-07-2025", "date_iso": "2025-04-07", "description": "UPI/SHREESHA/555131195480/UPI", "raw": "UPI/SHREESHA/555131195480/UPI", "amount": 120.0, "type": "expense", "debit": 120.0, "credit": 0.0, "balance": 120.0, "page": "Text", "line": "37", "store": "SHREESHA", "commodity": null, "transactionId": "555131195480", "personName": "UPI", "accountNumber": null, "transferType": "UPI", "upiId": "SHREESHA", "bankCode": "KKBK"}, {"date": "04-07-2025", "date_iso": "2025-04-07", "description": "UPI/q543130246@ybl/518520385084/Bhojan", "raw": "UPI/q543130246@ybl/518520385084/Bhojan", "amount": 170.0, "type": "expense", "debit": 170.0, "credit": 0.0, "balance": 170.0, "page": "Text", "line": "38", "store": "q543130246@ybl", "commodity": "Bhojan", "transactionId": "518520385084", "personName": "Bhojan", "accountNumber": null, "transferType": "UPI", "upiId": "q543130246@ybl", "bankCode": "KKBK"}, {"date": "05-07-2025", "date_iso": "2025-05-07", "description": "UPI/q429367583@ybl/518614642480/UPI", "raw": "UPI/q429367583@ybl/518614642480/UPI", "amount": 70.0, "type": "expense", "debit": 70.0, "credit": 0.0, "balance": 70.0, "page": "Text", "line": "39", "store": "q429367583@ybl", "commodity": null, "transactionId": "518614642480", "personName": "UPI", "accountNumber": null, "transferType": "UPI", "upiId": "q429367583@ybl", "bankCode": "KKBK"}, {"date": "05-07-2025", "date_iso": "2025-05-07", "description": "UPI/23000192@idfcba/518614651556", "raw": "UPI/23000192@idfcba/518614651556", "amount": 30.0, "type": "expense", "debit": 30.0, "credit": 0.0, "balance": 30.0, "page": "Text", "line": "40", "store": "23000192@idfcba", "commodity": null, "transactionId": null, "personName": null, "accountNumber": null, "transferType": null, "upiId": null, "bankCode": "KKBK"}, {"date": "05-07-2025", "date_iso": "2025-05-07", "description": "UPI/SHREESHA/518696359306/UPI", "raw": "UPI/SHREESHA/518696359306/UPI", "amount": 70.0, "type": "income", "debit": 0.0, "credit": 70.0, "balance": 70.0, "page": "Text", "line": "42", "store": "SHREESHA", "commodity": null, "transactionId": "518696359306", "personName": "UPI", "accountNumber": null, "transferType": "UPI", "upiId": "SHREESHA", "bankCode": "KKBK"}, {"date": "05-07-2025", "date_iso": "2025-05-07", "description": "UPI/sahilgaykar307@/518614673771/Thanks", "raw": "UPI/sahilgaykar307@/518614673771/Thanks", "amount": 100.0, "type": "expense", "debit": 100.0, "credit": 0.0, "balance": 100.0, "page": "Text", "line": "43", "store": "sahilgaykar307@", "commodity": "Thanks", "transactionId": "518614673771", "personName": "Thanks", "accountNumber": null, "transferType": "UPI", "upiId": "sahilgaykar307@", "bankCode": "KKBK"}, {"date": "05-07-2025", "date_iso": "2025-05-07", "description": "CASHBACK EARNED ONBF-mcq01g4t37804b9", "raw": "CASHBACK EARNED ONBF-mcq01g4t37804b9", "amount": 1.15, "type": "income", "debit": 0.0, "credit": 1.15, "balance": 1.15, "page": "Text", "line": "45", "store": null, "commodity": null, "transactionId": null, "personName": null, "accountNumber": null, "transferType": null, "upiId": null, "bankCode": "KKBK"}, {"date": "05-07-2025", "date_iso": "2025-05-07", "description": "UPI/shreeshauppunda/518619344740/UPI", "raw": "UPI/shreeshauppunda/518619344740/UPI", "amount": 20.0, "type": "expense", "debit": 20.0, "credit": 0.0, "balance": 20.0, "page": "Text", "line": "46", "store": "shreeshauppunda", "commodity": null, "transactionId": "518619344740", "personName": "UPI", "accountNumber": null, "transferType": "UPI", "upiId": "shreeshauppunda", "bankCode": "KKBK"}, {"date": "05-07-2025", "date_iso": "2025-05-07", "description": "UPI/ombk.aacv42604n/518620581803/Petrol", "raw": "UPI/ombk.aacv42604n/518620581803/Petrol", "amount": 880.0, "type": "expense", "debit": 880.0, "credit": 0.0, "balance": 880.0, "page": "Text", "line": "47", "store": "ombk.aacv42604n", "commodity": "Petrol", "transactionId": "518620581803", "personName": "Petrol", "accountNumber": null, "transferType": "UPI", "upiId": "ombk.aacv42604n", "bankCode": "KKBK"}, {"date": "05-07-2025", "date_iso": "2025-05-07", "description": "UPI/q958942023@ybl/518620713317", "raw": "UPI/q958942023@ybl/518620713317", "amount": 80.0, "type": "expense", "debit": 80.0, "credit": 0.0, "balance": 80.0, "page": "Text", "line": "48", "store": "q958942023@ybl", "commodity": null, "transactionId": null, "personName": null, "accountNumber": null, "transferType": null, "upiId": null, "bankCode": "KKBK"}, {"date": "06-07-2025", "date_iso": "2025-06-07", "description": "CASHBACK EARNED ONBF-mcrlxxye21b3267", "raw": "CASHBACK EARNED ONBF-mcrlxxye21b3267", "amount": 1.15, "type": "income", "debit": 0.0, "credit": 1.15, "balance": 1.15, "page": "Text", "line": "10", "store": null, "commodity": null, "transactionId": null, "personName": null, "accountNumber": null, "transferType": null, "upiId": null, "bankCode": "KKBK"}, {"date": "06-07-2025", "date_iso": "2025-06-07", "description": "UPI/gpay-1125792972/518717308013/Bike", "raw": "UPI/gpay-1125792972/518717308013/Bike", "amount": 900.0, "type": "expense", "debit": 900.0, "credit": 0.0, "balance": 900.0, "page": "Text", "line": "8", "store": "gpay-1125792972", "commodity": "Bike", "transactionId": "518717308013", "personName": "Bike", "accountNumber": null, "transferType": "UPI", "upiId": "gpay-1125792972", "bankCode": "KKBK"}, {"date": "06-07-2025", "date_iso": "2025-06-07", "description": "UPI/paytmqr5e3bgq@p/518717398941/Pan", "raw": "UPI/paytmqr5e3bgq@p/518717398941/Pan", "amount": 48.0, "type": "expense", "debit": 48.0, "credit": 0.0, "balance": 48.0, "page": "Text", "line": "11", "store": "paytmqr5e3bgq@p", "commodity": "Pan", "transactionId": "518717398941", "personName": "Pan", "accountNumber": null, "transferType": "UPI", "upiId": "paytmqr5e3bgq@p", "bankCode": "KKBK"}, {"date": "06-07-2025", "date_iso": "2025-06-07", "description": "UPI/SANDEEP KUMAR/518715071621/UPI", "raw": "UPI/SANDEEP KUMAR/518715071621/UPI", "amount": 1.0, "type": "income", "debit": 0.0, "credit": 1.0, "balance": 1.0, "page": "Text", "line": "6", "store": "SANDEEP KUMAR", "commodity": null, "transactionId": "518715071621", "personName": "UPI", "accountNumber": null, "transferType": "UPI", "upiId": "SANDEEP KUMAR", "bankCode": "KKBK"}, {"date": "06-07-2025", "date_iso": "2025-06-07", "description": "UPI/paytmqr6gg43m@p/518715069470/Food", "raw": "UPI/paytmqr6gg43m@p/518715069470/Food", "amount": 160.0, "type": "expense", "debit": 160.0, "credit": 0.0, "balance": 160.0, "page": "Text", "line": "5", "store": "paytmqr6gg43m@p", "commodity": "Food", "transactionId": "518715069470", "personName": "Food", "accountNumber": null, "transferType": "UPI", "upiId": "paytmqr6gg43m@p", "bankCode": "KKBK"}, {"date": "06-07-2025", "date_iso": "2025-06-07", "description": "UPI/q661369950@ybl/518715103820/UPI", "raw": "UPI/q661369950@ybl/518715103820/UPI", "amount": 50.0, "type": "expense", "debit": 50.0, "credit": 0.0, "balance": 50.0, "page": "Text", "line": "7", "store": "q661369950@ybl", "commodity": null, "transactionId": "518715103820", "personName": "UPI", "accountNumber": null, "transferType": "UPI", "upiId": "q661369950@ybl", "bankCode": "KKBK"}, {"date": "07-07-2025", "date_iso": "2025-07-07", "description": "UPI/23000192@idfcba/518814132978/UPI", "raw": "UPI/23000192@idfcba/518814132978/UPI", "amount": 30.0, "type": "expense", "debit": 30.0, "credit": 0.0, "balance": 30.0, "page": "Text", "line": "12", "store": "23000192@idfcba", "commodity": null, "transactionId": "518814132978", "personName": "UPI", "accountNumber": null, "transferType": "UPI", "upiId": "23000192@idfcba", "bankCode": "KKBK"}, {"date": "07-07-2025", "date_iso": "2025-07-07", "description": "NEFT HDFCH00349124744 ALLERN NEFTINW-1264885378", "raw": "NEFT HDFCH00349124744 ALLERN NEFTINW-1264885378", "amount": 27000.0, "type": "income", "debit": 0.0, "credit": 27000.0, "balance": 27000.0, "page": "Text", "line": "13", "store": null, "commodity": null, "transactionId": "HDFCH00349124744", "personName": "ALLERN NEFTINW-1264885378", "accountNumber": null, "transferType": "NEFT", "upiId": null, "bankCode": "KKBK"}, {"date": "07-07-2025", "date_iso": "2025-07-07", "description": "UPI/q683674770@ybl/518820165010/Pan", "raw": "UPI/q683674770@ybl/518820165010/Pan", "amount": 16.0, "type": "expense", "debit": 16.0, "credit": 0.0, "balance": 16.0, "page": "Text", "line": "15", "store": "q683674770@ybl", "commodity": "Pan", "transactionId": "518820165010", "personName": "Pan", "accountNumber": null, "transferType": "UPI", "upiId": "q683674770@ybl", "bankCode": "KKBK"}, {"date": "07-07-2025", "date_iso": "2025-07-07", "description": "UPI/q536376884@ybl/518820176444/Chips", "raw": "UPI/q536376884@ybl/518820176444/Chips", "amount": 150.0, "type": "expense", "debit": 150.0, "credit": 0.0, "balance": 150.0, "page": "Text", "line": "16", "store": "q536376884@ybl", "commodity": "Chips", "transactionId": "518820176444", "personName": "Chips", "accountNumber": null, "transferType": "UPI", "upiId": "q536376884@ybl", "bankCode": "KKBK"}, {"date": "07-07-2025", "date_iso": "2025-07-07", "description": "UPI/paytmqr62oyal@p/518820196584/UPI", "raw": "UPI/paytmqr62oyal@p/518820196584/UPI", "amount": 50.0, "type": "expense", "debit": 50.0, "credit": 0.0, "balance": 50.0, "page": "Text", "line": "17", "store": "paytmqr62oyal@p", "commodity": null, "transactionId": "518820196584", "personName": "UPI", "accountNumber": null, "transferType": "UPI", "upiId": "paytmqr62oyal@p", "bankCode": "KKBK"}, {"date": "08-07-2025", "date_iso": "2025-08-07", "description": "ayment for KB2", "raw": "UPI/KBCHOLA/518940465240/Payment for KB2", "amount": 3025.0, "type": "expense", "debit": 3025.0, "credit": 0.0, "balance": 3025.0, "page": "Text", "line": "26", "store": "KBCHOLA", "commodity": null, "transactionId": "518940465240", "personName": "Payment for KB2", "accountNumber": null, "transferType": "UPI", "upiId": "KBCHOLA", "bankCode": "KKBK"}, {"date": "08-07-2025", "date_iso": "2025-08-07", "description": "UPI/shilpamishra020/518921812045/UPI", "raw": "UPI/shilpamishra020/518921812045/UPI", "amount": 30.0, "type": "expense", "debit": 30.0, "credit": 0.0, "balance": 30.0, "page": "Text", "line": "25", "store": "shilpamishra020", "commodity": null, "transactionId": "518921812045", "personName": "UPI", "accountNumber": null, "transferType": "UPI", "upiId": "shilpamishra020", "bankCode": "KKBK"}, {"date": "08-07-2025", "date_iso": "2025-08-07", "description": "CASHBACK EARNED ONBF-mcupuf2n21f6f3e", "raw": "CASHBACK EARNED ONBF-mcupuf2n21f6f3e", "amount": 2.0, "type": "income", "debit": 0.0, "credit": 2.0, "balance": 2.0, "page": "Text", "line": "24", "store": null, "commodity": null, "transactionId": null, "personName": null, "accountNumber": null, "transferType": null, "upiId": null, "bankCode": "KKBK"}, {"date": "08-07-2025", "date_iso": "2025-08-07", "description": "UPI/Mr PUSHPARAJ SI/518994342377/UPI", "raw": "UPI/Mr PUSHPARAJ SI/518994342377/UPI", "amount": 100.0, "type": "income", "debit": 0.0, "credit": 100.0, "balance": 100.0, "page": "Text", "line": "20", "store": "Mr PUSHPARAJ SI", "commodity": null, "transactionId": "518994342377", "personName": "UPI", "accountNumber": null, "transferType": "UPI", "upiId": "Mr PUSHPARAJ SI", "bankCode": "KKBK"}, {"date": "08-07-2025", "date_iso": "2025-08-07", "description": "UPI/MANOJ KUMAR PR/518997770197/Rent", "raw": "UPI/MANOJ KUMAR PR/518997770197/Rent", "amount": 6000.0, "type": "expense", "debit": 6000.0, "credit": 0.0, "balance": 6000.0, "page": "Text", "line": "21", "store": "MANOJ KUMAR PR", "commodity": "Rent", "transactionId": "518997770197", "personName": "Rent", "accountNumber": null, "transferType": "UPI", "upiId": "MANOJ KUMAR PR", "bankCode": "KKBK"}, {"date": "08-07-2025", "date_iso": "2025-08-07", "description": "UPI/zeptoonline@ybl/518912342735/Payment", "raw": "UPI/zeptoonline@ybl/518912342735/Payment", "amount": 375.0, "type": "expense", "debit": 375.0, "credit": 0.0, "balance": 375.0, "page": "Text", "line": "18", "store": "zeptoonline@ybl", "commodity": "Payment", "transactionId": "518912342735", "personName": "Payment", "accountNumber": null, "transferType": "UPI", "upiId": "zeptoonline@ybl", "bankCode": "KKBK"}, {"date": "08-07-2025", "date_iso": "2025-08-07", "description": "UPI/q683674770@ybl/518921778656/Pan", "raw": "UPI/q683674770@ybl/518921778656/Pan", "amount": 16.0, "type": "expense", "debit": 16.0, "credit": 0.0, "balance": 16.0, "page": "Text", "line": "23", "store": "q683674770@ybl", "commodity": "Pan", "transactionId": "518921778656", "personName": "Pan", "accountNumber": null, "transferType": "UPI", "upiId": "q683674770@ybl", "bankCode": "KKBK"}, {"date": "09-07-2025", "date_iso": "2025-09-07", "description": "UPI/Zepto/555670520375/UPI", "raw": "UPI/Zepto/555670520375/UPI", "amount": 171.35, "type": "expense", "debit": 171.35, "credit": 0.0, "balance": 171.35, "page": "Text", "line": "34", "store": "Zepto", "commodity": null, "transactionId": "555670520375", "personName": "UPI", "accountNumber": null, "transferType": "UPI", "upiId": "Zepto", "bankCode": "KKBK"}, {"date": "09-07-2025", "date_iso": "2025-09-07", "description": "UPI/SHILPA BAJRANGB/555660698514/UPI", "raw": "UPI/SHILPA BAJRANGB/555660698514/UPI", "amount": 200.0, "type": "income", "debit": 0.0, "credit": 200.0, "balance": 200.0, "page": "Text", "line": "35", "store": "SHILPA BAJRANGB", "commodity": null, "transactionId": "555660698514", "personName": "UPI", "accountNumber": null, "transferType": "UPI", "upiId": "SHILPA BAJRANGB", "bankCode": "KKBK"}, {"date": "09-07-2025", "date_iso": "2025-09-07", "description": "UPI/q108604194@ybl/519022445416/Capacitor", "raw": "UPI/q108604194@ybl/519022445416/Capacitor", "amount": 50.0, "type": "expense", "debit": 50.0, "credit": 0.0, "balance": 50.0, "page": "Text", "line": "36", "store": "q108604194@ybl", "commodity": "Capacitor", "transactionId": "519022445416", "personName": "Capacitor", "accountNumber": null, "transferType": "UPI", "upiId": "q108604194@ybl", "bankCode": "KKBK"}, {"date": "09-07-2025", "date_iso": "2025-09-07", "description": "UPI/gpay-1125625909/519014019638/UPI", "raw": "UPI/gpay-1125625909/519014019638/UPI", "amount": 90.0, "type": "expense", "debit": 90.0, "credit": 0.0, "balance": 90.0, "page": "Text", "line": "33", "store": "gpay-1125625909", "commodity": null, "transactionId": "519014019638", "personName": "UPI", "accountNumber": null, "transferType": "UPI", "upiId": "gpay-1125625909", "bankCode": "KKBK"}, {"date": "09-07-2025", "date_iso": "2025-09-07", "description": "UPI/SHILPA BAJRANGB/555629697627/UPI", "raw": "UPI/SHILPA BAJRANGB/555629697627/UPI", "amount": 120.0, "type": "income", "debit": 0.0, "credit": 120.0, "balance": 120.0, "page": "Text", "line": "29", "store": "SHILPA BAJRANGB", "commodity": null, "transactionId": "555629697627", "personName": "UPI", "accountNumber": null, "transferType": "UPI", "upiId": "SHILPA BAJRANGB", "bankCode": "KKBK"}, {"date": "09-07-2025", "date_iso": "2025-09-07", "description": "UPI/paytm.s1h2sjy@p/519014013638/Frankie", "raw": "UPI/paytm.s1h2sjy@p/519014013638/Frankie", "amount": 105.0, "type": "expense", "debit": 105.0, "credit": 0.0, "balance": 105.0, "page": "Text", "line": "31", "store": "paytm.s1h2sjy@p", "commodity": "Frankie", "transactionId": "519014013638", "personName": "Frankie", "accountNumber": null, "transferType": "UPI", "upiId": "paytm.s1h2sjy@p", "bankCode": "KKBK"}, {"date": "09-07-2025", "date_iso": "2025-09-07", "description": "UPI/Mr MUNSHEELAL R/555691409334/kada", "raw": "UPI/Mr MUNSHEELAL R/555691409334/kada", "amount": 1200.0, "type": "expense", "debit": 1200.0, "credit": 0.0, "balance": 1200.0, "page": "Text", "line": "30", "store": "Mr MUNSHEELAL R", "commodity": "Kada", "transactionId": "555691409334", "personName": "kada", "accountNumber": null, "transferType": "UPI", "upiId": "Mr MUNSHEELAL R", "bankCode": "KKBK"}, {"date": "09-07-2025", "date_iso": "2025-09-07", "description": "UPI/shilpamishra020/519010566016/For milky", "raw": "UPI/shilpamishra020/519010566016/For milky", "amount": 120.0, "type": "expense", "debit": 120.0, "credit": 0.0, "balance": 120.0, "page": "Text", "line": "27", "store": "shilpamishra020", "commodity": "For Milky", "transactionId": "519010566016", "personName": "For milky", "accountNumber": null, "transferType": "UPI", "upiId": "shilpamishra020", "bankCode": "KKBK"}, {"date": "09-07-2025", "date_iso": "2025-09-07", "description": "CASHBACK EARNED ONBF-mcvpebtv1107144", "raw": "CASHBACK EARNED ONBF-mcvpebtv1107144", "amount": 1.0, "type": "income", "debit": 0.0, "credit": 1.0, "balance": 1.0, "page": "Text", "line": "32", "store": null, "commodity": null, "transactionId": null, "personName": null, "accountNumber": null, "transferType": null, "upiId": null, "bankCode": "KKBK"}, {"date": "10-07-2025", "date_iso": "2025-10-07", "description": "UPI/mamtavishwakarm/519108712793/Wish", "raw": "UPI/mamtavishwakarm/519108712793/Wish", "amount": 5000.0, "type": "expense", "debit": 5000.0, "credit": 0.0, "balance": 5000.0, "page": "Text", "line": "6", "store": "mamtavishwakarm", "commodity": "Wish", "transactionId": "519108712793", "personName": "Wish", "accountNumber": null, "transferType": "UPI", "upiId": "mamtavishwakarm", "bankCode": "KKBK"}, {"date": "10-07-2025", "date_iso": "2025-10-07", "description": "UPI/q108604194@ybl/519122955035", "raw": "UPI/q108604194@ybl/519122955035", "amount": 15.0, "type": "expense", "debit": 15.0, "credit": 0.0, "balance": 15.0, "page": "Text", "line": "17", "store": "q108604194@ybl", "commodity": null, "transactionId": null, "personName": null, "accountNumber": null, "transferType": null, "upiId": null, "bankCode": "KKBK"}, {"date": "10-07-2025", "date_iso": "2025-10-07", "description": "UPI/OMKAR TANAJI KA/519147010670", "raw": "UPI/OMKAR TANAJI KA/519147010670", "amount": 3000.0, "type": "expense", "debit": 3000.0, "credit": 0.0, "balance": 3000.0, "page": "Text", "line": "15", "store": "OMKAR TANAJI KA", "commodity": null, "transactionId": null, "personName": null, "accountNumber": null, "transferType": null, "upiId": null, "bankCode": "KKBK"}, {"date": "10-07-2025", "date_iso": "2025-10-07", "description": "UPI/paytmqr6b3nnt@p/519120645934/Popcorn", "raw": "UPI/paytmqr6b3nnt@p/519120645934/Popcorn", "amount": 30.0, "type": "expense", "debit": 30.0, "credit": 0.0, "balance": 30.0, "page": "Text", "line": "14", "store": "paytmqr6b3nnt@p", "commodity": "Popcorn", "transactionId": "519120645934", "personName": "Popcorn", "accountNumber": null, "transferType": "UPI", "upiId": "paytmqr6b3nnt@p", "bankCode": "KKBK"}, {"date": "10-07-2025", "date_iso": "2025-10-07", "description": "UPI/q108604194@ybl/519120634434/M seal", "raw": "UPI/q108604194@ybl/519120634434/M seal", "amount": 20.0, "type": "expense", "debit": 20.0, "credit": 0.0, "balance": 20.0, "page": "Text", "line": "13", "store": "q108604194@ybl", "commodity": "M Seal", "transactionId": "519120634434", "personName": "M seal", "accountNumber": null, "transferType": "UPI", "upiId": "q108604194@ybl", "bankCode": "KKBK"}, {"date": "10-07-2025", "date_iso": "2025-10-07", "description": "UPI/SHILPA BAJRANGB/519101381864/UPI", "raw": "UPI/SHILPA BAJRANGB/519101381864/UPI", "amount": 100.0, "type": "income", "debit": 0.0, "credit": 100.0, "balance": 100.0, "page": "Text", "line": "12", "store": "SHILPA BAJRANGB", "commodity": null, "transactionId": "519101381864", "personName": "UPI", "accountNumber": null, "transferType": "UPI", "upiId": "SHILPA BAJRANGB", "bankCode": "KKBK"}, {"date": "10-07-2025", "date_iso": "2025-10-07", "description": "UPI/q372391809@ybl/519114562011/UPI", "raw": "UPI/q372391809@ybl/519114562011/UPI", "amount": 50.0, "type": "expense", "debit": 50.0, "credit": 0.0, "balance": 50.0, "page": "Text", "line": "11", "store": "q372391809@ybl", "commodity": null, "transactionId": "519114562011", "personName": "UPI", "accountNumber": null, "transferType": "UPI", "upiId": "q372391809@ybl", "bankCode": "KKBK"}, {"date": "10-07-2025", "date_iso": "2025-10-07", "description": "UPI/q156730843@ybl/519114515278/Sandwich", "raw": "UPI/q156730843@ybl/519114515278/Sandwich", "amount": 140.0, "type": "expense", "debit": 140.0, "credit": 0.0, "balance": 140.0, "page": "Text", "line": "10", "store": "q156730843@ybl", "commodity": "Sandwich", "transactionId": "519114515278", "personName": "Sandwich", "accountNumber": null, "transferType": "UPI", "upiId": "q156730843@ybl", "bankCode": "KKBK"}, {"date": "10-07-2025", "date_iso": "2025-10-07", "description": "UPI/sahilgaykar307@/519113494608/Kal ka", "raw": "UPI/sahilgaykar307@/519113494608/Kal ka", "amount": 100.0, "type": "expense", "debit": 100.0, "credit": 0.0, "balance": 100.0, "page": "Text", "line": "9", "store": "sahilgaykar307@", "commodity": "Kal Ka", "transactionId": "519113494608", "personName": "Kal ka", "accountNumber": null, "transferType": "UPI", "upiId": "sahilgaykar307@", "bankCode": "KKBK"}, {"date": "10-07-2025", "date_iso": "2025-10-07", "description": "NACH-MUT-DR-GROWW INVEST TECH PR- NACHDR10072506270600", "raw": "NACH-MUT-DR-GROWW INVEST TECH PR- NACHDR10072506270600", "amount": 1000.0, "type": "expense", "debit": 1000.0, "credit": 0.0, "balance": 1000.0, "page": "Text", "line": "4", "store": null, "commodity": null, "transactionId": null, "personName": null, "accountNumber": null, "transferType": null, "upiId": null, "bankCode": "KKBK"}, {"date": "10-07-2025", "date_iso": "2025-10-07", "description": "UPI/CHIMAN SANTOSH /555702085838/UPI", "raw": "UPI/CHIMAN SANTOSH /555702085838/UPI", "amount": 40.0, "type": "income", "debit": 0.0, "credit": 40.0, "balance": 40.0, "page": "Text", "line": "8", "store": "CHIMAN SANTOSH", "commodity": null, "transactionId": "555702085838", "personName": "UPI", "accountNumber": null, "transferType": "UPI", "upiId": "CHIMAN SANTOSH", "bankCode": "KKBK"}, {"date": "10-07-2025", "date_iso": "2025-10-07", "description": "CASHBACK EARNED ONBF-mcwdydbz865cdef", "raw": "CASHBACK EARNED ONBF-mcwdydbz865cdef", "amount": 1.0, "type": "income", "debit": 0.0, "credit": 1.0, "balance": 1.0, "page": "Text", "line": "46", "store": null, "commodity": null, "transactionId": null, "personName": null, "accountNumber": null, "transferType": null, "upiId": null, "bankCode": "KKBK"}, {"date": "10-07-2025", "date_iso": "2025-10-07", "description": "UPI/shilpamishra020/519101576370/UPI", "raw": "UPI/shilpamishra020/519101576370/UPI", "amount": 200.0, "type": "expense", "debit": 200.0, "credit": 0.0, "balance": 200.0, "page": "Text", "line": "37", "store": "shilpamishra020", "commodity": null, "transactionId": "519101576370", "personName": "UPI", "accountNumber": null, "transferType": "UPI", "upiId": "shilpamishra020", "bankCode": "KKBK"}, {"date": "10-07-2025", "date_iso": "2025-10-07", "description": "UPI/SHILPA BAJRANGB/519127634120/UPI", "raw": "UPI/SHILPA BAJRANGB/519127634120/UPI", "amount": 200.0, "type": "income", "debit": 0.0, "credit": 200.0, "balance": 200.0, "page": "Text", "line": "38", "store": "SHILPA BAJRANGB", "commodity": null, "transactionId": "519127634120", "personName": "UPI", "accountNumber": null, "transferType": "UPI", "upiId": "SHILPA BAJRANGB", "bankCode": "KKBK"}, {"date": "10-07-2025", "date_iso": "2025-10-07", "description": "UPI/shilpamishra020/519101577069/UPI", "raw": "UPI/shilpamishra020/519101577069/UPI", "amount": 200.0, "type": "expense", "debit": 200.0, "credit": 0.0, "balance": 200.0, "page": "Text", "line": "39", "store": "shilpamishra020", "commodity": null, "transactionId": "519101577069", "personName": "UPI", "accountNumber": null, "transferType": "UPI", "upiId": "shilpamishra020", "bankCode": "KKBK"}, {"date": "10-07-2025", "date_iso": "2025-10-07", "description": "UPI/SHILPA BAJRANGB/519169839354/UPI", "raw": "UPI/SHILPA BAJRANGB/519169839354/UPI", "amount": 200.0, "type": "income", "debit": 0.0, "credit": 200.0, "balance": 200.0, "page": "Text", "line": "40", "store": "SHILPA BAJRANGB", "commodity": null, "transactionId": "519169839354", "personName": "UPI", "accountNumber": null, "transferType": "UPI", "upiId": "SHILPA BAJRANGB", "bankCode": "KKBK"}, {"date": "10-07-2025", "date_iso": "2025-10-07", "description": "UPI/SHILPA BAJRANGB/519110042403/UPI", "raw": "UPI/SHILPA BAJRANGB/519110042403/UPI", "amount": 200.0, "type": "income", "debit": 0.0, "credit": 200.0, "balance": 200.0, "page": "Text", "line": "47", "store": "SHILPA BAJRANGB", "commodity": null, "transactionId": "519110042403", "personName": "UPI", "accountNumber": null, "transferType": "UPI", "upiId": "SHILPA BAJRANGB", "bankCode": "KKBK"}, {"date": "10-07-2025", "date_iso": "2025-10-07", "description": "CASHBACK EARNED ONBF-mcwduer728b5946", "raw": "CASHBACK EARNED ONBF-mcwduer728b5946", "amount": 1.0, "type": "income", "debit": 0.0, "credit": 1.0, "balance": 1.0, "page": "Text", "line": "42", "store": null, "commodity": null, "transactionId": null, "personName": null, "accountNumber": null, "transferType": null, "upiId": null, "bankCode": "KKBK"}, {"date": "10-07-2025", "date_iso": "2025-10-07", "description": "UPI/SHILPA BAJRANGB/519166838622", "raw": "UPI/SHILPA BAJRANGB/519166838622", "amount": 200.0, "type": "income", "debit": 0.0, "credit": 200.0, "balance": 200.0, "page": "Text", "line": "43", "store": "SHILPA BAJRANGB", "commodity": null, "transactionId": null, "personName": null, "accountNumber": null, "transferType": null, "upiId": null, "bankCode": "KKBK"}, {"date": "10-07-2025", "date_iso": "2025-10-07", "description": "UPI/shilpamishra020/519101578468/UPI", "raw": "UPI/shilpamishra020/519101578468/UPI", "amount": 200.0, "type": "expense", "debit": 200.0, "credit": 0.0, "balance": 200.0, "page": "Text", "line": "45", "store": "shilpamishra020", "commodity": null, "transactionId": "519101578468", "personName": "UPI", "accountNumber": null, "transferType": "UPI", "upiId": "shilpamishra020", "bankCode": "KKBK"}, {"date": "10-07-2025", "date_iso": "2025-10-07", "description": "UPI/shilpamishra020/519101577493/UPI", "raw": "UPI/shilpamishra020/519101577493/UPI", "amount": 200.0, "type": "expense", "debit": 200.0, "credit": 0.0, "balance": 200.0, "page": "Text", "line": "41", "store": "shilpamishra020", "commodity": null, "transactionId": "519101577493", "personName": "UPI", "accountNumber": null, "transferType": "UPI", "upiId": "shilpamishra020", "bankCode": "KKBK"}, {"date": "11-07-2025", "date_iso": "2025-11-07", "description": "UPI/q422747727@ybl/519222529909/Meat", "raw": "UPI/q422747727@ybl/519222529909/Meat", "amount": 56.0, "type": "expense", "debit": 56.0, "credit": 0.0, "balance": 56.0, "page": "Text", "line": "33", "store": "q422747727@ybl", "commodity": "Meat", "transactionId": "519222529909", "personName": "Meat", "accountNumber": null, "transferType": "UPI", "upiId": "q422747727@ybl", "bankCode": "KKBK"}, {"date": "11-07-2025", "date_iso": "2025-11-07", "description": "UPI/bharatpe.9h0a0b/519221259103/Pay to", "raw": "UPI/bharatpe.9h0a0b/519221259103/Pay to", "amount": 50.0, "type": "expense", "debit": 50.0, "credit": 0.0, "balance": 50.0, "page": "Text", "line": "31", "store": "bharatpe.9h0a0b", "commodity": "Pay To", "transactionId": "519221259103", "personName": "Pay to", "accountNumber": null, "transferType": "UPI", "upiId": "bharatpe.9h0a0b", "bankCode": "KKBK"}, {"date": "11-07-2025", "date_iso": "2025-11-07", "description": "UPI/q055648973@ybl/519221257822/Malai", "raw": "UPI/q055648973@ybl/519221257822/Malai", "amount": 50.0, "type": "expense", "debit": 50.0, "credit": 0.0, "balance": 50.0, "page": "Text", "line": "30", "store": "q055648973@ybl", "commodity": "Malai", "transactionId": "519221257822", "personName": "Malai", "accountNumber": null, "transferType": "UPI", "upiId": "q055648973@ybl", "bankCode": "KKBK"}, {"date": "11-07-2025", "date_iso": "2025-11-07", "description": "UPI/CHIMAN SANTOSH /519283574188/UPI", "raw": "UPI/CHIMAN SANTOSH /519283574188/UPI", "amount": 2000.0, "type": "expense", "debit": 2000.0, "credit": 0.0, "balance": 2000.0, "page": "Text", "line": "28", "store": "CHIMAN SANTOSH", "commodity": null, "transactionId": "519283574188", "personName": "UPI", "accountNumber": null, "transferType": "UPI", "upiId": "CHIMAN SANTOSH", "bankCode": "KKBK"}, {"date": "11-07-2025", "date_iso": "2025-11-07", "description": "UPI/AMISH NILESH JO/519221195073/UPI", "raw": "UPI/AMISH NILESH JO/519221195073/UPI", "amount": 150.0, "type": "income", "debit": 0.0, "credit": 150.0, "balance": 150.0, "page": "Text", "line": "27", "store": "AMISH NILESH JO", "commodity": null, "transactionId": "519221195073", "personName": "UPI", "accountNumber": null, "transferType": "UPI", "upiId": "AMISH NILESH JO", "bankCode": "KKBK"}, {"date": "11-07-2025", "date_iso": "2025-11-07", "description": "UPI/Mr MUNSHEELAL R/519249973542/fan", "raw": "UPI/Mr MUNSHEELAL R/519249973542/fan", "amount": 550.0, "type": "expense", "debit": 550.0, "credit": 0.0, "balance": 550.0, "page": "Text", "line": "29", "store": "Mr MUNSHEELAL R", "commodity": "Fan", "transactionId": "519249973542", "personName": "fan", "accountNumber": null, "transferType": "UPI", "upiId": "Mr MUNSHEELAL R", "bankCode": "KKBK"}, {"date": "11-07-2025", "date_iso": "2025-11-07", "description": "UPI/Abdul service c/519268568490/bike wash", "raw": "UPI/Abdul service c/519268568490/bike wash", "amount": 250.0, "type": "expense", "debit": 250.0, "credit": 0.0, "balance": 250.0, "page": "Text", "line": "26", "store": "Abdul service c", "commodity": "Bike Wash", "transactionId": "519268568490", "personName": "bike wash", "accountNumber": null, "transferType": "UPI", "upiId": "Abdul service c", "bankCode": "KKBK"}, {"date": "11-07-2025", "date_iso": "2025-11-07", "description": "UPI/paytmqr5zaoik@p/519216340920/Chai", "raw": "UPI/paytmqr5zaoik@p/519216340920/Chai", "amount": 20.0, "type": "expense", "debit": 20.0, "credit": 0.0, "balance": 20.0, "page": "Text", "line": "24", "store": "paytmqr5zaoik@p", "commodity": "Chai", "transactionId": "519216340920", "personName": "Chai", "accountNumber": null, "transferType": "UPI", "upiId": "paytmqr5zaoik@p", "bankCode": "KKBK"}, {"date": "11-07-2025", "date_iso": "2025-11-07", "description": "UPI/gpay-1125625909/519214129825/Nimbu", "raw": "UPI/gpay-1125625909/519214129825/Nimbu", "amount": 20.0, "type": "expense", "debit": 20.0, "credit": 0.0, "balance": 20.0, "page": "Text", "line": "22", "store": "gpay-1125625909", "commodity": "Nimbu", "transactionId": "519214129825", "personName": "Nimbu", "accountNumber": null, "transferType": "UPI", "upiId": "gpay-1125625909", "bankCode": "KKBK"}, {"date": "11-07-2025", "date_iso": "2025-11-07", "description": "UPI/ks622441@oksbi/519214127048/Chat", "raw": "UPI/ks622441@oksbi/519214127048/Chat", "amount": 70.0, "type": "expense", "debit": 70.0, "credit": 0.0, "balance": 70.0, "page": "Text", "line": "21", "store": "ks622441@oksbi", "commodity": "Chat", "transactionId": "519214127048", "personName": "Chat", "accountNumber": null, "transferType": "UPI", "upiId": "ks622441@oksbi", "bankCode": "KKBK"}, {"date": "11-07-2025", "date_iso": "2025-11-07", "description": "UPI/OMKAR TANAJI KA/555871471511/UPI", "raw": "UPI/OMKAR TANAJI KA/555871471511/UPI", "amount": 100.0, "type": "income", "debit": 0.0, "credit": 100.0, "balance": 100.0, "page": "Text", "line": "20", "store": "OMKAR TANAJI KA", "commodity": null, "transactionId": "555871471511", "personName": "UPI", "accountNumber": null, "transferType": "UPI", "upiId": "OMKAR TANAJI KA", "bankCode": "KKBK"}, {"date": "11-07-2025", "date_iso": "2025-11-07", "description": "UPI/paytmqr6d13mq@p/519214097704/UPI", "raw": "UPI/paytmqr6d13mq@p/519214097704/UPI", "amount": 100.0, "type": "expense", "debit": 100.0, "credit": 0.0, "balance": 100.0, "page": "Text", "line": "19", "store": "paytmqr6d13mq@p", "commodity": null, "transactionId": "519214097704", "personName": "UPI", "accountNumber": null, "transferType": "UPI", "upiId": "paytmqr6d13mq@p", "bankCode": "KKBK"}, {"date": "11-07-2025", "date_iso": "2025-11-07", "description": "CASHBACK EARNED ONBF-mcyos4t1f5ef172", "raw": "CASHBACK EARNED ONBF-mcyos4t1f5ef172", "amount": 1.15, "type": "income", "debit": 0.0, "credit": 1.15, "balance": 1.15, "page": "Text", "line": "25", "store": null, "commodity": null, "transactionId": null, "personName": null, "accountNumber": null, "transferType": null, "upiId": null, "bankCode": "KKBK"}, {"date": "12-07-2025", "date_iso": "2025-12-07", "description": "UPI/paytmqr6fmse0@p/519320640871/Fuel", "raw": "UPI/paytmqr6fmse0@p/519320640871/Fuel", "amount": 250.0, "type": "expense", "debit": 250.0, "credit": 0.0, "balance": 250.0, "page": "Text", "line": "39", "store": "paytmqr6fmse0@p", "commodity": "Fuel", "transactionId": "519320640871", "personName": "Fuel", "accountNumber": null, "transferType": "UPI", "upiId": "paytmqr6fmse0@p", "bankCode": "KKBK"}, {"date": "12-07-2025", "date_iso": "2025-12-07", "description": "UPI/q425433594@ybl/519320463666/Petrol", "raw": "UPI/q425433594@ybl/519320463666/Petrol", "amount": 944.0, "type": "expense", "debit": 944.0, "credit": 0.0, "balance": 944.0, "page": "Text", "line": "38", "store": "q425433594@ybl", "commodity": "Petrol", "transactionId": "519320463666", "personName": "Petrol", "accountNumber": null, "transferType": "UPI", "upiId": "q425433594@ybl", "bankCode": "KKBK"}, {"date": "12-07-2025", "date_iso": "2025-12-07", "description": "UPI/23000192@idfcba/519314473371/UPI", "raw": "UPI/23000192@idfcba/519314473371/UPI", "amount": 40.0, "type": "expense", "debit": 40.0, "credit": 0.0, "balance": 40.0, "page": "Text", "line": "36", "store": "23000192@idfcba", "commodity": null, "transactionId": "519314473371", "personName": "UPI", "accountNumber": null, "transferType": "UPI", "upiId": "23000192@idfcba", "bankCode": "KKBK"}, {"date": "12-07-2025", "date_iso": "2025-12-07", "description": "UPI/23000192@idfcba/519310993732/UPI", "raw": "UPI/23000192@idfcba/519310993732/UPI", "amount": 20.0, "type": "expense", "debit": 20.0, "credit": 0.0, "balance": 20.0, "page": "Text", "line": "35", "store": "23000192@idfcba", "commodity": null, "transactionId": "519310993732", "personName": "UPI", "accountNumber": null, "transferType": "UPI", "upiId": "23000192@idfcba", "bankCode": "KKBK"}, {"date": "12-07-2025", "date_iso": "2025-12-07", "description": "UPI/pramilaraut449@/519319417813/Bhel", "raw": "UPI/pramilaraut449@/519319417813/Bhel", "amount": 60.0, "type": "expense", "debit": 60.0, "credit": 0.0, "balance": 60.0, "page": "Text", "line": "37", "store": "pramilaraut449@", "commodity": "Bhel", "transactionId": "519319417813", "personName": "Bhel", "accountNumber": null, "transferType": "UPI", "upiId": "pramilaraut449@", "bankCode": "KKBK"}, {"date": "13-07-2025", "date_iso": "2025-07-13", "description": "CASHBACK EARNED ONBF-md1x6e7q7204210", "raw": "CASHBACK EARNED ONBF-md1x6e7q7204210", "amount": 1.5, "type": "income", "debit": 0.0, "credit": 1.5, "balance": 1.5, "page": "Text", "line": "7", "store": null, "commodity": null, "transactionId": null, "personName": null, "accountNumber": null, "transferType": null, "upiId": null, "bankCode": "KKBK"}, {"date": "13-07-2025", "date_iso": "2025-07-13", "description": "UPI/q789774254@ybl/519422191291/Raincoat", "raw": "UPI/q789774254@ybl/519422191291/Raincoat", "amount": 140.0, "type": "expense", "debit": 140.0, "credit": 0.0, "balance": 140.0, "page": "Text", "line": "6", "store": "q789774254@ybl", "commodity": "Raincoat", "transactionId": "519422191291", "personName": "Raincoat", "accountNumber": null, "transferType": "UPI", "upiId": "q789774254@ybl", "bankCode": "KKBK"}, {"date": "13-07-2025", "date_iso": "2025-07-13", "description": "UPI/paytmqr6blx7h@p/519422175302/Pan", "raw": "UPI/paytmqr6blx7h@p/519422175302/Pan", "amount": 16.0, "type": "expense", "debit": 16.0, "credit": 0.0, "balance": 16.0, "page": "Text", "line": "5", "store": "paytmqr6blx7h@p", "commodity": "Pan", "transactionId": "519422175302", "personName": "Pan", "accountNumber": null, "transferType": "UPI", "upiId": "paytmqr6blx7h@p", "bankCode": "KKBK"}, {"date": "13-07-2025", "date_iso": "2025-07-13", "description": "UPI/gpay-1125237851/519422165924/Cloth", "raw": "UPI/gpay-1125237851/519422165924/Cloth", "amount": 165.0, "type": "expense", "debit": 165.0, "credit": 0.0, "balance": 165.0, "page": "Text", "line": "4", "store": "gpay-1125237851", "commodity": "Cloth", "transactionId": "519422165924", "personName": "Cloth", "accountNumber": null, "transferType": "UPI", "upiId": "gpay-1125237851", "bankCode": "KKBK"}, {"date": "13-07-2025", "date_iso": "2025-07-13", "description": "UPI/paytmqr6b3nnt@p/519420951205/Popcorn", "raw": "UPI/paytmqr6b3nnt@p/519420951205/Popcorn", "amount": 20.0, "type": "expense", "debit": 20.0, "credit": 0.0, "balance": 20.0, "page": "Text", "line": "48", "store": "paytmqr6b3nnt@p", "commodity": "Popcorn", "transactionId": "519420951205", "personName": "Popcorn", "accountNumber": null, "transferType": "UPI", "upiId": "paytmqr6b3nnt@p", "bankCode": "KKBK"}, {"date": "13-07-2025", "date_iso": "2025-07-13", "description": "UPI/q543130246@ybl/519420909145/Bhojan", "raw": "UPI/q543130246@ybl/519420909145/Bhojan", "amount": 156.0, "type": "expense", "debit": 156.0, "credit": 0.0, "balance": 156.0, "page": "Text", "line": "47", "store": "q543130246@ybl", "commodity": "Bhojan", "transactionId": "519420909145", "personName": "Bhojan", "accountNumber": null, "transferType": "UPI", "upiId": "q543130246@ybl", "bankCode": "KKBK"}, {"date": "13-07-2025", "date_iso": "2025-07-13", "description": "CASHBACK EARNED ONBF-md1mcjix48e05cf", "raw": "CASHBACK EARNED ONBF-md1mcjix48e05cf", "amount": 1.15, "type": "income", "debit": 0.0, "credit": 1.15, "balance": 1.15, "page": "Text", "line": "45", "store": null, "commodity": null, "transactionId": null, "personName": null, "accountNumber": null, "transferType": null, "upiId": null, "bankCode": "KKBK"}, {"date": "13-07-2025", "date_iso": "2025-07-13", "description": "UPI/q108604194@ybl/519417306129/Hook", "raw": "UPI/q108604194@ybl/519417306129/Hook", "amount": 35.0, "type": "expense", "debit": 35.0, "credit": 0.0, "balance": 35.0, "page": "Text", "line": "44", "store": "q108604194@ybl", "commodity": "Hook", "transactionId": "519417306129", "personName": "Hook", "accountNumber": null, "transferType": "UPI", "upiId": "q108604194@ybl", "bankCode": "KKBK"}, {"date": "13-07-2025", "date_iso": "2025-07-13", "description": "UPI/q661369950@ybl/519416191305/Milk", "raw": "UPI/q661369950@ybl/519416191305/Milk", "amount": 69.0, "type": "expense", "debit": 69.0, "credit": 0.0, "balance": 69.0, "page": "Text", "line": "43", "store": "q661369950@ybl", "commodity": "Milk", "transactionId": "519416191305", "personName": "Milk", "accountNumber": null, "transferType": "UPI", "upiId": "q661369950@ybl", "bankCode": "KKBK"}, {"date": "13-07-2025", "date_iso": "2025-07-13", "description": "UPI/q108604194@ybl/519411555744", "raw": "UPI/q108604194@ybl/519411555744", "amount": 90.0, "type": "expense", "debit": 90.0, "credit": 0.0, "balance": 90.0, "page": "Text", "line": "41", "store": "q108604194@ybl", "commodity": null, "transactionId": null, "personName": null, "accountNumber": null, "transferType": null, "upiId": null, "bankCode": "KKBK"}, {"date": "13-07-2025", "date_iso": "2025-07-13", "description": "UPI/bajajpay.687972/519417312359/Fan repair", "raw": "UPI/bajajpay.687972/519417312359/Fan repair", "amount": 500.0, "type": "expense", "debit": 500.0, "credit": 0.0, "balance": 500.0, "page": "Text", "line": "46", "store": "bajajpay.687972", "commodity": "Fan Repair", "transactionId": "519417312359", "personName": "Fan repair", "accountNumber": null, "transferType": "UPI", "upiId": "bajajpay.687972", "bankCode": "KKBK"}, {"date": "14-07-2025", "date_iso": "2025-07-14", "description": "UPI/SHILPA BAJRANGB/519581127993/UPI", "raw": "UPI/SHILPA BAJRANGB/519581127993/UPI", "amount": 20.0, "type": "income", "debit": 0.0, "credit": 20.0, "balance": 20.0, "page": "Text", "line": "8", "store": "SHILPA BAJRANGB", "commodity": null, "transactionId": "519581127993", "personName": "UPI", "accountNumber": null, "transferType": "UPI", "upiId": "SHILPA BAJRANGB", "bankCode": "KKBK"}, {"date": "14-07-2025", "date_iso": "2025-07-14", "description": "UPI/paytmqr1g9jdk08/519514258941/Lassi", "raw": "UPI/paytmqr1g9jdk08/519514258941/Lassi", "amount": 20.0, "type": "expense", "debit": 20.0, "credit": 0.0, "balance": 20.0, "page": "Text", "line": "9", "store": "paytmqr1g9jdk08", "commodity": "Lassi", "transactionId": "519514258941", "personName": "Lassi", "accountNumber": null, "transferType": "UPI", "upiId": "paytmqr1g9jdk08", "bankCode": "KKBK"}, {"date": "14-07-2025", "date_iso": "2025-07-14", "description": "UPI/q584953316@ybl/519514309110/UPI", "raw": "UPI/q584953316@ybl/519514309110/UPI", "amount": 20.0, "type": "expense", "debit": 20.0, "credit": 0.0, "balance": 20.0, "page": "Text", "line": "10", "store": "q584953316@ybl", "commodity": null, "transactionId": "519514309110", "personName": "UPI", "accountNumber": null, "transferType": "UPI", "upiId": "q584953316@ybl", "bankCode": "KKBK"}, {"date": "14-07-2025", "date_iso": "2025-07-14", "description": "UPI/omkar.kalokhe12/519514323470/Lassi", "raw": "UPI/omkar.kalokhe12/519514323470/Lassi", "amount": 20.0, "type": "expense", "debit": 20.0, "credit": 0.0, "balance": 20.0, "page": "Text", "line": "11", "store": "omkar.kalokhe12", "commodity": "Lassi", "transactionId": "519514323470", "personName": "Lassi", "accountNumber": null, "transferType": "UPI", "upiId": "omkar.kalokhe12", "bankCode": "KKBK"}, {"date": "14-07-2025", "date_iso": "2025-07-14", "description": "UPI/OMKAR TANAJI KA/519515159928/done", "raw": "UPI/OMKAR TANAJI KA/519515159928/done", "amount": 3000.0, "type": "income", "debit": 0.0, "credit": 3000.0, "balance": 3000.0, "page": "Text", "line": "12", "store": "OMKAR TANAJI KA", "commodity": "Done", "transactionId": "519515159928", "personName": "done", "accountNumber": null, "transferType": "UPI", "upiId": "OMKAR TANAJI KA", "bankCode": "KKBK"}, {"date": "15-07-2025", "date_iso": "2025-07-15", "description": "UPI/q543130246@ybl/519621776008/Bhojan", "raw": "UPI/q543130246@ybl/519621776008/Bhojan", "amount": 320.0, "type": "expense", "debit": 320.0, "credit": 0.0, "balance": 320.0, "page": "Text", "line": "18", "store": "q543130246@ybl", "commodity": "Bhojan", "transactionId": "519621776008", "personName": "Bhojan", "accountNumber": null, "transferType": "UPI", "upiId": "q543130246@ybl", "bankCode": "KKBK"}, {"date": "15-07-2025", "date_iso": "2025-07-15", "description": "UPI/SHILPA BAJRANGB/556294735448/UPI", "raw": "UPI/SHILPA BAJRANGB/556294735448/UPI", "amount": 20.0, "type": "income", "debit": 0.0, "credit": 20.0, "balance": 20.0, "page": "Text", "line": "17", "store": "SHILPA BAJRANGB", "commodity": null, "transactionId": "556294735448", "personName": "UPI", "accountNumber": null, "transferType": "UPI", "upiId": "SHILPA BAJRANGB", "bankCode": "KKBK"}, {"date": "15-07-2025", "date_iso": "2025-07-15", "description": "UPI/paytmqr2dbd9rpv/519614681645/Lassi", "raw": "UPI/paytmqr2dbd9rpv/519614681645/Lassi", "amount": 75.0, "type": "expense", "debit": 75.0, "credit": 0.0, "balance": 75.0, "page": "Text", "line": "16", "store": "paytmqr2dbd9rpv", "commodity": "Lassi", "transactionId": "519614681645", "personName": "Lassi", "accountNumber": null, "transferType": "UPI", "upiId": "paytmqr2dbd9rpv", "bankCode": "KKBK"}, {"date": "15-07-2025", "date_iso": "2025-07-15", "description": "CASHBACK EARNED ONBF-md4oz6y5d5518f0", "raw": "CASHBACK EARNED ONBF-md4oz6y5d5518f0", "amount": 1.15, "type": "income", "debit": 0.0, "credit": 1.15, "balance": 1.15, "page": "Text", "line": "19", "store": null, "commodity": null, "transactionId": null, "personName": null, "accountNumber": null, "transferType": null, "upiId": null, "bankCode": "KKBK"}, {"date": "15-07-2025", "date_iso": "2025-07-15", "description": "UPI/8953589272@okbi/519610168505/UPI", "raw": "UPI/8953589272@okbi/519610168505/UPI", "amount": 75.0, "type": "expense", "debit": 75.0, "credit": 0.0, "balance": 75.0, "page": "Text", "line": "14", "store": "8953589272@okbi", "commodity": null, "transactionId": "519610168505", "personName": "UPI", "accountNumber": null, "transferType": "UPI", "upiId": "8953589272@okbi", "bankCode": "KKBK"}, {"date": "15-07-2025", "date_iso": "2025-07-15", "description": "UPI/SANDEEP KUMAR/556244431555/UPI", "raw": "UPI/SANDEEP KUMAR/556244431555/UPI", "amount": 2000.0, "type": "expense", "debit": 2000.0, "credit": 0.0, "balance": 2000.0, "page": "Text", "line": "13", "store": "SANDEEP KUMAR", "commodity": null, "transactionId": "556244431555", "personName": "UPI", "accountNumber": null, "transferType": "UPI", "upiId": "SANDEEP KUMAR", "bankCode": "KKBK"}, {"date": "15-07-2025", "date_iso": "2025-07-15", "description": "UPI/CHIMAN SANTOSH /556208462783/UPI", "raw": "UPI/CHIMAN SANTOSH /556208462783/UPI", "amount": 50.0, "type": "income", "debit": 0.0, "credit": 50.0, "balance": 50.0, "page": "Text", "line": "15", "store": "CHIMAN SANTOSH", "commodity": null, "transactionId": "556208462783", "personName": "UPI", "accountNumber": null, "transferType": "UPI", "upiId": "CHIMAN SANTOSH", "bankCode": "KKBK"}, {"date": "16-07-2025", "date_iso": "2025-07-16", "description": "UPI/OMKAR TANAJI KA/519707532124/briyani", "raw": "UPI/OMKAR TANAJI KA/519707532124/briyani", "amount": 20.0, "type": "expense", "debit": 20.0, "credit": 0.0, "balance": 20.0, "page": "Text", "line": "20", "store": "OMKAR TANAJI KA", "commodity": "Briyani", "transactionId": "519707532124", "personName": "briyani", "accountNumber": null, "transferType": "UPI", "upiId": "OMKAR TANAJI KA", "bankCode": "KKBK"}, {"date": "17-07-2025", "date_iso": "2025-07-17", "description": "UPI/paytmqr1g9jdk08/519813767493/Lassi", "raw": "UPI/paytmqr1g9jdk08/519813767493/Lassi", "amount": 30.0, "type": "expense", "debit": 30.0, "credit": 0.0, "balance": 30.0, "page": "Text", "line": "21", "store": "paytmqr1g9jdk08", "commodity": "Lassi", "transactionId": "519813767493", "personName": "Lassi", "accountNumber": null, "transferType": "UPI", "upiId": "paytmqr1g9jdk08", "bankCode": "KKBK"}, {"date": "17-07-2025", "date_iso": "2025-07-17", "description": "UPI/paytmqr64xpfe@p/519820830095/Munch", "raw": "UPI/paytmqr64xpfe@p/519820830095/Munch", "amount": 40.0, "type": "expense", "debit": 40.0, "credit": 0.0, "balance": 40.0, "page": "Text", "line": "22", "store": "paytmqr64xpfe@p", "commodity": "Munch", "transactionId": "519820830095", "personName": "Munch", "accountNumber": null, "transferType": "UPI", "upiId": "paytmqr64xpfe@p", "bankCode": "KKBK"}, {"date": "17-07-2025", "date_iso": "2025-07-17", "description": "UPI/q831197501@ybl/519820842119/Bhaji", "raw": "UPI/q831197501@ybl/519820842119/Bhaji", "amount": 50.0, "type": "expense", "debit": 50.0, "credit": 0.0, "balance": 50.0, "page": "Text", "line": "23", "store": "q831197501@ybl", "commodity": "Bhaji", "transactionId": "519820842119", "personName": "Bhaji", "accountNumber": null, "transferType": "UPI", "upiId": "q831197501@ybl", "bankCode": "KKBK"}, {"date": "18-07-2025", "date_iso": "2025-07-18", "description": "UPI/bharatpe.9h0a0b/519920181916/Pay to", "raw": "UPI/bharatpe.9h0a0b/519920181916/Pay to", "amount": 50.0, "type": "expense", "debit": 50.0, "credit": 0.0, "balance": 50.0, "page": "Text", "line": "25", "store": "bharatpe.9h0a0b", "commodity": "Pay To", "transactionId": "519920181916", "personName": "Pay to", "accountNumber": null, "transferType": "UPI", "upiId": "bharatpe.9h0a0b", "bankCode": "KKBK"}, {"date": "18-07-2025", "date_iso": "2025-07-18", "description": "UPI/paytmqr5kgkza@p/519920226942/Pani puri", "raw": "UPI/paytmqr5kgkza@p/519920226942/Pani puri", "amount": 50.0, "type": "expense", "debit": 50.0, "credit": 0.0, "balance": 50.0, "page": "Text", "line": "27", "store": "paytmqr5kgkza@p", "commodity": "Pani Puri", "transactionId": "519920226942", "personName": "Pani puri", "accountNumber": null, "transferType": "UPI", "upiId": "paytmqr5kgkza@p", "bankCode": "KKBK"}, {"date": "18-07-2025", "date_iso": "2025-07-18", "description": "UPI/paytmqr1g9jdk08/519914212712/Lassi", "raw": "UPI/paytmqr1g9jdk08/519914212712/Lassi", "amount": 50.0, "type": "expense", "debit": 50.0, "credit": 0.0, "balance": 50.0, "page": "Text", "line": "24", "store": "paytmqr1g9jdk08", "commodity": "Lassi", "transactionId": "519914212712", "personName": "Lassi", "accountNumber": null, "transferType": "UPI", "upiId": "paytmqr1g9jdk08", "bankCode": "KKBK"}, {"date": "19-07-2025", "date_iso": "2025-07-19", "description": "UPI/q820845250@ybl/520009955743/Petrol", "raw": "UPI/q820845250@ybl/520009955743/Petrol", "amount": 910.22, "type": "expense", "debit": 910.22, "credit": 0.0, "balance": 910.22, "page": "Text", "line": "28", "store": "q820845250@ybl", "commodity": "Petrol", "transactionId": "520009955743", "personName": "Petrol", "accountNumber": null, "transferType": "UPI", "upiId": "q820845250@ybl", "bankCode": "KKBK"}, {"date": "19-07-2025", "date_iso": "2025-07-19", "description": "UPI/q385706515@ybl/520014537797/Chole", "raw": "UPI/q385706515@ybl/520014537797/Chole", "amount": 120.0, "type": "expense", "debit": 120.0, "credit": 0.0, "balance": 120.0, "page": "Text", "line": "29", "store": "q385706515@ybl", "commodity": "Chole", "transactionId": "520014537797", "personName": "Chole", "accountNumber": null, "transferType": "UPI", "upiId": "q385706515@ybl", "bankCode": "KKBK"}, {"date": "19-07-2025", "date_iso": "2025-07-19", "description": "CASHBACK EARNED ONBF-md9zyou8cb29398", "raw": "CASHBACK EARNED ONBF-md9zyou8cb29398", "amount": 1.0, "type": "income", "debit": 0.0, "credit": 1.0, "balance": 1.0, "page": "Text", "line": "31", "store": null, "commodity": null, "transactionId": null, "personName": null, "accountNumber": null, "transferType": null, "upiId": null, "bankCode": "KKBK"}, {"date": "19-07-2025", "date_iso": "2025-07-19", "description": "UPI/q030362543@ybl/520014545222/UPI", "raw": "UPI/q030362543@ybl/520014545222/UPI", "amount": 20.0, "type": "expense", "debit": 20.0, "credit": 0.0, "balance": 20.0, "page": "Text", "line": "32", "store": "q030362543@ybl", "commodity": null, "transactionId": "520014545222", "personName": "UPI", "accountNumber": null, "transferType": "UPI", "upiId": "q030362543@ybl", "bankCode": "KKBK"}, {"date": "19-07-2025", "date_iso": "2025-07-19", "description": "UPI/OMKAR TANAJI KA/520014608898/UPI", "raw": "UPI/OMKAR TANAJI KA/520014608898/UPI", "amount": 150.0, "type": "income", "debit": 0.0, "credit": 150.0, "balance": 150.0, "page": "Text", "line": "33", "store": "OMKAR TANAJI KA", "commodity": null, "transactionId": "520014608898", "personName": "UPI", "accountNumber": null, "transferType": "UPI", "upiId": "OMKAR TANAJI KA", "bankCode": "KKBK"}, {"date": "19-07-2025", "date_iso": "2025-07-19", "description": "UPI/paytmqr6b4pmu@p/520021668804", "raw": "UPI/paytmqr6b4pmu@p/520021668804", "amount": 30.0, "type": "expense", "debit": 30.0, "credit": 0.0, "balance": 30.0, "page": "Text", "line": "34", "store": "paytmqr6b4pmu@p", "commodity": null, "transactionId": null, "personName": null, "accountNumber": null, "transferType": null, "upiId": null, "bankCode": "KKBK"}, {"date": "19-07-2025", "date_iso": "2025-07-19", "description": "UPI/paytmqr1wnuo8jx/520021676213/Souve", "raw": "UPI/paytmqr1wnuo8jx/520021676213/Souve", "amount": 15.0, "type": "expense", "debit": 15.0, "credit": 0.0, "balance": 15.0, "page": "Text", "line": "36", "store": "paytmqr1wnuo8jx", "commodity": "Souve", "transactionId": "520021676213", "personName": "Souve", "accountNumber": null, "transferType": "UPI", "upiId": "paytmqr1wnuo8jx", "bankCode": "KKBK"}, {"date": "21-07-2025", "date_iso": "2025-07-21", "description": "UPI/paytm.s1f8ogw@p/520219888869/Milk", "raw": "UPI/paytm.s1f8ogw@p/520219888869/Milk", "amount": 48.0, "type": "expense", "debit": 48.0, "credit": 0.0, "balance": 48.0, "page": "Text", "line": "44", "store": "paytm.s1f8ogw@p", "commodity": "Milk", "transactionId": "520219888869", "personName": "Milk", "accountNumber": null, "transferType": "UPI", "upiId": "paytm.s1f8ogw@p", "bankCode": "KKBK"}, {"date": "21-07-2025", "date_iso": "2025-07-21", "description": "UPI/gpay-1125688497/520219825940/Bike", "raw": "UPI/gpay-1125688497/520219825940/Bike", "amount": 300.0, "type": "expense", "debit": 300.0, "credit": 0.0, "balance": 300.0, "page": "Text", "line": "42", "store": "gpay-1125688497", "commodity": "Bike", "transactionId": "520219825940", "personName": "Bike", "accountNumber": null, "transferType": "UPI", "upiId": "gpay-1125688497", "bankCode": "KKBK"}, {"date": "21-07-2025", "date_iso": "2025-07-21", "description": "UPI/bharatpe.9r0u0k/520210630583/Pay to", "raw": "UPI/bharatpe.9r0u0k/520210630583/Pay to", "amount": 280.0, "type": "expense", "debit": 280.0, "credit": 0.0, "balance": 280.0, "page": "Text", "line": "37", "store": "bharatpe.9r0u0k", "commodity": "Pay To", "transactionId": "520210630583", "personName": "Pay to", "accountNumber": null, "transferType": "UPI", "upiId": "bharatpe.9r0u0k", "bankCode": "KKBK"}, {"date": "21-07-2025", "date_iso": "2025-07-21", "description": "UPI/q130051932@ybl/520213961450/Fevikik", "raw": "UPI/q130051932@ybl/520213961450/Fevikik", "amount": 5.0, "type": "expense", "debit": 5.0, "credit": 0.0, "balance": 5.0, "page": "Text", "line": "39", "store": "q130051932@ybl", "commodity": "Fevikik", "transactionId": "520213961450", "personName": "Fevikik", "accountNumber": null, "transferType": "UPI", "upiId": "q130051932@ybl", "bankCode": "KKBK"}, {"date": "21-07-2025", "date_iso": "2025-07-21", "description": "UPI/gpay-1125688497/520214062844/Bike", "raw": "UPI/gpay-1125688497/520214062844/Bike", "amount": 500.0, "type": "expense", "debit": 500.0, "credit": 0.0, "balance": 500.0, "page": "Text", "line": "40", "store": "gpay-1125688497", "commodity": "Bike", "transactionId": "520214062844", "personName": "Bike", "accountNumber": null, "transferType": "UPI", "upiId": "gpay-1125688497", "bankCode": "KKBK"}, {"date": "22-07-2025", "date_iso": "2025-07-22", "description": "UPI/paytmqr2dbd9rpv/520314329844/UPI", "raw": "UPI/paytmqr2dbd9rpv/520314329844/UPI", "amount": 30.0, "type": "expense", "debit": 30.0, "credit": 0.0, "balance": 30.0, "page": "Text", "line": "45", "store": "paytmqr2dbd9rpv", "commodity": null, "transactionId": "520314329844", "personName": "UPI", "accountNumber": null, "transferType": "UPI", "upiId": "paytmqr2dbd9rpv", "bankCode": "KKBK"}, {"date": "22-07-2025", "date_iso": "2025-07-22", "description": "UPI/paytmqr5kgkza@p/520321347168/Suka", "raw": "UPI/paytmqr5kgkza@p/520321347168/Suka", "amount": 50.0, "type": "expense", "debit": 50.0, "credit": 0.0, "balance": 50.0, "page": "Text", "line": "46", "store": "paytmqr5kgkza@p", "commodity": "Suka", "transactionId": "520321347168", "personName": "Suka", "accountNumber": null, "transferType": "UPI", "upiId": "paytmqr5kgkza@p", "bankCode": "KKBK"}, {"date": "22-07-2025", "date_iso": "2025-07-22", "description": "CASHBACK EARNED ONBF-mdepjdfi8a2156b", "raw": "CASHBACK EARNED ONBF-mdepjdfi8a2156b", "amount": 1.0, "type": "income", "debit": 0.0, "credit": 1.0, "balance": 1.0, "page": "Text", "line": "48", "store": null, "commodity": null, "transactionId": null, "personName": null, "accountNumber": null, "transferType": null, "upiId": null, "bankCode": "KKBK"}, {"date": "23-07-2025", "date_iso": "2025-07-23", "description": "UPI/paytmqr5kgkza@p/520421416929/Pani puri", "raw": "UPI/paytmqr5kgkza@p/520421416929/Pani puri", "amount": 25.0, "type": "expense", "debit": 25.0, "credit": 0.0, "balance": 25.0, "page": "Text", "line": "8", "store": "paytmqr5kgkza@p", "commodity": "Pani Puri", "transactionId": "520421416929", "personName": "Pani puri", "accountNumber": null, "transferType": "UPI", "upiId": "paytmqr5kgkza@p", "bankCode": "KKBK"}, {"date": "23-07-2025", "date_iso": "2025-07-23", "description": "UPI/Chirag Santosh /520428765558/UPI", "raw": "UPI/Chirag Santosh /520428765558/UPI", "amount": 40.0, "type": "income", "debit": 0.0, "credit": 40.0, "balance": 40.0, "page": "Text", "line": "6", "store": "Chirag Santosh", "commodity": null, "transactionId": "520428765558", "personName": "UPI", "accountNumber": null, "transferType": "UPI", "upiId": "Chirag Santosh", "bankCode": "KKBK"}, {"date": "23-07-2025", "date_iso": "2025-07-23", "description": "UPI/q683674770@ybl/520421396418/Pan", "raw": "UPI/q683674770@ybl/520421396418/Pan", "amount": 24.0, "type": "expense", "debit": 24.0, "credit": 0.0, "balance": 24.0, "page": "Text", "line": "7", "store": "q683674770@ybl", "commodity": "Pan", "transactionId": "520421396418", "personName": "Pan", "accountNumber": null, "transferType": "UPI", "upiId": "q683674770@ybl", "bankCode": "KKBK"}, {"date": "23-07-2025", "date_iso": "2025-07-23", "description": "UPI/paytmqr2dbd9rpv/520413388788/Lassi", "raw": "UPI/paytmqr2dbd9rpv/520413388788/Lassi", "amount": 30.0, "type": "expense", "debit": 30.0, "credit": 0.0, "balance": 30.0, "page": "Text", "line": "4", "store": "paytmqr2dbd9rpv", "commodity": "Lassi", "transactionId": "520413388788", "personName": "Lassi", "accountNumber": null, "transferType": "UPI", "upiId": "paytmqr2dbd9rpv", "bankCode": "KKBK"}, {"date": "23-07-2025", "date_iso": "2025-07-23", "description": "UPI/q394723543@ybl/520414423436/UPI", "raw": "UPI/q394723543@ybl/520414423436/UPI", "amount": 40.0, "type": "expense", "debit": 40.0, "credit": 0.0, "balance": 40.0, "page": "Text", "line": "5", "store": "q394723543@ybl", "commodity": null, "transactionId": "520414423436", "personName": "UPI", "accountNumber": null, "transferType": "UPI", "upiId": "q394723543@ybl", "bankCode": "KKBK"}, {"date": "24-07-2025", "date_iso": "2025-07-24", "description": "UPI/paytmqr2dbd9rpv/520513566283/Lassi", "raw": "UPI/paytmqr2dbd9rpv/520513566283/Lassi", "amount": 20.0, "type": "expense", "debit": 20.0, "credit": 0.0, "balance": 20.0, "page": "Text", "line": "9", "store": "paytmqr2dbd9rpv", "commodity": "Lassi", "transactionId": "520513566283", "personName": "Lassi", "accountNumber": null, "transferType": "UPI", "upiId": "paytmqr2dbd9rpv", "bankCode": "KKBK"}, {"date": "24-07-2025", "date_iso": "2025-07-24", "description": "UPI/ADITYA RAJESH B/520572788597/UPI", "raw": "UPI/ADITYA RAJESH B/520572788597/UPI", "amount": 50.0, "type": "income", "debit": 0.0, "credit": 50.0, "balance": 50.0, "page": "Text", "line": "10", "store": "ADITYA RAJESH B", "commodity": null, "transactionId": "520572788597", "personName": "UPI", "accountNumber": null, "transferType": "UPI", "upiId": "ADITYA RAJESH B", "bankCode": "KKBK"}, {"date": "24-07-2025", "date_iso": "2025-07-24", "description": "UPI/q029211953@ybl/520520556394/Pani puri", "raw": "UPI/q029211953@ybl/520520556394/Pani puri", "amount": 60.0, "type": "expense", "debit": 60.0, "credit": 0.0, "balance": 60.0, "page": "Text", "line": "11", "store": "q029211953@ybl", "commodity": "Pani Puri", "transactionId": "520520556394", "personName": "Pani puri", "accountNumber": null, "transferType": "UPI", "upiId": "q029211953@ybl", "bankCode": "KKBK"}, {"date": "24-07-2025", "date_iso": "2025-07-24", "description": "UPI/paytmqr6ftry3@p/520521721950", "raw": "UPI/paytmqr6ftry3@p/520521721950", "amount": 100.0, "type": "expense", "debit": 100.0, "credit": 0.0, "balance": 100.0, "page": "Text", "line": "12", "store": "paytmqr6ftry3@p", "commodity": null, "transactionId": null, "personName": null, "accountNumber": null, "transferType": null, "upiId": null, "bankCode": "KKBK"}, {"date": "25-07-2025", "date_iso": "2025-07-25", "description": "UPI/NEHA LALBAHADUR/520633728743/Sent", "raw": "UPI/NEHA LALBAHADUR/520633728743/Sent", "amount": 60.0, "type": "income", "debit": 0.0, "credit": 60.0, "balance": 60.0, "page": "Text", "line": "18", "store": "NEHA LALBAHADUR", "commodity": "Sent", "transactionId": "520633728743", "personName": "Sent", "accountNumber": null, "transferType": "UPI", "upiId": "NEHA LALBAHADUR", "bankCode": "KKBK"}, {"date": "25-07-2025", "date_iso": "2025-07-25", "description": "UPI/paytmqr68d1ra@p/520620854733/Agarbatti", "raw": "UPI/paytmqr68d1ra@p/520620854733/Agarbatti", "amount": 55.0, "type": "expense", "debit": 55.0, "credit": 0.0, "balance": 55.0, "page": "Text", "line": "20", "store": "paytmqr68d1ra@p", "commodity": "Agarbatti", "transactionId": "520620854733", "personName": "Agarbatti", "accountNumber": null, "transferType": "UPI", "upiId": "paytmqr68d1ra@p", "bankCode": "KKBK"}, {"date": "25-07-2025", "date_iso": "2025-07-25", "description": "UPI/23000192@idfcba/520614904147/UPI", "raw": "UPI/23000192@idfcba/520614904147/UPI", "amount": 100.0, "type": "expense", "debit": 100.0, "credit": 0.0, "balance": 100.0, "page": "Text", "line": "17", "store": "23000192@idfcba", "commodity": null, "transactionId": "520614904147", "personName": "UPI", "accountNumber": null, "transferType": "UPI", "upiId": "23000192@idfcba", "bankCode": "KKBK"}, {"date": "25-07-2025", "date_iso": "2025-07-25", "description": "UPI/paytmqr28100505/520610318387/Shaving", "raw": "UPI/paytmqr28100505/520610318387/Shaving", "amount": 50.0, "type": "expense", "debit": 50.0, "credit": 0.0, "balance": 50.0, "page": "Text", "line": "14", "store": "paytmqr28100505", "commodity": "Shaving", "transactionId": "520610318387", "personName": "Shaving", "accountNumber": null, "transferType": "UPI", "upiId": "paytmqr28100505", "bankCode": "KKBK"}, {"date": "25-07-2025", "date_iso": "2025-07-25", "description": "CASHBACK EARNED ONBF-mdica1wg2f32e83", "raw": "CASHBACK EARNED ONBF-mdica1wg2f32e83", "amount": 1.15, "type": "income", "debit": 0.0, "credit": 1.15, "balance": 1.15, "page": "Text", "line": "15", "store": null, "commodity": null, "transactionId": null, "personName": null, "accountNumber": null, "transferType": null, "upiId": null, "bankCode": "KKBK"}, {"date": "25-07-2025", "date_iso": "2025-07-25", "description": "UPI/paytmqr63crfr@p/520614883924/Bhaji", "raw": "UPI/paytmqr63crfr@p/520614883924/Bhaji", "amount": 40.0, "type": "expense", "debit": 40.0, "credit": 0.0, "balance": 40.0, "page": "Text", "line": "16", "store": "paytmqr63crfr@p", "commodity": "Bhaji", "transactionId": "520614883924", "personName": "Bhaji", "accountNumber": null, "transferType": "UPI", "upiId": "paytmqr63crfr@p", "bankCode": "KKBK"}, {"date": "26-07-2025", "date_iso": "2025-07-26", "description": "UPI/paytmqr2dbd9rpv/520713966429/Lassi", "raw": "UPI/paytmqr2dbd9rpv/520713966429/Lassi", "amount": 25.0, "type": "expense", "debit": 25.0, "credit": 0.0, "balance": 25.0, "page": "Text", "line": "21", "store": "paytmqr2dbd9rpv", "commodity": "Lassi", "transactionId": "520713966429", "personName": "Lassi", "accountNumber": null, "transferType": "UPI", "upiId": "paytmqr2dbd9rpv", "bankCode": "KKBK"}, {"date": "26-07-2025", "date_iso": "2025-07-26", "description": "UPI/OMKAR TANAJI KA/557336468321/UPI", "raw": "UPI/OMKAR TANAJI KA/557336468321/UPI", "amount": 40.0, "type": "expense", "debit": 40.0, "credit": 0.0, "balance": 40.0, "page": "Text", "line": "22", "store": "OMKAR TANAJI KA", "commodity": null, "transactionId": "557336468321", "personName": "UPI", "accountNumber": null, "transferType": "UPI", "upiId": "OMKAR TANAJI KA", "bankCode": "KKBK"}, {"date": "26-07-2025", "date_iso": "2025-07-26", "description": "UPI/shreeshauppunda/520718631150/UPI", "raw": "UPI/shreeshauppunda/520718631150/UPI", "amount": 400.0, "type": "expense", "debit": 400.0, "credit": 0.0, "balance": 400.0, "page": "Text", "line": "23", "store": "shreeshauppunda", "commodity": null, "transactionId": "520718631150", "personName": "UPI", "accountNumber": null, "transferType": "UPI", "upiId": "shreeshauppunda", "bankCode": "KKBK"}, {"date": "26-07-2025", "date_iso": "2025-07-26", "description": "UPI/SHREESHA/520755572987/UPI", "raw": "UPI/SHREESHA/520755572987/UPI", "amount": 400.0, "type": "income", "debit": 0.0, "credit": 400.0, "balance": 400.0, "page": "Text", "line": "24", "store": "SHREESHA", "commodity": null, "transactionId": "520755572987", "personName": "UPI", "accountNumber": null, "transferType": "UPI", "upiId": "SHREESHA", "bankCode": "KKBK"}, {"date": "26-07-2025", "date_iso": "2025-07-26", "description": "UPI/q306002307@ybl/520720893720/Petrol", "raw": "UPI/q306002307@ybl/520720893720/Petrol", "amount": 800.0, "type": "expense", "debit": 800.0, "credit": 0.0, "balance": 800.0, "page": "Text", "line": "25", "store": "q306002307@ybl", "commodity": "Petrol", "transactionId": "520720893720", "personName": "Petrol", "accountNumber": null, "transferType": "UPI", "upiId": "q306002307@ybl", "bankCode": "KKBK"}, {"date": "26-07-2025", "date_iso": "2025-07-26", "description": "CASHBACK EARNED ONBF-mdkd54nv67e860b", "raw": "CASHBACK EARNED ONBF-mdkd54nv67e860b", "amount": 1.0, "type": "income", "debit": 0.0, "credit": 1.0, "balance": 1.0, "page": "Text", "line": "26", "store": null, "commodity": null, "transactionId": null, "personName": null, "accountNumber": null, "transferType": null, "upiId": null, "bankCode": "KKBK"}, {"date": "26-07-2025", "date_iso": "2025-07-26", "description": "UPI/paytmqr6byraw@p/520722240380/Pan", "raw": "UPI/paytmqr6byraw@p/520722240380/Pan", "amount": 16.0, "type": "expense", "debit": 16.0, "credit": 0.0, "balance": 16.0, "page": "Text", "line": "27", "store": "paytmqr6byraw@p", "commodity": "Pan", "transactionId": "520722240380", "personName": "Pan", "accountNumber": null, "transferType": "UPI", "upiId": "paytmqr6byraw@p", "bankCode": "KKBK"}, {"date": "27-07-2025", "date_iso": "2025-07-27", "description": "UPI/q683674770@ybl/520821206819/Pan", "raw": "UPI/q683674770@ybl/520821206819/Pan", "amount": 48.0, "type": "expense", "debit": 48.0, "credit": 0.0, "balance": 48.0, "page": "Text", "line": "33", "store": "q683674770@ybl", "commodity": "Pan", "transactionId": "520821206819", "personName": "Pan", "accountNumber": null, "transferType": "UPI", "upiId": "q683674770@ybl", "bankCode": "KKBK"}, {"date": "27-07-2025", "date_iso": "2025-07-27", "description": "UPI/q820756379@ybl/520819826994/Samosa", "raw": "UPI/q820756379@ybl/520819826994/Samosa", "amount": 180.0, "type": "expense", "debit": 180.0, "credit": 0.0, "balance": 180.0, "page": "Text", "line": "30", "store": "q820756379@ybl", "commodity": "Samosa", "transactionId": "520819826994", "personName": "Samosa", "accountNumber": null, "transferType": "UPI", "upiId": "q820756379@ybl", "bankCode": "KKBK"}, {"date": "27-07-2025", "date_iso": "2025-07-27", "description": "UPI/q083947814@ybl/520819906895/UPI", "raw": "UPI/q083947814@ybl/520819906895/UPI", "amount": 20.0, "type": "expense", "debit": 20.0, "credit": 0.0, "balance": 20.0, "page": "Text", "line": "32", "store": "q083947814@ybl", "commodity": null, "transactionId": "520819906895", "personName": "UPI", "accountNumber": null, "transferType": "UPI", "upiId": "q083947814@ybl", "bankCode": "KKBK"}, {"date": "27-07-2025", "date_iso": "2025-07-27", "description": "UPI/MAMTA MUNSHEELA/520884693427/UPI", "raw": "UPI/MAMTA MUNSHEELA/520884693427/UPI", "amount": 4500.0, "type": "income", "debit": 0.0, "credit": 4500.0, "balance": 4500.0, "page": "Text", "line": "28", "store": "MAMTA MUNSHEELA", "commodity": null, "transactionId": "520884693427", "personName": "UPI", "accountNumber": null, "transferType": "UPI", "upiId": "MAMTA MUNSHEELA", "bankCode": "KKBK"}, {"date": "27-07-2025", "date_iso": "2025-07-27", "description": "UPI/q775805952@ybl/520818793109/Iskcon", "raw": "UPI/q775805952@ybl/520818793109/Iskcon", "amount": 530.0, "type": "expense", "debit": 530.0, "credit": 0.0, "balance": 530.0, "page": "Text", "line": "29", "store": "q775805952@ybl", "commodity": "Iskcon", "transactionId": "520818793109", "personName": "Iskcon", "accountNumber": null, "transferType": "UPI", "upiId": "q775805952@ybl", "bankCode": "KKBK"}, {"date": "28-07-2025", "date_iso": "2025-07-28", "description": "CYBS SI 520805507429", "raw": "PCD/3138/YOUTUBE CYBS SI 520805507429", "amount": 149.0, "type": "expense", "debit": 149.0, "credit": 0.0, "balance": 149.0, "page": "Text", "line": "34", "store": "3138", "commodity": null, "transactionId": null, "personName": null, "accountNumber": null, "transferType": null, "upiId": null, "bankCode": "KKBK"}, {"date": "28-07-2025", "date_iso": "2025-07-28", "description": "UPI/bharatpe.900694/520914446533/Pay to", "raw": "UPI/bharatpe.900694/520914446533/Pay to", "amount": 60.0, "type": "expense", "debit": 60.0, "credit": 0.0, "balance": 60.0, "page": "Text", "line": "36", "store": "bharatpe.900694", "commodity": "Pay To", "transactionId": "520914446533", "personName": "Pay to", "accountNumber": null, "transferType": "UPI", "upiId": "bharatpe.900694", "bankCode": "KKBK"}, {"date": "28-07-2025", "date_iso": "2025-07-28", "description": "UPI/q584953316@ybl/520914449586/Sindhana", "raw": "UPI/q584953316@ybl/520914449586/Sindhana", "amount": 40.0, "type": "expense", "debit": 40.0, "credit": 0.0, "balance": 40.0, "page": "Text", "line": "38", "store": "q584953316@ybl", "commodity": "Sindhana", "transactionId": "520914449586", "personName": "Sindhana", "accountNumber": null, "transferType": "UPI", "upiId": "q584953316@ybl", "bankCode": "KKBK"}, {"date": "28-07-2025", "date_iso": "2025-07-28", "description": "UPI/paytmqr2dbd9rpv/520914455991/Lassi", "raw": "UPI/paytmqr2dbd9rpv/520914455991/Lassi", "amount": 35.0, "type": "expense", "debit": 35.0, "credit": 0.0, "balance": 35.0, "page": "Text", "line": "39", "store": "paytmqr2dbd9rpv", "commodity": "Lassi", "transactionId": "520914455991", "personName": "Lassi", "accountNumber": null, "transferType": "UPI", "upiId": "paytmqr2dbd9rpv", "bankCode": "KKBK"}, {"date": "28-07-2025", "date_iso": "2025-07-28", "description": "UPI/paytmqr5kgkza@p/520921607634/Pani puri", "raw": "UPI/paytmqr5kgkza@p/520921607634/Pani puri", "amount": 75.0, "type": "expense", "debit": 75.0, "credit": 0.0, "balance": 75.0, "page": "Text", "line": "40", "store": "paytmqr5kgkza@p", "commodity": "Pani Puri", "transactionId": "520921607634", "personName": "Pani puri", "accountNumber": null, "transferType": "UPI", "upiId": "paytmqr5kgkza@p", "bankCode": "KKBK"}, {"date": "29-07-2025", "date_iso": "2025-07-29", "description": "UPI/scoops Of delig/557675782486/lassi", "raw": "UPI/scoops Of delig/557675782486/lassi", "amount": 60.0, "type": "expense", "debit": 60.0, "credit": 0.0, "balance": 60.0, "page": "Text", "line": "41", "store": "scoops Of delig", "commodity": "Lassi", "transactionId": "557675782486", "personName": "lassi", "accountNumber": null, "transferType": "UPI", "upiId": "scoops Of delig", "bankCode": "KKBK"}, {"date": "29-07-2025", "date_iso": "2025-07-29", "description": "UPI/OMKAR TANAJI KA/521063065554/UPI", "raw": "UPI/OMKAR TANAJI KA/521063065554/UPI", "amount": 100.0, "type": "income", "debit": 0.0, "credit": 100.0, "balance": 100.0, "page": "Text", "line": "42", "store": "OMKAR TANAJI KA", "commodity": null, "transactionId": "521063065554", "personName": "UPI", "accountNumber": null, "transferType": "UPI", "upiId": "OMKAR TANAJI KA", "bankCode": "KKBK"}, {"date": "29-07-2025", "date_iso": "2025-07-29", "description": "UPI/ADITYA RAJESH B/521073486236/UPI", "raw": "UPI/ADITYA RAJESH B/521073486236/UPI", "amount": 40.0, "type": "income", "debit": 0.0, "credit": 40.0, "balance": 40.0, "page": "Text", "line": "43", "store": "ADITYA RAJESH B", "commodity": null, "transactionId": "521073486236", "personName": "UPI", "accountNumber": null, "transferType": "UPI", "upiId": "ADITYA RAJESH B", "bankCode": "KKBK"}, {"date": "29-07-2025", "date_iso": "2025-07-29", "description": "UPI/q683674770@ybl/521020138839/Pan", "raw": "UPI/q683674770@ybl/521020138839/Pan", "amount": 68.0, "type": "expense", "debit": 68.0, "credit": 0.0, "balance": 68.0, "page": "Text", "line": "44", "store": "q683674770@ybl", "commodity": "Pan", "transactionId": "521020138839", "personName": "Pan", "accountNumber": null, "transferType": "UPI", "upiId": "q683674770@ybl", "bankCode": "KKBK"}, {"date": "29-07-2025", "date_iso": "2025-07-29", "description": "UPI/paytmqr64xpfe@p/521021153658/UPI", "raw": "UPI/paytmqr64xpfe@p/521021153658/UPI", "amount": 50.0, "type": "expense", "debit": 50.0, "credit": 0.0, "balance": 50.0, "page": "Text", "line": "45", "store": "paytmqr64xpfe@p", "commodity": null, "transactionId": "521021153658", "personName": "UPI", "accountNumber": null, "transferType": "UPI", "upiId": "paytmqr64xpfe@p", "bankCode": "KKBK"}, {"date": "30-07-2025", "date_iso": "2025-07-30", "description": "UPI/q683674770@ybl/521120051392/UPI", "raw": "UPI/q683674770@ybl/521120051392/UPI", "amount": 10.0, "type": "expense", "debit": 10.0, "credit": 0.0, "balance": 10.0, "page": "Text", "line": "5", "store": "q683674770@ybl", "commodity": null, "transactionId": "521120051392", "personName": "UPI", "accountNumber": null, "transferType": "UPI", "upiId": "q683674770@ybl", "bankCode": "KKBK"}, {"date": "30-07-2025", "date_iso": "2025-07-30", "description": "UPI/q683674770@ybl/521120048262/Pan", "raw": "UPI/q683674770@ybl/521120048262/Pan", "amount": 48.0, "type": "expense", "debit": 48.0, "credit": 0.0, "balance": 48.0, "page": "Text", "line": "4", "store": "q683674770@ybl", "commodity": "Pan", "transactionId": "521120048262", "personName": "Pan", "accountNumber": null, "transferType": "UPI", "upiId": "q683674770@ybl", "bankCode": "KKBK"}, {"date": "30-07-2025", "date_iso": "2025-07-30", "description": "UPI/q156730843@ybl/521117476678/Sabdwich", "raw": "UPI/q156730843@ybl/521117476678/Sabdwich", "amount": 100.0, "type": "expense", "debit": 100.0, "credit": 0.0, "balance": 100.0, "page": "Text", "line": "47", "store": "q156730843@ybl", "commodity": "Sabdwich", "transactionId": "521117476678", "personName": "Sabdwich", "accountNumber": null, "transferType": "UPI", "upiId": "q156730843@ybl", "bankCode": "KKBK"}, {"date": "30-07-2025", "date_iso": "2025-07-30", "description": "UPI/paytmqr2dbd9rpv/521114868879/Lassi", "raw": "UPI/paytmqr2dbd9rpv/521114868879/Lassi", "amount": 35.0, "type": "expense", "debit": 35.0, "credit": 0.0, "balance": 35.0, "page": "Text", "line": "46", "store": "paytmqr2dbd9rpv", "commodity": "Lassi", "transactionId": "521114868879", "personName": "Lassi", "accountNumber": null, "transferType": "UPI", "upiId": "paytmqr2dbd9rpv", "bankCode": "KKBK"}, {"date": "31-07-2025", "date_iso": "2025-07-31", "description": "UPI/q821093085@ybl/521210018781", "raw": "UPI/q821093085@ybl/521210018781", "amount": 30.0, "type": "expense", "debit": 30.0, "credit": 0.0, "balance": 30.0, "page": "Text", "line": "6", "store": "q821093085@ybl", "commodity": null, "transactionId": null, "personName": null, "accountNumber": null, "transferType": null, "upiId": null, "bankCode": "KKBK"}, {"date": "31-07-2025", "date_iso": "2025-07-31", "description": "CASHBACK EARNED ONBF-mdqxcc0hd8d1df9", "raw": "CASHBACK EARNED ONBF-mdqxcc0hd8d1df9", "amount": 1.15, "type": "income", "debit": 0.0, "credit": 1.15, "balance": 1.15, "page": "Text", "line": "8", "store": null, "commodity": null, "transactionId": null, "personName": null, "accountNumber": null, "transferType": null, "upiId": null, "bankCode": "KKBK"}, {"date": "31-07-2025", "date_iso": "2025-07-31", "description": "UPI/PUJA ARJUN MANE/521241578213/UPI", "raw": "UPI/PUJA ARJUN MANE/521241578213/UPI", "amount": 1943.0, "type": "income", "debit": 0.0, "credit": 1943.0, "balance": 1943.0, "page": "Text", "line": "9", "store": "PUJA ARJUN MANE", "commodity": null, "transactionId": "521241578213", "personName": "UPI", "accountNumber": null, "transferType": "UPI", "upiId": "PUJA ARJUN MANE", "bankCode": "KKBK"}, {"date": "31-07-2025", "date_iso": "2025-07-31", "description": "UPI/paytmqr69lcmz@p/521214872625/Lassi", "raw": "UPI/paytmqr69lcmz@p/521214872625/Lassi", "amount": 50.0, "type": "expense", "debit": 50.0, "credit": 0.0, "balance": 50.0, "page": "Text", "line": "10", "store": "paytmqr69lcmz@p", "commodity": "Lassi", "transactionId": "521214872625", "personName": "Lassi", "accountNumber": null, "transferType": "UPI", "upiId": "paytmqr69lcmz@p", "bankCode": "KKBK"}, {"date": "31-07-2025", "date_iso": "2025-07-31", "description": "UPI/ADITYA RAJESH B/521243786671/UPI", "raw": "UPI/ADITYA RAJESH B/521243786671/UPI", "amount": 100.0, "type": "income", "debit": 0.0, "credit": 100.0, "balance": 100.0, "page": "Text", "line": "11", "store": "ADITYA RAJESH B", "commodity": null, "transactionId": "521243786671", "personName": "UPI", "accountNumber": null, "transferType": "UPI", "upiId": "ADITYA RAJESH B", "bankCode": "KKBK"}, {"date": "31-07-2025", "date_iso": "2025-07-31", "description": "UPI/8108917818@ybl/521214913805/Chole", "raw": "UPI/8108917818@ybl/521214913805/Chole", "amount": 90.0, "type": "expense", "debit": 90.0, "credit": 0.0, "balance": 90.0, "page": "Text", "line": "12", "store": "8108917818@ybl", "commodity": "Chole", "transactionId": "521214913805", "personName": "Chole", "accountNumber": null, "transferType": "UPI", "upiId": "8108917818@ybl", "bankCode": "KKBK"}, {"date": "31-07-2025", "date_iso": "2025-07-31", "description": "UPI/q584953316@ybl/521214918699/UPI", "raw": "UPI/q584953316@ybl/521214918699/UPI", "amount": 140.0, "type": "expense", "debit": 140.0, "credit": 0.0, "balance": 140.0, "page": "Text", "line": "14", "store": "q584953316@ybl", "commodity": null, "transactionId": "521214918699", "personName": "UPI", "accountNumber": null, "transferType": "UPI", "upiId": "q584953316@ybl", "bankCode": "KKBK"}, {"date": "31-07-2025", "date_iso": "2025-07-31", "description": "UPI/SHILPA BAJRANGB/521282382964/UPI", "raw": "UPI/SHILPA BAJRANGB/521282382964/UPI", "amount": 110.0, "type": "income", "debit": 0.0, "credit": 110.0, "balance": 110.0, "page": "Text", "line": "15", "store": "SHILPA BAJRANGB", "commodity": null, "transactionId": "521282382964", "personName": "UPI", "accountNumber": null, "transferType": "UPI", "upiId": "SHILPA BAJRANGB", "bankCode": "KKBK"}, {"date": "01-08-2025", "date_iso": "2025-01-08", "description": "UPI/Chirag Santosh /557964860326/UPI", "raw": "UPI/Chirag Santosh /557964860326/UPI", "amount": 30.0, "type": "income", "debit": 0.0, "credit": 30.0, "balance": 30.0, "page": "Text", "line": "22", "store": "Chirag Santosh", "commodity": null, "transactionId": "557964860326", "personName": "UPI", "accountNumber": null, "transferType": "UPI", "upiId": "Chirag Santosh", "bankCode": "KKBK"}, {"date": "01-08-2025", "date_iso": "2025-01-08", "description": "CASHBACK EARNED ONBF-mdsxxckm3dff54a", "raw": "CASHBACK EARNED ONBF-mdsxxckm3dff54a", "amount": 5.0, "type": "income", "debit": 0.0, "credit": 5.0, "balance": 5.0, "page": "Text", "line": "21", "store": null, "commodity": null, "transactionId": null, "personName": null, "accountNumber": null, "transferType": null, "upiId": null, "bankCode": "KKBK"}, {"date": "01-08-2025", "date_iso": "2025-01-08", "description": "UPI/q270287840@ybl/521320621966/Petrol", "raw": "UPI/q270287840@ybl/521320621966/Petrol", "amount": 912.0, "type": "expense", "debit": 912.0, "credit": 0.0, "balance": 912.0, "page": "Text", "line": "20", "store": "q270287840@ybl", "commodity": "Petrol", "transactionId": "521320621966", "personName": "Petrol", "accountNumber": null, "transferType": "UPI", "upiId": "q270287840@ybl", "bankCode": "KKBK"}, {"date": "01-08-2025", "date_iso": "2025-01-08", "description": "UPI/q683674770@ybl/521321835893/Toffee", "raw": "UPI/q683674770@ybl/521321835893/Toffee", "amount": 20.0, "type": "expense", "debit": 20.0, "credit": 0.0, "balance": 20.0, "page": "Text", "line": "23", "store": "q683674770@ybl", "commodity": "Toffee", "transactionId": "521321835893", "personName": "Toffee", "accountNumber": null, "transferType": "UPI", "upiId": "q683674770@ybl", "bankCode": "KKBK"}, {"date": "01-08-2025", "date_iso": "2025-01-08", "description": "UPI/paytmqr1g9jdk08/521314660325/Lassi", "raw": "UPI/paytmqr1g9jdk08/521314660325/Lassi", "amount": 25.0, "type": "expense", "debit": 25.0, "credit": 0.0, "balance": 25.0, "page": "Text", "line": "18", "store": "paytmqr1g9jdk08", "commodity": "Lassi", "transactionId": "521314660325", "personName": "Lassi", "accountNumber": null, "transferType": "UPI", "upiId": "paytmqr1g9jdk08", "bankCode": "KKBK"}, {"date": "01-08-2025", "date_iso": "2025-01-08", "description": "UPI/CAPITALFLOAT/521358815965/Request", "raw": "UPI/CAPITALFLOAT/521358815965/Request", "amount": 4576.58, "type": "expense", "debit": 4576.58, "credit": 0.0, "balance": 4576.58, "page": "Text", "line": "16", "store": "CAPITALFLOAT", "commodity": "Request", "transactionId": "521358815965", "personName": "Request", "accountNumber": null, "transferType": "UPI", "upiId": "CAPITALFLOAT", "bankCode": "KKBK"}, {"date": "01-08-2025", "date_iso": "2025-01-08", "description": "UPI/q224773015@ybl/521320584235/Pani puri", "raw": "UPI/q224773015@ybl/521320584235/Pani puri", "amount": 70.0, "type": "expense", "debit": 70.0, "credit": 0.0, "balance": 70.0, "page": "Text", "line": "19", "store": "q224773015@ybl", "commodity": "Pani Puri", "transactionId": "521320584235", "personName": "Pani puri", "accountNumber": null, "transferType": "UPI", "upiId": "q224773015@ybl", "bankCode": "KKBK"}, {"date": "01-08-2025", "date_iso": "2025-01-08", "description": "UPI/paytmqr6b4pmu@p/521321855552", "raw": "UPI/paytmqr6b4pmu@p/521321855552", "amount": 30.0, "type": "expense", "debit": 30.0, "credit": 0.0, "balance": 30.0, "page": "Text", "line": "24", "store": "paytmqr6b4pmu@p", "commodity": null, "transactionId": null, "personName": null, "accountNumber": null, "transferType": null, "upiId": null, "bankCode": "KKBK"}, {"date": "02-08-2025", "date_iso": "2025-02-08", "description": "UPI/DEEP D DEY/558043116925/for sandwich", "raw": "UPI/DEEP D DEY/558043116925/for sandwich", "amount": 40.0, "type": "expense", "debit": 40.0, "credit": 0.0, "balance": 40.0, "page": "Text", "line": "27", "store": "DEEP D DEY", "commodity": "For Sandwich", "transactionId": "558043116925", "personName": "for sandwich", "accountNumber": null, "transferType": "UPI", "upiId": "DEEP D DEY", "bankCode": "KKBK"}, {"date": "02-08-2025", "date_iso": "2025-02-08", "description": "UPI/ZEPTO MARKETPLA/521461087353/UPI", "raw": "UPI/ZEPTO MARKETPLA/521461087353/UPI", "amount": 204.48, "type": "expense", "debit": 204.48, "credit": 0.0, "balance": 204.48, "page": "Text", "line": "26", "store": "ZEPTO MARKETPLA", "commodity": null, "transactionId": "521461087353", "personName": "UPI", "accountNumber": null, "transferType": "UPI", "upiId": "ZEPTO MARKETPLA", "bankCode": "KKBK"}, {"date": "03-08-2025", "date_iso": "2025-03-08", "description": "UPI/SHILPA BAJRANGB/558125202816/UPI", "raw": "UPI/SHILPA BAJRANGB/558125202816/UPI", "amount": 30.0, "type": "income", "debit": 0.0, "credit": 30.0, "balance": 30.0, "page": "Text", "line": "28", "store": "SHILPA BAJRANGB", "commodity": null, "transactionId": "558125202816", "personName": "UPI", "accountNumber": null, "transferType": "UPI", "upiId": "SHILPA BAJRANGB", "bankCode": "KKBK"}, {"date": "03-08-2025", "date_iso": "2025-03-08", "description": "UPI/Mr Vishnu Munsh/558166734089/UPI", "raw": "UPI/Mr Vishnu Munsh/558166734089/UPI", "amount": 400.0, "type": "income", "debit": 0.0, "credit": 400.0, "balance": 400.0, "page": "Text", "line": "29", "store": "Mr Vishnu Munsh", "commodity": null, "transactionId": "558166734089", "personName": "UPI", "accountNumber": null, "transferType": "UPI", "upiId": "Mr Vishnu Munsh", "bankCode": "KKBK"}, {"date": "03-08-2025", "date_iso": "2025-03-08", "description": "UPI/Blinkit/558114890908/Blinkit Payment", "raw": "UPI/Blinkit/558114890908/Blinkit Payment", "amount": 363.0, "type": "expense", "debit": 363.0, "credit": 0.0, "balance": 363.0, "page": "Text", "line": "30", "store": "Blinkit", "commodity": "Blinkit Payment", "transactionId": "558114890908", "personName": "Blinkit Payment", "accountNumber": null, "transferType": "UPI", "upiId": "Blinkit", "bankCode": "KKBK"}, {"date": "04-08-2025", "date_iso": "2025-04-08", "description": "UPI/paytmqr2dbd9rpv/521613097407/Lassi", "raw": "UPI/paytmqr2dbd9rpv/521613097407/Lassi", "amount": 35.0, "type": "expense", "debit": 35.0, "credit": 0.0, "balance": 35.0, "page": "Text", "line": "31", "store": "paytmqr2dbd9rpv", "commodity": "Lassi", "transactionId": "521613097407", "personName": "Lassi", "accountNumber": null, "transferType": "UPI", "upiId": "paytmqr2dbd9rpv", "bankCode": "KKBK"}, {"date": "05-08-2025", "date_iso": "2025-05-08", "description": "UPI/q683674770@ybl/521720314644/UPI", "raw": "UPI/q683674770@ybl/521720314644/UPI", "amount": 20.0, "type": "expense", "debit": 20.0, "credit": 0.0, "balance": 20.0, "page": "Text", "line": "37", "store": "q683674770@ybl", "commodity": null, "transactionId": "521720314644", "personName": "UPI", "accountNumber": null, "transferType": "UPI", "upiId": "q683674770@ybl", "bankCode": "KKBK"}, {"date": "05-08-2025", "date_iso": "2025-05-08", "description": "UPI/q584953316@ybl/521714169189/UPI", "raw": "UPI/q584953316@ybl/521714169189/UPI", "amount": 90.0, "type": "expense", "debit": 90.0, "credit": 0.0, "balance": 90.0, "page": "Text", "line": "35", "store": "q584953316@ybl", "commodity": null, "transactionId": "521714169189", "personName": "UPI", "accountNumber": null, "transferType": "UPI", "upiId": "q584953316@ybl", "bankCode": "KKBK"}, {"date": "05-08-2025", "date_iso": "2025-05-08", "description": "UPI/npd051956@tjsb/521720158054/Pani puri", "raw": "UPI/npd051956@tjsb/521720158054/Pani puri", "amount": 60.0, "type": "expense", "debit": 60.0, "credit": 0.0, "balance": 60.0, "page": "Text", "line": "36", "store": "npd051956@tjsb", "commodity": "Pani Puri", "transactionId": "521720158054", "personName": "Pani puri", "accountNumber": null, "transferType": "UPI", "upiId": "npd051956@tjsb", "bankCode": "KKBK"}, {"date": "05-08-2025", "date_iso": "2025-05-08", "description": "UPI/q821093085@ybl/521710885859/Jucie", "raw": "UPI/q821093085@ybl/521710885859/Jucie", "amount": 30.0, "type": "expense", "debit": 30.0, "credit": 0.0, "balance": 30.0, "page": "Text", "line": "32", "store": "q821093085@ybl", "commodity": "Jucie", "transactionId": "521710885859", "personName": "Jucie", "accountNumber": null, "transferType": "UPI", "upiId": "q821093085@ybl", "bankCode": "KKBK"}, {"date": "05-08-2025", "date_iso": "2025-05-08", "description": "UPI/paytm.s1jv8qq@p/521714155332/Masala", "raw": "UPI/paytm.s1jv8qq@p/521714155332/Masala", "amount": 40.0, "type": "expense", "debit": 40.0, "credit": 0.0, "balance": 40.0, "page": "Text", "line": "33", "store": "paytm.s1jv8qq@p", "commodity": "Masala", "transactionId": "521714155332", "personName": "Masala", "accountNumber": null, "transferType": "UPI", "upiId": "paytm.s1jv8qq@p", "bankCode": "KKBK"}, {"date": "06-08-2025", "date_iso": "2025-06-08", "description": "UPI/paytmqr69lppx@p/521820885901/Kinder", "raw": "UPI/paytmqr69lppx@p/521820885901/Kinder", "amount": 50.0, "type": "expense", "debit": 50.0, "credit": 0.0, "balance": 50.0, "page": "Text", "line": "45", "store": "paytmqr69lppx@p", "commodity": "Kinder", "transactionId": "521820885901", "personName": "Kinder", "accountNumber": null, "transferType": "UPI", "upiId": "paytmqr69lppx@p", "bankCode": "KKBK"}, {"date": "06-08-2025", "date_iso": "2025-06-08", "description": "UPI/SHILPA BAJRANGB/558437048756/UPI", "raw": "UPI/SHILPA BAJRANGB/558437048756/UPI", "amount": 40.0, "type": "income", "debit": 0.0, "credit": 40.0, "balance": 40.0, "page": "Text", "line": "38", "store": "SHILPA BAJRANGB", "commodity": null, "transactionId": "558437048756", "personName": "UPI", "accountNumber": null, "transferType": "UPI", "upiId": "SHILPA BAJRANGB", "bankCode": "KKBK"}, {"date": "06-08-2025", "date_iso": "2025-06-08", "description": "UPI/q418823653@ybl/521813655256/Sandwich", "raw": "UPI/q418823653@ybl/521813655256/Sandwich", "amount": 40.0, "type": "expense", "debit": 40.0, "credit": 0.0, "balance": 40.0, "page": "Text", "line": "39", "store": "q418823653@ybl", "commodity": "Sandwich", "transactionId": "521813655256", "personName": "Sandwich", "accountNumber": null, "transferType": "UPI", "upiId": "q418823653@ybl", "bankCode": "KKBK"}, {"date": "06-08-2025", "date_iso": "2025-06-08", "description": "UPI/OMKAR TANAJI KA/558414677067/UPI", "raw": "UPI/OMKAR TANAJI KA/558414677067/UPI", "amount": 100.0, "type": "income", "debit": 0.0, "credit": 100.0, "balance": 100.0, "page": "Text", "line": "42", "store": "OMKAR TANAJI KA", "commodity": null, "transactionId": "558414677067", "personName": "UPI", "accountNumber": null, "transferType": "UPI", "upiId": "OMKAR TANAJI KA", "bankCode": "KKBK"}, {"date": "06-08-2025", "date_iso": "2025-06-08", "description": "UPI/SAHIL MANCHINDR/109340761916/UPI", "raw": "UPI/SAHIL MANCHINDR/109340761916/UPI", "amount": 20.0, "type": "income", "debit": 0.0, "credit": 20.0, "balance": 20.0, "page": "Text", "line": "43", "store": "SAHIL MANCHINDR", "commodity": null, "transactionId": "109340761916", "personName": "UPI", "accountNumber": null, "transferType": "UPI", "upiId": "SAHIL MANCHINDR", "bankCode": "KKBK"}, {"date": "06-08-2025", "date_iso": "2025-06-08", "description": "UPI/ADITYA RAJESH B/521819841993/UPI", "raw": "UPI/ADITYA RAJESH B/521819841993/UPI", "amount": 50.0, "type": "income", "debit": 0.0, "credit": 50.0, "balance": 50.0, "page": "Text", "line": "44", "store": "ADITYA RAJESH B", "commodity": null, "transactionId": "521819841993", "personName": "UPI", "accountNumber": null, "transferType": "UPI", "upiId": "ADITYA RAJESH B", "bankCode": "KKBK"}, {"date": "06-08-2025", "date_iso": "2025-06-08", "description": "UPI/gpay-1125117309/521813660350/Nimbu", "raw": "UPI/gpay-1125117309/521813660350/Nimbu", "amount": 10.0, "type": "expense", "debit": 10.0, "credit": 0.0, "balance": 10.0, "page": "Text", "line": "40", "store": "gpay-1125117309", "commodity": "Nimbu", "transactionId": "521813660350", "personName": "Nimbu", "accountNumber": null, "transferType": "UPI", "upiId": "gpay-1125117309", "bankCode": "KKBK"}, {"date": "07-08-2025", "date_iso": "2025-07-08", "description": "UPI/q028859565@ybl/521914496872/Sindhana", "raw": "UPI/q028859565@ybl/521914496872/Sindhana", "amount": 40.0, "type": "expense", "debit": 40.0, "credit": 0.0, "balance": 40.0, "page": "Text", "line": "4", "store": "q028859565@ybl", "commodity": "Sindhana", "transactionId": "521914496872", "personName": "Sindhana", "accountNumber": null, "transferType": "UPI", "upiId": "q028859565@ybl", "bankCode": "KKBK"}, {"date": "07-08-2025", "date_iso": "2025-07-08", "description": "UPI/kumarashok45147/521900342480/UPI", "raw": "UPI/kumarashok45147/521900342480/UPI", "amount": 273.0, "type": "expense", "debit": 273.0, "credit": 0.0, "balance": 273.0, "page": "Text", "line": "47", "store": "kumarashok45147", "commodity": null, "transactionId": "521900342480", "personName": "UPI", "accountNumber": null, "transferType": "UPI", "upiId": "kumarashok45147", "bankCode": "KKBK"}, {"date": "07-08-2025", "date_iso": "2025-07-08", "description": "UPI/q030362543@ybl/521914488285/Juice", "raw": "UPI/q030362543@ybl/521914488285/Juice", "amount": 20.0, "type": "expense", "debit": 20.0, "credit": 0.0, "balance": 20.0, "page": "Text", "line": "48", "store": "q030362543@ybl", "commodity": "Juice", "transactionId": "521914488285", "personName": "Juice", "accountNumber": null, "transferType": "UPI", "upiId": "q030362543@ybl", "bankCode": "KKBK"}, {"date": "08-08-2025", "date_iso": "2025-08-08", "description": "UPI/23000192@idfcba/522014735797/UPI", "raw": "UPI/23000192@idfcba/522014735797/UPI", "amount": 75.0, "type": "expense", "debit": 75.0, "credit": 0.0, "balance": 75.0, "page": "Text", "line": "17", "store": "23000192@idfcba", "commodity": null, "transactionId": "522014735797", "personName": "UPI", "accountNumber": null, "transferType": "UPI", "upiId": "23000192@idfcba", "bankCode": "KKBK"}, {"date": "08-08-2025", "date_iso": "2025-08-08", "description": "UPI/MANOJ PRAJAPAT/522058036958/Rent", "raw": "UPI/MANOJ PRAJAPAT/522058036958/Rent", "amount": 6000.0, "type": "expense", "debit": 6000.0, "credit": 0.0, "balance": 6000.0, "page": "Text", "line": "22", "store": "MANOJ PRAJAPAT", "commodity": "Rent", "transactionId": "522058036958", "personName": "Rent", "accountNumber": null, "transferType": "UPI", "upiId": "MANOJ PRAJAPAT", "bankCode": "KKBK"}, {"date": "08-08-2025", "date_iso": "2025-08-08", "description": "UPI/MANOJ PRAJAPAT/522025146770/test", "raw": "UPI/MANOJ PRAJAPAT/522025146770/test", "amount": 1.0, "type": "income", "debit": 0.0, "credit": 1.0, "balance": 1.0, "page": "Text", "line": "20", "store": "MANOJ PRAJAPAT", "commodity": "Test", "transactionId": "522025146