{"success": true, "transactions": [{"date": "02/10/2025", "date_iso": "2025-10-02", "description": "UPI 010043048143 KEDARNATH SHARMA/", "raw": "UPI 010043048143/BKID /JAYPRAKASH KEDARNATH SHARMA/", "amount": 1500.0, "type": "expense", "debit": 1500.0, "credit": 0.0, "balance": 22666.4, "page": "Page 1", "line": "2", "store": null, "commodity": null, "reference": "010043048143", "channel": "UPI", "transactionId": "010043048143", "personName": null, "accountNumber": null, "transferType": "UPI", "upiId": null, "bankCode": "MAHB"}, {"date": "02/10/2025", "date_iso": "2025-10-02", "description": "UPI 010632899107 KEDARNATH SHARMA/", "raw": "UPI 010632899107/BKID /JAYPRAKASH KEDARNATH SHARMA/", "amount": 200.0, "type": "expense", "debit": 200.0, "credit": 0.0, "balance": 22466.4, "page": "Page 1", "line": "3", "store": null, "commodity": null, "reference": "010632899107", "channel": "UPI", "transactionId": "010632899107", "personName": null, "accountNumber": null, "transferType": "UPI", "upiId": null, "bankCode": "MAHB"}, {"date": "03/10/2025", "date_iso": "2025-10-03", "description": "UPI 082401169709ndian Railways", "raw": "UPI 082401169709/SBIN/Indian Railways/NO REMARKS", "amount": 10.0, "type": "expense", "debit": 10.0, "credit": 0.0, "balance": 22456.4, "page": "Page 1", "line": "4", "store": null, "commodity": null, "reference": "082401169709", "channel": "UPI", "transactionId": "082401169709", "personName": "Indian Railways", "accountNumber": null, "transferType": "UPI", "upiId": null, "bankCode": "MAHB"}, {"date": "03/10/2025", "date_iso": "2025-10-03", "description": "UPI 112144060830ehul Xerox", "raw": "UPI 112144060830/UTIB/Mehul Xerox /NO REMARKS", "amount": 45.0, "type": "expense", "debit": 45.0, "credit": 0.0, "balance": 22411.4, "page": "Page 1", "line": "5", "store": null, "commodity": null, "reference": "112144060830", "channel": "UPI", "transactionId": "112144060830", "personName": "Mehul Xerox", "accountNumber": null, "transferType": "UPI", "upiId": null, "bankCode": "MAHB"}, {"date": "03/10/2025", "date_iso": "2025-10-03", "description": "UPI 112557611904", "raw": "UPI 112557611904/HDFC/CAMPUS MEDICAL AND GENERAL S", "amount": 20.0, "type": "expense", "debit": 20.0, "credit": 0.0, "balance": 22391.4, "page": "Page 1", "line": "6", "store": null, "commodity": null, "reference": "112557611904", "channel": "UPI", "transactionId": "112557611904", "personName": "CAMPUS MEDICAL AND GENERAL S", "accountNumber": null, "transferType": "UPI", "upiId": null, "bankCode": "MAHB"}, {"date": "03/10/2025", "date_iso": "2025-10-03", "description": "NEFT SBINN52025100339766111 ITDTAX REFUND 2025-26 SBIN0000TBU", "raw": "NEFT SBINN52025100339766111 ITDTAX REFUND 2025-26 SBIN0000TBU", "amount": 3970.0, "type": "income", "debit": 0.0, "credit": 3970.0, "balance": 26361.4, "page": "Page 1", "line": "7", "store": null, "commodity": null, "reference": "SBINN52025100339766111", "channel": "9008-NEFT/ RTGS\nCELL", "transactionId": "SBINN52025100339766111", "personName": null, "accountNumber": null, "transferType": "NEFT", "upiId": null, "bankCode": "MAHB"}, {"date": "03/10/2025", "date_iso": "2025-10-03", "description": "UPI 194141850863ariwar dryfruit and sweets/", "raw": "UPI 194141850863/YESB/Pariwar dryfruit and sweets/", "amount": 125.0, "type": "expense", "debit": 125.0, "credit": 0.0, "balance": 26236.4, "page": "Page 1", "line": "8", "store": null, "commodity": null, "reference": "194141850863", "channel": "UPI", "transactionId": "194141850863", "personName": "Pariwar dryfruit and sweets", "accountNumber": null, "transferType": "UPI", "upiId": null, "bankCode": "MAHB"}, {"date": "03/10/2025", "date_iso": "2025-10-03", "description": "UPI 101617620529 BHIM", "raw": "UPI 101617620529/HDFC/NPCI BHIM /BHIMCASHBACK", "amount": 2.0, "type": "income", "debit": 0.0, "credit": 2.0, "balance": 26238.4, "page": "Page 1", "line": "9", "store": null, "commodity": null, "reference": "101617620529", "channel": "UPI", "transactionId": "101617620529", "personName": "NPCI BHIM", "accountNumber": null, "transferType": "UPI", "upiId": null, "bankCode": "MAHB"}, {"date": "04/10/2025", "date_iso": "2025-10-04", "description": "UPI 102910288423ndian Railways", "raw": "UPI 102910288423/SBIN/Indian Railways/NO REMARKS", "amount": 10.0, "type": "expense", "debit": 10.0, "credit": 0.0, "balance": 26228.4, "page": "Page 1", "line": "10", "store": null, "commodity": null, "reference": "102910288423", "channel": "UPI", "transactionId": "102910288423", "personName": "Indian Railways", "accountNumber": null, "transferType": "UPI", "upiId": null, "bankCode": "MAHB"}, {"date": "04/10/2025", "date_iso": "2025-10-04", "description": "UPI 182918561456 ADDA", "raw": "UPI 182918561456/HDFC/GAMING ADDA/NO REMARKS", "amount": 160.0, "type": "expense", "debit": 160.0, "credit": 0.0, "balance": 26068.4, "page": "Page 1", "line": "11", "store": null, "commodity": null, "reference": "182918561456", "channel": "UPI", "transactionId": "182918561456", "personName": "GAMING ADDA", "accountNumber": null, "transferType": "UPI", "upiId": null, "bankCode": "MAHB"}, {"date": "05/10/2025", "date_iso": "2025-10-05", "description": "UPI 184403214883 Groww", "raw": "UPI 184403214883/HDFC/ICCL Groww /Paid Via Elements", "amount": 500.0, "type": "expense", "debit": 500.0, "credit": 0.0, "balance": 23058.4, "page": "Page 1", "line": "14", "store": null, "commodity": null, "reference": "184403214883", "channel": "UPI", "transactionId": "184403214883", "personName": "ICCL Groww", "accountNumber": null, "transferType": "UPI", "upiId": null, "bankCode": "MAHB"}, {"date": "05/10/2025", "date_iso": "2025-10-05", "description": "UPI 090639678950ndian Railways", "raw": "UPI 090639678950/SBIN/Indian Railways/NO REMARKS", "amount": 10.0, "type": "expense", "debit": 10.0, "credit": 0.0, "balance": 26058.4, "page": "Page 1", "line": "12", "store": null, "commodity": null, "reference": "090639678950", "channel": "UPI", "transactionId": "090639678950", "personName": "Indian Railways", "accountNumber": null, "transferType": "UPI", "upiId": null, "bankCode": "MAHB"}, {"date": "05/10/2025", "date_iso": "2025-10-05", "description": "UPI 175909283463 KEDARNATH SHARMA/", "raw": "UPI 175909283463/BKID /JAYPRAKASH KEDARNATH SHARMA/", "amount": 2500.0, "type": "expense", "debit": 2500.0, "credit": 0.0, "balance": 23558.4, "page": "Page 1", "line": "13", "store": null, "commodity": null, "reference": "175909283463", "channel": "UPI", "transactionId": "175909283463", "personName": null, "accountNumber": null, "transferType": "UPI", "upiId": null, "bankCode": "MAHB"}, {"date": "06/10/2025", "date_iso": "2025-10-06", "description": "UPI 112812721205ndian Railways", "raw": "UPI 112812721205/SBIN/Indian Railways/NO REMARKS", "amount": 10.0, "type": "expense", "debit": 10.0, "credit": 0.0, "balance": 23048.4, "page": "Page 1", "line": "15", "store": null, "commodity": null, "reference": "112812721205", "channel": "UPI", "transactionId": "112812721205", "personName": "Indian Railways", "accountNumber": null, "transferType": "UPI", "upiId": null, "bankCode": "MAHB"}, {"date": "06/10/2025", "date_iso": "2025-10-06", "description": "UPI 100291105423 ollect from 7715076", "raw": "UPI 100291105423/SBIN/SBIMOPS /Collect from 7715076", "amount": 100.0, "type": "expense", "debit": 100.0, "credit": 0.0, "balance": 22948.4, "page": "Page 1", "line": "16", "store": null, "commodity": null, "reference": "100291105423", "channel": "UPI", "transactionId": "100291105423", "personName": "SBIMOPS", "accountNumber": null, "transferType": "UPI", "upiId": null, "bankCode": "MAHB"}, {"date": "07/10/2025", "date_iso": "2025-10-07", "description": "UPI 171455409376 DAULAT SUPE", "raw": "UPI 171455409376/YESB/JITESH DAULAT SUPE/NO REMARK", "amount": 50.0, "type": "expense", "debit": 50.0, "credit": 0.0, "balance": 22284.4, "page": "Page 1", "line": "21", "store": null, "commodity": null, "reference": "171455409376", "channel": "UPI", "transactionId": "171455409376", "personName": "JITESH DAULAT SUPE", "accountNumber": null, "transferType": "UPI", "upiId": null, "bankCode": "MAHB"}, {"date": "07/10/2025", "date_iso": "2025-10-07", "description": "UPI 094943826433ndian Railways", "raw": "UPI 094943826433/SBIN/Indian Railways/NO REMARKS", "amount": 10.0, "type": "expense", "debit": 10.0, "credit": 0.0, "balance": 22938.4, "page": "Page 1", "line": "17", "store": null, "commodity": null, "reference": "094943826433", "channel": "UPI", "transactionId": "094943826433", "personName": "Indian Railways", "accountNumber": null, "transferType": "UPI", "upiId": null, "bankCode": "MAHB"}, {"date": "07/10/2025", "date_iso": "2025-10-07", "description": "UPI 095937526291", "raw": "UPI 095937526291/ICIC/BHIM/NO REMARKS", "amount": 99.0, "type": "expense", "debit": 99.0, "credit": 0.0, "balance": 22839.4, "page": "Page 1", "line": "18", "store": null, "commodity": null, "reference": "095937526291", "channel": "UPI", "transactionId": "095937526291", "personName": "BHIM", "accountNumber": null, "transferType": "UPI", "upiId": null, "bankCode": "MAHB"}, {"date": "07/10/2025", "date_iso": "2025-10-07", "description": "ACH Indian Clearing 0000X1LCSDKPAPX7GS252790265869", "raw": "ACH Indian Clearing 0000X1LCSDKPAPX7GS252790265869", "amount": 500.0, "type": "expense", "debit": 500.0, "credit": 0.0, "balance": 22339.4, "page": "Page 1", "line": "19", "store": null, "commodity": null, "reference": null, "channel": "1001-MUMBAI\nSERVICE BRANCH", "transactionId": null, "personName": null, "accountNumber": null, "transferType": "1001-MUMBAI\nSERVICE BRANCH", "upiId": null, "bankCode": "MAHB"}, {"date": "07/10/2025", "date_iso": "2025-10-07", "description": "UPI 143553229466 PRINTS", "raw": "UPI 143553229466/TBSB/INDO PRINTS/NO REMARKS", "amount": 5.0, "type": "expense", "debit": 5.0, "credit": 0.0, "balance": 22334.4, "page": "Page 1", "line": "20", "store": null, "commodity": null, "reference": "143553229466", "channel": "UPI", "transactionId": "143553229466", "personName": "INDO PRINTS", "accountNumber": null, "transferType": "UPI", "upiId": null, "bankCode": "MAHB"}, {"date": "08/10/2025", "date_iso": "2025-10-08", "description": "UPI 101657050798 BHIM", "raw": "UPI 101657050798/HDFC/NPCI BHIM /BHIMCASHBACK", "amount": 2.0, "type": "income", "debit": 0.0, "credit": 2.0, "balance": 22176.4, "page": "Page 2", "line": "1", "store": null, "commodity": null, "reference": "101657050798", "channel": "UPI", "transactionId": "101657050798", "personName": "NPCI BHIM", "accountNumber": null, "transferType": "UPI", "upiId": null, "bankCode": "MAHB"}, {"date": "08/10/2025", "date_iso": "2025-10-08", "description": "UPI 171354850223 GUPTA", "raw": "UPI 171354850223/YESB/RAKESH GUPTA/NO REMARKS", "amount": 100.0, "type": "expense", "debit": 100.0, "credit": 0.0, "balance": 22174.4, "page": "Page 1", "line": "23", "store": null, "commodity": null, "reference": "171354850223", "channel": "UPI", "transactionId": "171354850223", "personName": "RAKESH GUPTA", "accountNumber": null, "transferType": "UPI", "upiId": null, "bankCode": "MAHB"}, {"date": "08/10/2025", "date_iso": "2025-10-08", "description": "UPI 082259126874ndian Railways", "raw": "UPI 082259126874/SBIN/Indian Railways/NO REMARKS", "amount": 10.0, "type": "expense", "debit": 10.0, "credit": 0.0, "balance": 22274.4, "page": "Page 1", "line": "22", "store": null, "commodity": null, "reference": "082259126874", "channel": "UPI", "transactionId": "082259126874", "personName": "Indian Railways", "accountNumber": null, "transferType": "UPI", "upiId": null, "bankCode": "MAHB"}, {"date": "09/10/2025", "date_iso": "2025-10-09", "description": "UPI 093454761610ndian Railways", "raw": "UPI 093454761610/SBIN/Indian Railways/NO REMARKS", "amount": 10.0, "type": "expense", "debit": 10.0, "credit": 0.0, "balance": 22166.4, "page": "Page 2", "line": "2", "store": null, "commodity": null, "reference": "093454761610", "channel": "UPI", "transactionId": "093454761610", "personName": "Indian Railways", "accountNumber": null, "transferType": "UPI", "upiId": null, "bankCode": "MAHB"}, {"date": "09/10/2025", "date_iso": "2025-10-09", "description": "UPI 103409984372halo", "raw": "UPI 103409984372/AIRP/Chalo/Chalo", "amount": 10.0, "type": "expense", "debit": 10.0, "credit": 0.0, "balance": 22156.4, "page": "Page 2", "line": "3", "store": null, "commodity": null, "reference": "103409984372", "channel": "UPI", "transactionId": "103409984372", "personName": "Chalo", "accountNumber": null, "transferType": "UPI", "upiId": null, "bankCode": "MAHB"}, {"date": "09/10/2025", "date_iso": "2025-10-09", "description": "UPI 134136060298", "raw": "UPI 134136060298/HDFC/CAMPUS MEDICAL AND GENERAL S", "amount": 20.0, "type": "expense", "debit": 20.0, "credit": 0.0, "balance": 22136.4, "page": "Page 2", "line": "4", "store": null, "commodity": null, "reference": "134136060298", "channel": "UPI", "transactionId": "134136060298", "personName": "CAMPUS MEDICAL AND GENERAL S", "accountNumber": null, "transferType": "UPI", "upiId": null, "bankCode": "MAHB"}, {"date": "10/10/2025", "date_iso": "2025-10-10", "description": "UPI 101207680547ndian Railways", "raw": "UPI 101207680547/SBIN/Indian Railways/NO REMARKS", "amount": 10.0, "type": "expense", "debit": 10.0, "credit": 0.0, "balance": 22126.4, "page": "Page 2", "line": "5", "store": null, "commodity": null, "reference": "101207680547", "channel": "UPI", "transactionId": "101207680547", "personName": "Indian Railways", "accountNumber": null, "transferType": "UPI", "upiId": null, "bankCode": "MAHB"}, {"date": "10/10/2025", "date_iso": "2025-10-10", "description": "UPI 152700887878ndian Railways", "raw": "UPI 152700887878/SBIN/Indian Railways/NO REMARKS", "amount": 10.0, "type": "expense", "debit": 10.0, "credit": 0.0, "balance": 22116.4, "page": "Page 2", "line": "6", "store": null, "commodity": null, "reference": "152700887878", "channel": "UPI", "transactionId": "152700887878", "personName": "Indian Railways", "accountNumber": null, "transferType": "UPI", "upiId": null, "bankCode": "MAHB"}, {"date": "11/10/2025", "date_iso": "2025-10-11", "description": "UPI 104927625615ndian Railways", "raw": "UPI 104927625615/SBIN/Indian Railways/NO REMARKS", "amount": 10.0, "type": "expense", "debit": 10.0, "credit": 0.0, "balance": 22106.4, "page": "Page 2", "line": "7", "store": null, "commodity": null, "reference": "104927625615", "channel": "UPI", "transactionId": "104927625615", "personName": "Indian Railways", "accountNumber": null, "transferType": "UPI", "upiId": null, "bankCode": "MAHB"}, {"date": "11/10/2025", "date_iso": "2025-10-11", "description": "UPI 100295878879 upi", "raw": "UPI 100295878879/SBIN/SBIMOPS /@upi", "amount": 1150.0, "type": "expense", "debit": 1150.0, "credit": 0.0, "balance": 20956.4, "page": "Page 2", "line": "8", "store": null, "commodity": null, "reference": "100295878879", "channel": "UPI", "transactionId": "100295878879", "personName": "SBIMOPS", "accountNumber": null, "transferType": "UPI", "upiId": null, "bankCode": "MAHB"}, {"date": "11/10/2025", "date_iso": "2025-10-11", "description": "UPI 101685607796 BHIM", "raw": "UPI 101685607796/HDFC/NPCI BHIM /BHIMCASHBACK", "amount": 10.0, "type": "income", "debit": 0.0, "credit": 10.0, "balance": 20966.4, "page": "Page 2", "line": "9", "store": null, "commodity": null, "reference": "101685607796", "channel": "UPI", "transactionId": "101685607796", "personName": "NPCI BHIM", "accountNumber": null, "transferType": "UPI", "upiId": null, "bankCode": "MAHB"}, {"date": "12/10/2025", "date_iso": "2025-10-12", "description": "UPI 090739070872ndian Railways", "raw": "UPI 090739070872/SBIN/Indian Railways/NO REMARKS", "amount": 10.0, "type": "expense", "debit": 10.0, "credit": 0.0, "balance": 20956.4, "page": "Page 2", "line": "10", "store": null, "commodity": null, "reference": "090739070872", "channel": "UPI", "transactionId": "090739070872", "personName": "Indian Railways", "accountNumber": null, "transferType": "UPI", "upiId": null, "bankCode": "MAHB"}, {"date": "13/10/2025", "date_iso": "2025-10-13", "description": "UPI 095040290351 INVEST TECH PVT LTD", "raw": "UPI 095040290351/HDFC/GROWW INVEST TECH PVT LTD/Pa", "amount": 10000.0, "type": "expense", "debit": 10000.0, "credit": 0.0, "balance": 10956.4, "page": "Page 2", "line": "11", "store": null, "commodity": null, "reference": "095040290351", "channel": "UPI", "transactionId": "095040290351", "personName": "GROWW INVEST TECH PVT LTD", "accountNumber": null, "transferType": "UPI", "upiId": null, "bankCode": "MAHB"}, {"date": "14/10/2025", "date_iso": "2025-10-14", "description": "UPI 081244441869ndian Railways", "raw": "UPI 081244441869/SBIN/Indian Railways/NO REMARKS", "amount": 10.0, "type": "expense", "debit": 10.0, "credit": 0.0, "balance": 10946.4, "page": "Page 2", "line": "12", "store": null, "commodity": null, "reference": "081244441869", "channel": "UPI", "transactionId": "081244441869", "personName": "Indian Railways", "accountNumber": null, "transferType": "UPI", "upiId": null, "bankCode": "MAHB"}, {"date": "14/10/2025", "date_iso": "2025-10-14", "description": "UPI 090948666230", "raw": "UPI 090948666230/ICIC/MMRDA/Pay", "amount": 10.0, "type": "expense", "debit": 10.0, "credit": 0.0, "balance": 10936.4, "page": "Page 2", "line": "13", "store": null, "commodity": null, "reference": "090948666230", "channel": "UPI", "transactionId": "090948666230", "personName": "MMRDA", "accountNumber": null, "transferType": "UPI", "upiId": null, "bankCode": "MAHB"}, {"date": "15/10/2025", "date_iso": "2025-10-15", "description": "UPI 075248540961ndian Railways", "raw": "UPI 075248540961/SBIN/Indian Railways/NO REMARKS", "amount": 10.0, "type": "expense", "debit": 10.0, "credit": 0.0, "balance": 10926.4, "page": "Page 2", "line": "14", "store": null, "commodity": null, "reference": "075248540961", "channel": "UPI", "transactionId": "075248540961", "personName": "Indian Railways", "accountNumber": null, "transferType": "UPI", "upiId": null, "bankCode": "MAHB"}, {"date": "15/10/2025", "date_iso": "2025-10-15", "description": "UPI 081644403663", "raw": "UPI 081644403663/ICIC/MMRDA/Pay", "amount": 12.0, "type": "expense", "debit": 12.0, "credit": 0.0, "balance": 10914.4, "page": "Page 2", "line": "15", "store": null, "commodity": null, "reference": "081644403663", "channel": "UPI", "transactionId": "081644403663", "personName": "MMRDA", "accountNumber": null, "transferType": "UPI", "upiId": null, "bankCode": "MAHB"}, {"date": "15/10/2025", "date_iso": "2025-10-15", "description": "UPI 111034066947", "raw": "UPI 111034066947/SBIN /ZUBAIRAHMED MOHAMMADSALIM CO", "amount": 60.0, "type": "expense", "debit": 60.0, "credit": 0.0, "balance": 10854.4, "page": "Page 2", "line": "16", "store": null, "commodity": null, "reference": "111034066947", "channel": "UPI", "transactionId": "111034066947", "personName": null, "accountNumber": null, "transferType": "UPI", "upiId": null, "bankCode": "MAHB"}, {"date": "16/10/2025", "date_iso": "2025-10-16", "description": "UPI 081525020192ndian Railways", "raw": "UPI 081525020192/SBIN/Indian Railways/NO REMARKS", "amount": 10.0, "type": "expense", "debit": 10.0, "credit": 0.0, "balance": 10844.4, "page": "Page 2", "line": "17", "store": null, "commodity": null, "reference": "081525020192", "channel": "UPI", "transactionId": "081525020192", "personName": "Indian Railways", "accountNumber": null, "transferType": "UPI", "upiId": null, "bankCode": "MAHB"}, {"date": "16/10/2025", "date_iso": "2025-10-16", "description": "UPI 084907660316", "raw": "UPI 084907660316/HDFC/MMRCL/Pay", "amount": 12.0, "type": "expense", "debit": 12.0, "credit": 0.0, "balance": 10832.4, "page": "Page 2", "line": "18", "store": null, "commodity": null, "reference": "084907660316", "channel": "UPI", "transactionId": "084907660316", "personName": "MMRCL", "accountNumber": null, "transferType": "UPI", "upiId": null, "bankCode": "MAHB"}, {"date": "16/10/2025", "date_iso": "2025-10-16", "description": "UPI 091816839797", "raw": "UPI 091816839797/HDFC/MMRCL/Pay", "amount": 12.0, "type": "expense", "debit": 12.0, "credit": 0.0, "balance": 10820.4, "page": "Page 2", "line": "19", "store": null, "commodity": null, "reference": "091816839797", "channel": "UPI", "transactionId": "091816839797", "personName": "MMRCL", "accountNumber": null, "transferType": "UPI", "upiId": null, "bankCode": "MAHB"}, {"date": "17/10/2025", "date_iso": "2025-10-17", "description": "UPI 184117040811 RAMESH KUWAR", "raw": "UPI 184117040811/MAHB/MANJIRI RAMESH KUWAR/NO REMA", "amount": 40.0, "type": "expense", "debit": 40.0, "credit": 0.0, "balance": 7708.4, "page": "Page 2", "line": "26", "store": null, "commodity": null, "reference": "184117040811", "channel": "UPI", "transactionId": "184117040811", "personName": "MANJIRI RAMESH KUWAR", "accountNumber": null, "transferType": "UPI", "upiId": null, "bankCode": "MAHB"}, {"date": "17/10/2025", "date_iso": "2025-10-17", "description": "UPI 183854990506rs SUREKHA RAVINDRA KAMBLE1", "raw": "UPI 183854990506/MAHB/Mrs SUREKHA RAVINDRA KAMBLE1", "amount": 20.0, "type": "expense", "debit": 20.0, "credit": 0.0, "balance": 7748.4, "page": "Page 2", "line": "25", "store": null, "commodity": null, "reference": "183854990506", "channel": "UPI", "transactionId": "183854990506", "personName": "Mrs SUREKHA RAVINDRA KAMBLE1", "accountNumber": null, "transferType": "UPI", "upiId": null, "bankCode": "MAHB"}, {"date": "17/10/2025", "date_iso": "2025-10-17", "description": "UPI 182838661574", "raw": "UPI 182838661574/YESB /VISHWANATH GANAPATHI ACHARYA", "amount": 10.0, "type": "expense", "debit": 10.0, "credit": 0.0, "balance": 7768.4, "page": "Page 2", "line": "24", "store": null, "commodity": null, "reference": "182838661574", "channel": "UPI", "transactionId": "182838661574", "personName": null, "accountNumber": null, "transferType": "UPI", "upiId": null, "bankCode": "MAHB"}, {"date": "17/10/2025", "date_iso": "2025-10-17", "description": "UPI 092424881247 KAMRUDDIN SHAIK", "raw": "UPI 092424881247/YESB /JAMALUDDIN KAMRUDDIN SHAIK /N", "amount": 20.0, "type": "expense", "debit": 20.0, "credit": 0.0, "balance": 7790.4, "page": "Page 2", "line": "22", "store": null, "commodity": null, "reference": "092424881247", "channel": "UPI", "transactionId": "092424881247", "personName": null, "accountNumber": null, "transferType": "UPI", "upiId": null, "bankCode": "MAHB"}, {"date": "17/10/2025", "date_iso": "2025-10-17", "description": "UPI 081613884435ndian Railways", "raw": "UPI 081613884435/SBIN/Indian Railways/NO REMARKS", "amount": 10.0, "type": "expense", "debit": 10.0, "credit": 0.0, "balance": 7810.4, "page": "Page 2", "line": "21", "store": null, "commodity": null, "reference": "081613884435", "channel": "UPI", "transactionId": "081613884435", "personName": "Indian Railways", "accountNumber": null, "transferType": "UPI", "upiId": null, "bankCode": "MAHB"}, {"date": "17/10/2025", "date_iso": "2025-10-17", "description": "UPI 223721594189 KEDARNATH SHARMA/", "raw": "UPI 223721594189/BKID /JAYPRAKASH KEDARNATH SHARMA/", "amount": 3000.0, "type": "expense", "debit": 3000.0, "credit": 0.0, "balance": 7820.4, "page": "Page 2", "line": "20", "store": null, "commodity": null, "reference": "223721594189", "channel": "UPI", "transactionId": "223721594189", "personName": null, "accountNumber": null, "transferType": "UPI", "upiId": null, "bankCode": "MAHB"}, {"date": "17/10/2025", "date_iso": "2025-10-17", "description": "UPI 164132579467 JIGAR JOSHI", "raw": "UPI 164132579467/YESB/POOJA JIGAR JOSHI/NO REMARKS", "amount": 12.0, "type": "expense", "debit": 12.0, "credit": 0.0, "balance": 7778.4, "page": "Page 2", "line": "23", "store": null, "commodity": null, "reference": "164132579467", "channel": "UPI", "transactionId": "164132579467", "personName": "POOJA JIGAR JOSHI", "accountNumber": null, "transferType": "UPI", "upiId": null, "bankCode": "MAHB"}, {"date": "18/10/2025", "date_iso": "2025-10-18", "description": "UPI 101514110844ndian Railways", "raw": "UPI 101514110844/SBIN/Indian Railways/NO REMARKS", "amount": 10.0, "type": "expense", "debit": 10.0, "credit": 0.0, "balance": 7698.4, "page": "Page 2", "line": "27", "store": null, "commodity": null, "reference": "101514110844", "channel": "UPI", "transactionId": "101514110844", "personName": "Indian Railways", "accountNumber": null, "transferType": "UPI", "upiId": null, "bankCode": "MAHB"}, {"date": "18/10/2025", "date_iso": "2025-10-18", "description": "UPI 131054864109 DEVIDAS SALUNKE", "raw": "UPI 131054864109/YESB/SHARAD DEVIDAS SALUNKE/NO RE", "amount": 70.0, "type": "expense", "debit": 70.0, "credit": 0.0, "balance": 7628.4, "page": "Page 2", "line": "28", "store": null, "commodity": null, "reference": "131054864109", "channel": "UPI", "transactionId": "131054864109", "personName": "SHARAD DEVIDAS SALUNKE", "accountNumber": null, "transferType": "UPI", "upiId": null, "bankCode": "MAHB"}, {"date": "19/10/2025", "date_iso": "2025-10-19", "description": "UPI 191609167628", "raw": "UPI 191609167628/UTIB /SATYAMJAYPRAKASHSHARMA /Bheek", "amount": 6000.0, "type": "income", "debit": 0.0, "credit": 6000.0, "balance": 7618.4, "page": "Page 2", "line": "32", "store": null, "commodity": null, "reference": "191609167628", "channel": "UPI", "transactionId": "191609167628", "personName": null, "accountNumber": null, "transferType": "UPI", "upiId": null, "bankCode": "MAHB"}, {"date": "19/10/2025", "date_iso": "2025-10-19", "description": "UPI 224428475333 KEDARNATH SHARMA/", "raw": "UPI 224428475333/BKID /JAYPRAKASH KEDARNATH SHARMA/", "amount": 4000.0, "type": "expense", "debit": 4000.0, "credit": 0.0, "balance": 3628.4, "page": "Page 2", "line": "29", "store": null, "commodity": null, "reference": "224428475333", "channel": "UPI", "transactionId": "224428475333", "personName": null, "accountNumber": null, "transferType": "UPI", "upiId": null, "bankCode": "MAHB"}, {"date": "19/10/2025", "date_iso": "2025-10-19", "description": "UPI 100527797227", "raw": "UPI 100527797227/HDFC/MMRDA/Pay", "amount": 10.0, "type": "expense", "debit": 10.0, "credit": 0.0, "balance": 3618.4, "page": "Page 2", "line": "30", "store": null, "commodity": null, "reference": "100527797227", "channel": "UPI", "transactionId": "100527797227", "personName": "MMRDA", "accountNumber": null, "transferType": "UPI", "upiId": null, "bankCode": "MAHB"}, {"date": "19/10/2025", "date_iso": "2025-10-19", "description": "UPI 181716068816ranshu Sharma", "raw": "UPI 181716068816/AIRP/Pranshu Sharma/NO REMARKS", "amount": 2000.0, "type": "expense", "debit": 2000.0, "credit": 0.0, "balance": 1618.4, "page": "Page 2", "line": "31", "store": null, "commodity": null, "reference": "181716068816", "channel": "UPI", "transactionId": "181716068816", "personName": "Pranshu Sharma", "accountNumber": null, "transferType": "UPI", "upiId": null, "bankCode": "MAHB"}, {"date": "20/10/2025", "date_iso": "2025-10-20", "description": "UPI 165353856840 RAGHUNATH YADAV", "raw": "UPI 165353856840/UNBA/ANIL RAGHUNATH YADAV/Pay to", "amount": 10.0, "type": "expense", "debit": 10.0, "credit": 0.0, "balance": 12598.4, "page": "Page 2", "line": "35", "store": null, "commodity": null, "reference": "165353856840", "channel": "UPI", "transactionId": "165353856840", "personName": "ANIL RAGHUNATH YADAV", "accountNumber": null, "transferType": "UPI", "upiId": null, "bankCode": "MAHB"}, {"date": "20/10/2025", "date_iso": "2025-10-20", "description": "/**9898 INVEST TECH PR", "raw": "IMPS/48/529312924007/**9898 /GROWW INVEST TECH PR/I", "amount": 5000.0, "type": "income", "debit": 0.0, "credit": 5000.0, "balance": 12608.4, "page": "Page 2", "line": "34", "store": "48", "commodity": null, "reference": "529312924007", "channel": "IMPS", "transactionId": "529312924007", "personName": null, "accountNumber": null, "transferType": "IMPS", "upiId": null, "bankCode": "MAHB"}, {"date": "20/10/2025", "date_iso": "2025-10-20", "description": "UPI 105732849749", "raw": "UPI 105732849749/HDFC/MMRDA/Pay", "amount": 10.0, "type": "expense", "debit": 10.0, "credit": 0.0, "balance": 7608.4, "page": "Page 2", "line": "33", "store": null, "commodity": null, "reference": "105732849749", "channel": "UPI", "transactionId": "105732849749", "personName": "MMRDA", "accountNumber": null, "transferType": "UPI", "upiId": null, "bankCode": "MAHB"}, {"date": "21/10/2025", "date_iso": "2025-10-21", "description": "UPI 170817333269 DONALDS", "raw": "UPI 170817333269/HDFC/MC DONALDS/Generating DYNAMI", "amount": 210.0, "type": "expense", "debit": 210.0, "credit": 0.0, "balance": 8180.4, "page": "Page 2", "line": "40", "store": null, "commodity": null, "reference": "170817333269", "channel": "UPI", "transactionId": "170817333269", "personName": "MC DONALDS", "accountNumber": null, "transferType": "UPI", "upiId": null, "bankCode": "MAHB"}, {"date": "21/10/2025", "date_iso": "2025-10-21", "description": "UPI 529413161932 INVEST TECH PVT LTD", "raw": "UPI 529413161932/HDFC/GROWW INVEST TECH PVT LTD/Pa", "amount": 4000.0, "type": "expense", "debit": 4000.0, "credit": 0.0, "balance": 8598.4, "page": "Page 2", "line": "36", "store": null, "commodity": null, "reference": "529413161932", "channel": "UPI", "transactionId": "529413161932", "personName": "GROWW INVEST TECH PVT LTD", "accountNumber": null, "transferType": "UPI", "upiId": null, "bankCode": "MAHB"}, {"date": "21/10/2025", "date_iso": "2025-10-21", "description": "UPI 141701515158 MASTAYYA NAIK", "raw": "UPI 141701515158/YESB/CHANDRA MASTAYYA NAIK/NO REM", "amount": 170.0, "type": "expense", "debit": 170.0, "credit": 0.0, "balance": 8428.4, "page": "Page 2", "line": "37", "store": null, "commodity": null, "reference": "141701515158", "channel": "UPI", "transactionId": "141701515158", "personName": "CHANDRA MASTAYYA NAIK", "accountNumber": null, "transferType": "UPI", "upiId": null, "bankCode": "MAHB"}, {"date": "21/10/2025", "date_iso": "2025-10-21", "description": "UPI 101760641038 BHIM", "raw": "UPI 101760641038/HDFC/NPCI BHIM /BHIMCASHBACK", "amount": 2.0, "type": "income", "debit": 0.0, "credit": 2.0, "balance": 8430.4, "page": "Page 2", "line": "38", "store": null, "commodity": null, "reference": "101760641038", "channel": "UPI", "transactionId": "101760641038", "personName": "NPCI BHIM", "accountNumber": null, "transferType": "UPI", "upiId": null, "bankCode": "MAHB"}, {"date": "21/10/2025", "date_iso": "2025-10-21", "description": "UPI 143025148417 GRAIN AND GEN", "raw": "UPI 143025148417/YESB/NILESH GRAIN AND GEN/NO REMA", "amount": 40.0, "type": "expense", "debit": 40.0, "credit": 0.0, "balance": 8390.4, "page": "Page 2", "line": "39", "store": null, "commodity": null, "reference": "143025148417", "channel": "UPI", "transactionId": "143025148417", "personName": "NILESH GRAIN AND GEN", "accountNumber": null, "transferType": "UPI", "upiId": null, "bankCode": "MAHB"}, {"date": "24/10/2025", "date_iso": "2025-10-24", "description": "UPI 104347216672", "raw": "UPI 104347216672/ICIC/MMRDA/Pay", "amount": 10.0, "type": "expense", "debit": 10.0, "credit": 0.0, "balance": 8170.4, "page": "Page 2", "line": "41", "store": null, "commodity": null, "reference": "104347216672", "channel": "UPI", "transactionId": "104347216672", "personName": "MMRDA", "accountNumber": null, "transferType": "UPI", "upiId": null, "bankCode": "MAHB"}, {"date": "25/10/2025", "date_iso": "2025-10-25", "description": "UPI 194557068848arma Snacks Corner", "raw": "UPI 194557068848/YESB/Karma Snacks Corner/NO REMAR", "amount": 70.0, "type": "expense", "debit": 70.0, "credit": 0.0, "balance": 8090.4, "page": "Page 2", "line": "43", "store": null, "commodity": null, "reference": "194557068848", "channel": "UPI", "transactionId": "194557068848", "personName": "Karma Snacks Corner", "accountNumber": null, "transferType": "UPI", "upiId": null, "bankCode": "MAHB"}, {"date": "25/10/2025", "date_iso": "2025-10-25", "description": "UPI 103726769203", "raw": "UPI 103726769203/ICIC/MMRDA/Pay", "amount": 10.0, "type": "expense", "debit": 10.0, "credit": 0.0, "balance": 8160.4, "page": "Page 2", "line": "42", "store": null, "commodity": null, "reference": "103726769203", "channel": "UPI", "transactionId": "103726769203", "personName": "MMRDA", "accountNumber": null, "transferType": "UPI", "upiId": null, "bankCode": "MAHB"}, {"date": "25/10/2025", "date_iso": "2025-10-25", "description": "UPI 101791519916 BHIM", "raw": "UPI 101791519916/HDFC/NPCI BHIM /BHIMCASHBACK", "amount": 2.0, "type": "income", "debit": 0.0, "credit": 2.0, "balance": 8092.4, "page": "Page 3", "line": "1", "store": null, "commodity": null, "reference": "101791519916", "channel": "UPI", "transactionId": "101791519916", "personName": "NPCI BHIM", "accountNumber": null, "transferType": "UPI", "upiId": null, "bankCode": "MAHB"}, {"date": "26/10/2025", "date_iso": "2025-10-26", "description": "UPI 101759323152", "raw": "UPI 101759323152/ICIC/MMRDA/Pay", "amount": 10.0, "type": "expense", "debit": 10.0, "credit": 0.0, "balance": 8082.4, "page": "Page 3", "line": "2", "store": null, "commodity": null, "reference": "101759323152", "channel": "UPI", "transactionId": "101759323152", "personName": "MMRDA", "accountNumber": null, "transferType": "UPI", "upiId": null, "bankCode": "MAHB"}, {"date": "27/10/2025", "date_iso": "2025-10-27", "description": "UPI 105307108654ndian Railways", "raw": "UPI 105307108654/SBIN/Indian Railways/NO REMARKS", "amount": 10.0, "type": "expense", "debit": 10.0, "credit": 0.0, "balance": 8072.4, "page": "Page 3", "line": "3", "store": null, "commodity": null, "reference": "105307108654", "channel": "UPI", "transactionId": "105307108654", "personName": "Indian Railways", "accountNumber": null, "transferType": "UPI", "upiId": null, "bankCode": "MAHB"}, {"date": "27/10/2025", "date_iso": "2025-10-27", "description": "UPI 530020003512niversity of Mumbai", "raw": "UPI 530020003512/AIRP/University of Mumbai/Pay via", "amount": 1359.18, "type": "expense", "debit": 1359.18, "credit": 0.0, "balance": 6713.22, "page": "Page 3", "line": "4", "store": null, "commodity": null, "reference": "530020003512", "channel": "UPI", "transactionId": "530020003512", "personName": "University of Mumbai", "accountNumber": null, "transferType": "UPI", "upiId": null, "bankCode": "MAHB"}, {"date": "27/10/2025", "date_iso": "2025-10-27", "description": "UPI 530020004869niversity of Mumbai", "raw": "UPI 530020004869/AIRP/University of Mumbai/Pay via", "amount": 403.18, "type": "expense", "debit": 403.18, "credit": 0.0, "balance": 6310.04, "page": "Page 3", "line": "5", "store": null, "commodity": null, "reference": "530020004869", "channel": "UPI", "transactionId": "530020004869", "personName": "University of Mumbai", "accountNumber": null, "transferType": "UPI", "upiId": null, "bankCode": "MAHB"}, {"date": "27/10/2025", "date_iso": "2025-10-27", "description": "UPI 530020007548niversity of Mumbai", "raw": "UPI 530020007548/AIRP/University of Mumbai/Pay via", "amount": 706.18, "type": "expense", "debit": 706.18, "credit": 0.0, "balance": 5603.86, "page": "Page 3", "line": "6", "store": null, "commodity": null, "reference": "530020007548", "channel": "UPI", "transactionId": "530020007548", "personName": "University of Mumbai", "accountNumber": null, "transferType": "UPI", "upiId": null, "bankCode": "MAHB"}, {"date": "28/10/2025", "date_iso": "2025-10-28", "description": "ACH Indian Clearing 0000BUN7YXM227V9AR253000319796", "raw": "ACH Indian Clearing 0000BUN7YXM227V9AR253000319796", "amount": 500.0, "type": "expense", "debit": 500.0, "credit": 0.0, "balance": 5103.86, "page": "Page 3", "line": "7", "store": null, "commodity": null, "reference": null, "channel": "1001-MUMBAI\nSERVICE BRANCH", "transactionId": null, "personName": null, "accountNumber": null, "transferType": "1001-MUMBAI\nSERVICE BRANCH", "upiId": null, "bankCode": "MAHB"}, {"date": "29/10/2025", "date_iso": "2025-10-29", "description": "UPI 103951416896", "raw": "UPI 103951416896/ICIC/MMRDA/Pay", "amount": 5.0, "type": "expense", "debit": 5.0, "credit": 0.0, "balance": 4809.86, "page": "Page 3", "line": "10", "store": null, "commodity": null, "reference": "103951416896", "channel": "UPI", "transactionId": "103951416896", "personName": "MMRDA", "accountNumber": null, "transferType": "UPI", "upiId": null, "bankCode": "MAHB"}, {"date": "29/10/2025", "date_iso": "2025-10-29", "description": "UPI 182137819268 JAYPRAKASH SHARMA", "raw": "UPI 182137819268/KKBK/SATYAM JAYPRAKASH SHARMA/NO", "amount": 500.0, "type": "expense", "debit": 500.0, "credit": 0.0, "balance": 4309.86, "page": "Page 3", "line": "11", "store": null, "commodity": null, "reference": "182137819268", "channel": "UPI", "transactionId": "182137819268", "personName": "SATYAM JAYPRAKASH SHARMA", "accountNumber": null, "transferType": "UPI", "upiId": null, "bankCode": "MAHB"}, {"date": "29/10/2025", "date_iso": "2025-10-29", "description": "UPI 103412044503", "raw": "UPI 103412044503/ICIC/BHIM/NO REMARKS", "amount": 299.0, "type": "expense", "debit": 299.0, "credit": 0.0, "balance": 4804.86, "page": "Page 3", "line": "8", "store": null, "commodity": null, "reference": "103412044503", "channel": "UPI", "transactionId": "103412044503", "personName": "BHIM", "accountNumber": null, "transferType": "UPI", "upiId": null, "bankCode": "MAHB"}, {"date": "29/10/2025", "date_iso": "2025-10-29", "description": "UPI 101815921299 BHIM", "raw": "UPI 101815921299/HDFC/NPCI BHIM /BHIMCASHBACK", "amount": 10.0, "type": "income", "debit": 0.0, "credit": 10.0, "balance": 4814.86, "page": "Page 3", "line": "9", "store": null, "commodity": null, "reference": "101815921299", "channel": "UPI", "transactionId": "101815921299", "personName": "NPCI BHIM", "accountNumber": null, "transferType": "UPI", "upiId": null, "bankCode": "MAHB"}, {"date": "30/10/2025", "date_iso": "2025-10-30", "description": "UPI 112717702539", "raw": "UPI 112717702539/ICIC/MMRDA/Pay", "amount": 5.0, "type": "expense", "debit": 5.0, "credit": 0.0, "balance": 4304.86, "page": "Page 3", "line": "12", "store": null, "commodity": null, "reference": "112717702539", "channel": "UPI", "transactionId": "112717702539", "personName": "MMRDA", "accountNumber": null, "transferType": "UPI", "upiId": null, "bankCode": "MAHB"}, {"date": "30/10/2025", "date_iso": "2025-10-30", "description": "MONTHLY SMS CHA", "raw": "MONTHLY SMS CHA", "amount": 15.0, "type": "expense", "debit": 15.0, "credit": 0.0, "balance": 4289.86, "page": "Page 3", "line": "13", "store": null, "commodity": null, "reference": null, "channel": "9999-CENTRAL OFF", "transactionId": null, "personName": null, "accountNumber": null, "transferType": "9999-CENTRAL OFF", "upiId": null, "bankCode": "MAHB"}, {"date": "30/10/2025", "date_iso": "2025-10-30", "description": "GST", "raw": "GST", "amount": 2.7, "type": "expense", "debit": 2.7, "credit": 0.0, "balance": 4287.16, "page": "Page 3", "line": "14", "store": null, "commodity": null, "reference": null, "channel": "9999-CENTRAL OFF", "transactionId": null, "personName": null, "accountNumber": null, "transferType": "9999-CENTRAL OFF", "upiId": null, "bankCode": "MAHB"}, {"date": "31/10/2025", "date_iso": "2025-10-31", "description": "UPI 100313296239 Chennai Graduate", "raw": "UPI 100313296239/SBIN/RRB Chennai Graduate/Collect", "amount": 500.0, "type": "expense", "debit": 500.0, "credit": 0.0, "balance": 3727.16, "page": "Page 3", "line": "18", "store": null, "commodity": null, "reference": "100313296239", "channel": "UPI", "transactionId": "100313296239", "personName": "RRB Chennai Graduate", "accountNumber": null, "transferType": "UPI", "upiId": null, "bankCode": "MAHB"}, {"date": "31/10/2025", "date_iso": "2025-10-31", "description": "UPI 104144095173", "raw": "UPI 104144095173/ICIC/MMRDA/Pay", "amount": 5.0, "type": "expense", "debit": 5.0, "credit": 0.0, "balance": 4282.16, "page": "Page 3", "line": "15", "store": null, "commodity": null, "reference": "104144095173", "channel": "UPI", "transactionId": "104144095173", "personName": "MMRDA", "accountNumber": null, "transferType": "UPI", "upiId": null, "bankCode": "MAHB"}, {"date": "31/10/2025", "date_iso": "2025-10-31", "description": "UPI 170020967254 NANDRAM GULDAGAD", "raw": "UPI 170020967254/ICIC/MAHESH NANDRAM GULDAGAD/NO R", "amount": 5.0, "type": "expense", "debit": 5.0, "credit": 0.0, "balance": 4277.16, "page": "Page 3", "line": "16", "store": null, "commodity": null, "reference": "170020967254", "channel": "UPI", "transactionId": "170020967254", "personName": "MAHESH NANDRAM GULDAGAD", "accountNumber": null, "transferType": "UPI", "upiId": null, "bankCode": "MAHB"}, {"date": "31/10/2025", "date_iso": "2025-10-31", "description": "UPI 174613354970 NARAYAN NAIK", "raw": "UPI 174613354970/SBIN/SHREYAS NARAYAN NAIK/NO REMA", "amount": 50.0, "type": "expense", "debit": 50.0, "credit": 0.0, "balance": 4227.16, "page": "Page 3", "line": "17", "store": null, "commodity": null, "reference": "174613354970", "channel": "UPI", "transactionId": "174613354970", "personName": "SHREYAS NARAYAN NAIK", "accountNumber": null, "transferType": "UPI", "upiId": null, "bankCode": "MAHB"}, {"date": "01/11/2025", "date_iso": "2025-11-01", "description": "UPI 154319781285ndian Railways", "raw": "UPI 154319781285/SBIN/Indian Railways/NO REMARKS", "amount": 5.0, "type": "expense", "debit": 5.0, "credit": 0.0, "balance": 2717.16, "page": "Page 3", "line": "21", "store": null, "commodity": null, "reference": "154319781285", "channel": "UPI", "transactionId": "154319781285", "personName": "Indian Railways", "accountNumber": null, "transferType": "UPI", "upiId": null, "bankCode": "MAHB"}, {"date": "01/11/2025", "date_iso": "2025-11-01", "description": "UPI 160959607727ndian Railways", "raw": "UPI 160959607727/SBIN/Indian Railways/NO REMARKS", "amount": 45.0, "type": "expense", "debit": 45.0, "credit": 0.0, "balance": 2672.16, "page": "Page 3", "line": "22", "store": null, "commodity": null, "reference": "160959607727", "channel": "UPI", "transactionId": "160959607727", "personName": "Indian Railways", "accountNumber": null, "transferType": "UPI", "upiId": null, "bankCode": "MAHB"}, {"date": "01/11/2025", "date_iso": "2025-11-01", "description": "ACH Indian Clearing 0000N99LE1U416U4O5253040994843", "raw": "ACH Indian Clearing 0000N99LE1U416U4O5253040994843", "amount": 1000.0, "type": "expense", "debit": 1000.0, "credit": 0.0, "balance": 2727.16, "page": "Page 3", "line": "19", "store": null, "commodity": null, "reference": null, "channel": "1001-MUMBAI\nSERVICE BRANCH", "transactionId": null, "personName": null, "accountNumber": null, "transferType": "1001-MUMBAI\nSERVICE BRANCH", "upiId": null, "bankCode": "MAHB"}, {"date": "01/11/2025", "date_iso": "2025-11-01", "description": "UPI 110808499854", "raw": "UPI 110808499854/KKBK/MMRDA /Pay", "amount": 5.0, "type": "expense", "debit": 5.0, "credit": 0.0, "balance": 2722.16, "page": "Page 3", "line": "20", "store": null, "commodity": null, "reference": "110808499854", "channel": "UPI", "transactionId": "110808499854", "personName": "MMRDA", "accountNumber": null, "transferType": "UPI", "upiId": null, "bankCode": "MAHB"}, {"date": "02/11/2025", "date_iso": "2025-11-02", "description": "UPI 092604026733", "raw": "UPI 092604026733/KKBK/MMRDA /Pay", "amount": 5.0, "type": "expense", "debit": 5.0, "credit": 0.0, "balance": 2667.16, "page": "Page 3", "line": "23", "store": null, "commodity": null, "reference": "092604026733", "channel": "UPI", "transactionId": "092604026733", "personName": "MMRDA", "accountNumber": null, "transferType": "UPI", "upiId": null, "bankCode": "MAHB"}], "count": 88, "metadata": {}}